title,Category,"price(""$"")",7-day sales,total_sales,total_reviews,7-day reviews,total_favorites,7-day favorites,tags,Ship From,release time,Best Seller,Etsy pick,Raving,store name,product_url
Editable Mouse Ears Name Tags Pack #1 ,Art & Collectibles > Prints > Digital Prints,5.0,20,203,31,5,143,2,"Art & Collectibles,Prints,Digital Prints",United States,2023-05-19,yes,no,no,LittleShopoSmiles,https://www.etsy.com/listing/1485270599/editable-mouse-ears-name-tags-pack-1
"Waterskiing Witches, Halloween Wall Art, Black and White Art, Vintage Wall Art, Funny Wall Art, DIGITAL DOWNLOAD, PRINTABLE Art, Large Art ",Art & Collectibles > Prints > Digital Prints,2.6,20,283,30,1,875,36,"Digital Download,Vintage Sports Print,Printable Wall Art,Vintage Wall Art,Black and White Art,Funny Wall Art,WaterSkiing Witches,Witch Wall Art,Halloween Wall Art,Halloween Wall Decor,Retro Wall Decor,Mid Century Modern,Water Sports Print",United States,2022-09-25,yes,no,no,VibrantVintagePrints,https://www.etsy.com/listing/1312266553/waterskiing-witches-halloween-wall-art
"300+ Patterns Midjourney Prompts, AI Art, Midjourney Prompt, Midjourney AI Art, Learn Midjourney, Digital Art, AI Generate, Art Print ",Art & Collectibles > Prints > Digital Prints,2.29,20,805,77,5,593,45,"print on demand,graphic design,customizable,midjourney,midjourney prompt,ai art,midjourney art,digital art,digital print,ai promt,ai prompt,pattern prompts,boho patterns",United States,2023-05-26,yes,no,no,PowerfulStyle,https://www.etsy.com/listing/1476209536/300-patterns-midjourney-prompts-ai-art
"Printable Wildflower Field Landscape Oil Painting, Vintage Farm House, Country Field Landscape Oil Painting Printable, Art Digital Download ",Art & Collectibles > Prints > Digital Prints,3.1,20,505,69,2,2033,71,"Printable Wall Art,Vintage Painting,Vintage Landscape,Wildflower Print,Field Painting,Vintage Art Print,Downloadable Print,Bedroom Art Print,Farmhouse Print,Cottage Art Print,Nature Painting,Muted Tonal Print,Warm Tone Print",United States,2023-03-03,yes,no,no,DigitallyDrawnPrints,https://www.etsy.com/listing/1429729391/printable-wildflower-field-landscape-oil
"As For Me and My House We Will Serve the Lord, DIGITAL DOWNLOAD!, Joshua 24:15, WALL Art, Jesus Art, Bible Art Verse, BibleSketches, Verse ",Art & Collectibles > Prints > Digital Prints,10.51,20,311,31,3,1749,33,"serve the Lord,Joshua,Joshua 24 15,Jesus Art,Jesus Wall Art,Bible Poster,Bible Sketches,Bible Art,me and my house,God Wall Art,my house serve Lord,Jesus Home Art,we will serve Lord",United States,2022-10-01,yes,no,no,BibleSketches,https://www.etsy.com/listing/1315974361/as-for-me-and-my-house-we-will-serve-the
"Trendy Retro Wall Art Set, Lucky You Poster, Trendy Aesthetic Print, Queen of Hearts Wall Art, Ace Card Print, Trendy Queen Funky Poster ",Art & Collectibles > Prints > Digital Prints,8.78,20,944,96,6,8901,394,"Trendy Retro Art Set,Aesthetic Art Set,Lucky You Poster,Red Ace Card Poster,Black Ace Poster,Retro Aesthetic Art,Vintage Wall Art,Playing Cards Print,Queen Funky Print,Colorful lucky Print,Lucky You Print",United States,2023-03-13,yes,no,no,InstantPrintsLibrary,https://www.etsy.com/listing/1437203461/trendy-retro-wall-art-set-lucky-you
"Gildan 5000 PNG Mockup Bundle, Transparent + White Backgrounds, All 70 Colors High Resolution, T-shirt Mockups G500 ",Art & Collectibles > Drawing & Illustration > Digital,4.5,19,28,18,1,43,10,"t-shirt mockup,gildan t-shirt,gildan mocks,softstyle,gildan softstyle,print on demand,etsy mockup,gildan tee,mockup bundle,gildan 5000,gildan 5000 mockup,gildan g500,women's mockup",United States,2023-07-03,yes,no,no,ShamelessLabels,https://www.etsy.com/listing/1501509342/gildan-5000-png-mockup-bundle
"Cycopath PNG-Halloween Sublimation Digital Design Download-bicycle png, ghost png, spooky season png, vintage png, trendy halloween png ",Art & Collectibles > Drawing & Illustration > Digital,3.8,19,141,9,0,257,12,"sublimation png,png designs,digital download,tshirt png design,png for shirts,cycopath png,ghost png,cute spooky png,halloween png,retro halloween png,girly halloween png,bicycle png,spooky season png",United States,2023-05-11,yes,no,no,ScarlowDigital,https://www.etsy.com/listing/1480085577/cycopath-png-halloween-sublimation
Digital Download | Matchbox Art Print | Bar Cart Art | Trendy Art Print | Apartment Poster | Western Art | Cute Home Decor | Printable Art ,Art & Collectibles > Prints > Digital Prints,6.0,19,490,23,3,1404,60,"art print,wall art,printable art,digital download,matchbox art,matchbox,bar cart art,trendy art print,cute art,western art,coastal cowgirl,apartment art",United States,2023-04-28,yes,no,no,WhiskeyandHoneyy,https://www.etsy.com/listing/1470763351/digital-download-matchbox-art-print-bar
Witch Coloring Pages | Crystal Coloring Page | Witch Coloring Book | Witch Aesthetic | Adult Coloring Book | Printable Coloring Pages ,Art & Collectibles > Drawing & Illustration > Digital,3.75,19,773,85,7,1278,37,"Adult Coloring Page,Adult Coloring Book,Printable Coloring,Spiritual Coloring,Grimoire Printable,Mindfulness Coloring,Witch Coloring Pages,Halloween Printable,Witch Illustration,Witch Coloring Book,Crystal Coloring,Magic Coloring",United States,2022-10-07,yes,no,no,BusyBreePrints,https://www.etsy.com/listing/1306181674/witch-coloring-pages-crystal-coloring
"Horror Characters 20oz Skinny Straight & Tapered Designs, Horror Movie Tumbler Designs, Cartoon Character Tumbler Wrap PNG, Digital download ",Art & Collectibles > Drawing & Illustration > Digital,3.66,19,1242,117,12,1358,84,"20 oz skinny tumbler,Tumbler wrap,Tumbler PNG,skinny tumbler,Cartoon Tumbler 20oz,Cartoon tumbler,Horror Movie png,Michael Halloween,jason voorhees png,freddy krueger png,Michael tumbler 20oz,Michael 20oz,20oz Jason Voorhees",United States,2023-05-29,yes,no,no,ChicGaleriaArt,https://www.etsy.com/listing/1492178337/horror-characters-20oz-skinny-straight
samsung frame tv art set of 20 | summer frame tv art | vintage landscape paintings | summer art for frame tv art | kikiandnim digital tv art ,Art & Collectibles > Prints > Digital Prints,7.5,19,142,17,2,281,33,"samsung frame tv art,summer frame tv art,vintage,landscape paintings,the frame tv art,summer tv art,art for frame tv,vintage frame tv art,farmhouse tv art,living room tv art,tv art bundle,kikiandnim,digital tv art",United States,2023-06-16,yes,no,no,KIKIANDNIM,https://www.etsy.com/ca/listing/1490331788/samsung-frame-tv-art-set-of-20-summer
"Mirrorball Print, Disco ball print, Folklore Design, Girly Wall Art, Preppy Wall Art, Retro Dorm Room Decor, Swiftie Gift ",Art & Collectibles > Prints > Digital Prints,4.75,19,650,60,2,3948,40,"girly wall art,preppy wall art,mirrorball,disco ball print,cassiedesignsstuff,TheWhimsyCommittee,reesefaithdesings",United States,2022-12-12,yes,no,no,ReeseFaithDesigns,https://www.etsy.com/listing/1368496809/mirrorball-print-disco-ball-print
Camper Earrings SVG | Engraved Camper Earring SVG | Camping Earring SVG Glowforge | Summer Earring Files Laser | Camper Earring Svg Forest ,Art & Collectibles > Drawing & Illustration > Digital,3.0,19,112,11,0,188,4,"camper earring svg,camper earrings svg,camping earring svg,camping earrings svg,glowforge earrings,summer earring svg,camping svg files,camper svg files,earring svg laser,camper svg,forest svg files,outdoor earrings svg,nature earring svg",United States,2023-05-08,yes,no,no,AlpineSkyDesigns,https://www.etsy.com/listing/1463275470/camper-earrings-svg-engraved-camper
"Taylor Poster Set of 6, Swiftie Decor, Trendy Aesthetic Wall Art, Album Cover Prints DIGITAL DOWNLOAD (6 prints) ",Art & Collectibles > Prints > Digital Prints,10.0,19,235,33,0,2021,89,"digital download,all too well,getaway car,champagne problems,folklore evermore,dorm decor wall art,college poster,taylor,eras,tour,swiftie fangirl,aesthetic mirrorball",United States,2023-05-12,yes,no,no,PleasingPrintCo,https://www.etsy.com/listing/1480297567/taylor-poster-set-of-6-swiftie-decor
"Cute Sloth Tumbler Sublimation Design, 20 oz Skinny Tumbler PNG, Floral Sloth Tumbler Wrap, Vibrant Colors, Digital Download ",Art & Collectibles > Drawing & Illustration > Digital,1.49,18,128,8,0,162,10,"tumbler png,skinny design,skinny tumbler png,tumbler wrap,sublimation designs,animal tumbler wrap,sublimation tumbler,20oz tumbler design,sloth tumbler wrap,sloth png,Sloth tumbler,sloth tumbler png,20 oz skinny design",United States,2023-03-31,yes,no,no,TumblerDesignsYY,https://www.etsy.com/listing/1451130727/cute-sloth-tumbler-sublimation-design-20
Moody Flower Painting | Printable Wall Art | Vintage Floral Wall Art | Antique Art Print | Farmhouse Wall Art | Moody Botanical Oil Painting ,Art & Collectibles > Prints > Digital Prints,2.81,18,849,52,0,1495,35,"moody flower print,printable wall art,antique art print,farmhouse wall art,moody botanical,vintage flower print,floral printable art,flower oil painting,vintage painting,digital download,French wall decor,floral wall art",United States,2022-12-26,yes,no,no,RenArtPrint,https://www.etsy.com/listing/1365265954/moody-flower-painting-printable-wall-art
Football Tumblers Designs | Football sport Designs | Football Tumbler Team Designs | 100pcs Tumblers Digital Designs Bundle -20oz 300DPI ,Art & Collectibles > Drawing & Illustration > Digital,5.05,18,998,139,7,776,31,"tumbler sublimation,sublimation designs,sublimation design,skinny tumbler,20 oz skinny tumbler,sublimation tumbler,sports tumbler,football tumbler,football designs,football team,football png,football fan gift,sports team tumblers",United States,2023-01-08,yes,no,no,PopShopTumblers,https://www.etsy.com/listing/1388690213/football-tumblers-designs-football-sport
"You RN good hands png sublimation design download, Registered Nurse png, Nursing png, Nurse life png, sublimate designs download ",Art & Collectibles > Drawing & Illustration > Digital,2.11,18,165,20,0,398,16,"nurse life png,medical instrument,sublimation design,western nurse png,nurse png,nursing png,nurse png design,nurse elements png,medical png,nurse sublimation,You RN good hands,registered nurse png,nurse sublimate",United States,2023-03-16,yes,no,no,HRASeamlessPattern,https://www.etsy.com/listing/1425841076/you-rn-good-hands-png-sublimation-design
Midjourney 3D Character Prompt | Create your own Pixar Style Character | Baby Animal AI Art | Digital Printables for Kids | Cute Kids Prompt ,Art & Collectibles > Prints > Digital Prints,3.92,18,57,10,2,59,1,"midjourney clip art,Pixar Art,Cute Kids Prompt,midjourney kids book,pixar kids png print,pixar style art,pixar pet,dreamworks movies,baby animal ai art",United States,2023-07-07,yes,no,no,Vorty,https://www.etsy.com/listing/1518653461/midjourney-3d-character-prompt-create
"All the pretty girls roll like this png sublimation design download, black woman hands png, smoking png, cannabis png, sublimate download ",Art & Collectibles > Drawing & Illustration > Digital,1.38,18,267,29,0,676,18,"black woman png,smoking weed png,afro girl png,black woman art png,black woman afro png,afro woman png,afro png,weed png,cannabis png,Marijuana png,black woman hands,black woman,smoking weed",United States,2023-04-01,yes,no,no,RammDesignStudio,https://www.etsy.com/listing/1437622242/all-the-pretty-girls-roll-like-this-png
"Woman Touches Jesus DIGITAL DOWNLOAD, Jesus Healing Bible Art, God heals Modern Bible Verse Jesus print Wall Art Bible Sketch Boho Scripture ",Art & Collectibles > Prints > Digital Prints,10.59,18,704,43,0,3252,157,"Modern Scripture,Boho Christian Art,Bible Verse Wall Art,Bible Sketches,Christian Home Decor,Bible Quote Print,Modern Bible Verse,Modern Christian Art,jesus art,bible art,Biblical wall art,jesus heals woman,bible sketch",United States,2023-03-08,yes,no,no,ProjectMadeNew,https://www.etsy.com/listing/1419539404/woman-touches-jesus-digital-download
"I'll Take 'Em Deviled PNG-Thanksgiving Sublimation Digital Design Download-deviled eggs png, png for men, mens png designs, funny png design ",Art & Collectibles > Drawing & Illustration > Digital,3.8,18,31,4,2,495,68,"sublimation png,png designs,digital download,tshirt png design,png for shirts,deviled eggs png,mens png designs,png for men,adult humor png,funny png designs,thanksgiving png,thankful png,take em deviled png",United States,2023-06-29,yes,no,no,ScarlowDigital,https://www.etsy.com/listing/1499046862/ill-take-em-deviled-png-thanksgiving
"Printable Wildflower Field Landscape Oil Painting, Vintage Farm House, Country Field Landscape Oil Painting Printable, Art Digital Download ",Art & Collectibles > Prints > Digital Prints,3.1,18,573,86,7,4415,217,"Printable Wall Art,Vintage Painting,Vintage Landscape,Wildflower Print,Field Painting,Vintage Art Print,Downloadable Print,Bedroom Art Print,Farmhouse Print,Cottage Art Print,Nature Painting,Muted Tonal Print,Warm Tone Print",United States,2023-03-28,yes,no,no,DigitallyDrawnPrints,https://www.etsy.com/listing/1434963760/printable-wildflower-field-landscape-oil
Laser Burn PNG | 3D Illusion | Engrave | Laser Ready | Digital Design File | Eagle | Flag | USA | Patriotic ,Art & Collectibles > Prints > Digital Prints,7.0,18,766,112,10,955,43,"glowforge,plaque,wall art,laser,gf5bucks,3D,illusion,wood carving,xtool,bald eagle,american flag,carved flag",United States,2023-03-02,yes,no,no,GF5Bucks,https://www.etsy.com/listing/1414420694/laser-burn-png-3d-illusion-engrave-laser
Pooh Fall Coffee Lattes Sublimation PNG JPEG FIle ,Art & Collectibles > Drawing & Illustration > Digital,1.25,18,1338,261,9,5467,121,"Cartoon Pooh,Coffee,Pooh Coffee,Pooh Latte,Pooh PNG,Pumpkin Spice,Pumpkin Spice Latte,Sublimation,Pooh JPEG",United States,2022-09-26,yes,no,no,GeauxGrafxDesigns,https://www.etsy.com/listing/1312514861/pooh-fall-coffee-lattes-sublimation-png
"BOO Ghost png, Halloween Sublimation, Spook vibes, Halloween png, Cute Ghost, DTG, Kids Halloween, sublimation design, Digital Download, ",Art & Collectibles > Prints > Digital Prints,2.54,18,59,6,1,262,44,"sublimation png,kids halloween,Halloween Boo,Halloween mickey,kids halloween png,Cute Halloween Ghost,sublimation design,spooky png,mickey mouse png",United States,2023-06-12,yes,no,no,HeliosPrint,https://www.etsy.com/listing/1501853873/boo-ghost-png-halloween-sublimation
"Halloween Fall Mockup Bundle, Boho Bella Canvas 3001 Woman Model Outdoor Mock, Thanksgiving White Black Blank Tshirt Mocks, POD Mock JPEG ",Art & Collectibles > Drawing & Illustration > Digital,1.3,18,63,16,3,32,3,"halloween mockup,bella canvas mockup,mockup bundle,fall mockup,halloween bundle,tshirt mockup bundle,trendy mockup,boho mockup bundle,thanksgiving mockup,fall model mockup,outdoor mockup,bella canvas bundle,3001 mockup bundle",United States,2023-07-28,yes,no,no,FoxyMagicMockups,https://www.etsy.com/listing/1518098626/halloween-fall-mockup-bundle-boho-bella
Retro Champagne Poster-Wall Print-Digital Download-Preppy Pink Prints-Barbie Doll Art-Vintage Doll Art-Y2K Aesthetic-Girly Bar Cart Art ,Art & Collectibles > Prints > Digital Prints,4.37,18,530,31,1,2451,85,"large wall art print,girly wall art,Digital Download,Wall Print,Y2K Aesthetic,Preppy Pink Prints,girly bar cart art,champagne posters,apartment art,dorm decor,Vintage Doll Art",United States,2023-05-20,yes,no,no,GSPrintShoppe,https://www.etsy.com/listing/1486357187/retro-champagne-poster-wall-print
Thanks for coming-Digital Prints-Wall Art Print-Typography Art-Downloadable Print-Bar Art Prints-Living Room Decor-Funny Wall Art-Bright Art ,Art & Collectibles > Prints > Digital Prints,4.86,18,406,33,1,4700,79,"printable art,downloadable print,living room print,feminist print,retro wall art,digital prints,wall art print,girly wall art,funny print,thanks for coming,typography,red typography,bar cart art",United States,2022-10-10,yes,no,no,GSPrintShoppe,https://www.etsy.com/listing/1322386781/thanks-for-coming-digital-prints-wall
SVG File. 55 American Flag USA We The People Right Constitution Veteran Army Patriotic Mega Pack Laser Wall Art hd Cricut Vector PNG Bundle ,Art & Collectibles > Drawing & Illustration > Digital,3.92,18,1533,171,3,1304,31,"american flag usa,we the people svg,cricut silhouette hd,shirt sticker poster,stencil decal tattoo,vinyl cut file png,veteran army right 2,vector patriot eagle,patriotic hunt wall,amendment laser art,soldier freedom usmc,military navy marine,engraving america us",United States,2022-12-28,yes,no,no,OutrunLights,https://www.etsy.com/listing/1366745646/svg-file-55-american-flag-usa-we-the
Light Naturals | A Light Vintage Aesthetic Set of 9 Gallery Prints for Digital Download | Neutral Tone Printable Wall Art | Cottagecore Art ,Art & Collectibles > Prints > Digital Prints,12.59,18,444,58,0,3190,71,"gallery wall prints,wall collage set,light academia art,academia aesthetic,landscape painting,pastoral artwork,antique botanical,light floral artwork,fine art prints,old artwork download,vintage art bundle,neutral tone decor,green and beige",United States,2023-01-03,yes,no,no,AnnaPrintablesCo,https://www.etsy.com/listing/1370790914/light-naturals-a-light-vintage-aesthetic
Mexican Patriotic Tumbler Wrap | Mexican Flag Tumbler Wrap | 20oz Sublimation Tumbler | PNG Straight Skinny Tumbler |Sublimation Design | ,Art & Collectibles > Drawing & Illustration > Digital,2.49,17,117,21,5,289,35,"Tumbler Wrap PNG,tumbler design,sublimation designs,skinny tumbler,sublimation tumbler,Tumbler wrap designs,tumbler png designs,png tumbler design,mexican tumbler,mexico tumbler wrap,mexico tumbler,mexico sublimation,patriotic tumbler",United States,2023-06-29,yes,no,no,Patterly,https://www.etsy.com/listing/1513159997/mexican-patriotic-tumbler-wrap-mexican
"Beatitudes Coloring Wheel, Printable Bible Verse Activity, Watercolor, Kids Bible Lesson, Memory Game, Sunday School ",Art & Collectibles > Prints > Digital Prints,4.25,17,365,54,0,326,2,"sunday school,Religious Game,bible cards kids,scripture cards kids,scripture cards,armor of god,printable activity,bible lesson kids,fruit of the spirit,days creation bible,beatitude,bible game printable,church lesson kids",United States,2022-10-29,yes,no,no,InspireGraphicDesign,https://www.etsy.com/listing/1321019308/beatitudes-coloring-wheel-printable
"2 Pets Portrait, Two Pets, Two Pets Custom Pet Portrait, Multiple Pet Portrait From Photo, Many Cat Dog Custom Portrait, Animal Art ",Art & Collectibles > Prints > Digital Prints,20.9,17,595,67,3,297,31,"Pet Portrait,Custom Pet Portrait,Cat Portrait,Dog Portrait,Pet,Pet Wall Art,Dog Painting,Custom Dog Portrait,Pet Painting,Pet Portrait Custom,Cat,Dog,Animal Painting",United States,2022-11-12,yes,no,no,ArtsifOfficial,https://www.etsy.com/listing/1330677694/2-pets-portrait-two-pets-two-pets-custom
Happy Elephant in Tub Printable Wall Art | Elephant Photo | Elephant Art | Bathroom Art Print | Digital Download | black and white ,Art & Collectibles > Prints > Digital Prints,3.99,17,593,43,3,2063,77,"elephants art,elephants print,elephants lover,bathroom decor,elephant art,downloadable art,black and white pic,safari photography,elephant wall art,digital art,elephants gift",United States,2023-01-04,yes,no,no,AnonymousPHOTO,https://www.etsy.com/listing/1371266850/happy-elephant-in-tub-printable-wall-art
"Funny English Classroom Wall Art, ELA Poster, High School English, Grammar Sign, Punctuation, Middle School Teacher Decor, Literature Poster ",Art & Collectibles > Prints > Digital Prints,3.5,17,110,16,2,321,12,"funny english,english classroom,classroom wall art,ela poster,high school english,grammar sign,punctuation,middle school,sarcastic teacher,literature poster,literary wall art,language arts decor,junior high decor",United States,2023-06-21,yes,no,no,MinMac,https://www.etsy.com/listing/1508099229/funny-english-classroom-wall-art-ela
"Its Okay To Feel All The Feels SVG, PNG,  Love Yourself Svg, Its Okay To Not Be Okay Svg, You Matter Svg, Self Love Svg, Retro Svg ",Art & Collectibles > Drawing & Illustration > Digital,2.76,17,910,76,1,1327,36,"self love svg,body positive svg,self love club svg,positive svg,mental health svg,positive quote svg,hippie svg,aesthetic svg,reminder png,mental health png,retro svg,anxiety svg,anxiety png",United States,2022-12-17,yes,no,no,SVGsociety,https://www.etsy.com/listing/1373277963/its-okay-to-feel-all-the-feels-svg-png
"Halloween SVG Png,Spooky Babes Svg,Salem SVG png,Witchy Designs,Witch SVG,Vintage png,Spooky Svg Png,Halloween Designs,Spooky Season Svg ",Art & Collectibles > Drawing & Illustration > Digital,2.99,17,227,14,2,420,31,"Sublimation Design,Halloween PNG,Spooky Squad png,Spooky Season Png,Spooky,graphic design,halloween svg,halloween cricut,salem svg,witch svg,trendy halloween svg,spooky babes png,skelleton png",United States,2023-05-29,yes,no,no,lunansoldesigns,https://www.etsy.com/listing/1492091215/halloween-svg-pngspooky-babes-svgsalem
"football player svg, Football name svg, football svg, football team svg png, American Football Player Svg, Football Shirt svg, Half Player ",Art & Collectibles > Prints > Digital Prints,4.95,17,239,21,8,436,147,"split monogram svg,name frame,last name svg,family sign svg,monogram frame svg,split frame svg,monogram frame,frame svg,family name svg,split monogram frame,svg mongram,monograme,footbal ekg svg",United States,2022-11-01,yes,no,no,Sofiamastery2,https://www.etsy.com/listing/1336783637/football-player-svg-football-name-svg
"Set of 3 Matisse Prints, Henri Matisse Print Set Of 3, Matisse Flower Market Poster, Matisse Print Digital, Botanical Print Set, Matisse ",Art & Collectibles > Prints > Digital Prints,4.5,16,398,24,2,2597,74,"Matisse Print,Henri Matisse Print,Matisse Poster,Matisse Print Art,Digital Art Prints,Matisse Wall Art,Set of 3 Prints,Set of 3 Matisse,Matisse Print Set,Henri Matisse Set,Gallery Wall Art,Set of 3 Digital Art,Exhibition Poster",United States,2022-09-22,yes,no,no,DreamDigitalPrintArt,https://www.etsy.com/listing/1295992358/set-of-3-matisse-prints-henri-matisse
"Kindle Lock Screen, Lizzie McGuire kindle Lock Screen, booked and busy kindle ",Art & Collectibles > Drawing & Illustration > Digital,2.0,16,140,47,1,197,14,"Kindle,Lock screen,Lizzie McGuire,Kindle lock screen,EPUB file,Custom Lock Screen",United States,2023-07-04,yes,no,no,DriftingDogwoodDsgns,https://www.etsy.com/listing/1502086574/kindle-lock-screen-lizzie-mcguire-kindle
Bar Art Print Liquor Poster Give It Your Best Shot Print Modern Bar Cart Wall Art Vodka Poster Tequila Print Digital Download 1 Print ,Art & Collectibles > Prints > Digital Prints,3.2,16,436,16,2,2406,94,"bar cart wall art,bar cart art,bar cart decor,bar wall art,alcohol prints,drink prints,apartment decor,trendy bar art,cute kitchen art,spirits poster,funny alcohol print,bar art pun,shots wall art",United States,2023-05-04,yes,no,no,FloralsPrints,https://www.etsy.com/listing/1460558284/bar-art-print-liquor-poster-give-it-your
Christmas Ornament SVG Bundle | Glowforge Ornament Files | Deer Bear Wolf Moose Ornament SVG Laser | Ornaments SVG Glowforge | Woodland ,Art & Collectibles > Drawing & Illustration > Digital,5.0,16,166,15,1,369,16,"ornament svg files,ornament svg bundle,christmas ornaments,glowforge ornaments,ornament svg laser,deer ornament svg,woodland ornament,glowforge files,christmas svg files,ornaments svg files,forest ornament svg,ornament files,laser ornament svg",United States,2022-11-04,yes,no,no,AlpineSkyDesigns,https://www.etsy.com/listing/1325529336/christmas-ornament-svg-bundle-glowforge
"Coffee scrubs and rubber gloves 20oz tumbler png sublimation design download, western tumbler png, Nurse tumbler png, sublimate download ",Art & Collectibles > Drawing & Illustration > Digital,1.9,16,257,23,1,304,10,"digital download,sublimation design,western tumbler png,20oz skinny tumbler,tumbler templates,nurse tumbler png,western nurse png,nursing png,nurse png,glitter tumbler png,wooden tumbler png,coffee scrubs png,rubber gloves png",United States,2023-02-20,yes,no,no,NeoWesternDigitAlart,https://www.etsy.com/listing/1421817261/coffee-scrubs-and-rubber-gloves-20oz
"Coastal Cowgirl Wall Art Newspaper Print Wall Art, New York News | Western Wall Art Vintage Bar Cart, Dorm Retro Surfing, Printable Wall Art ",Art & Collectibles > Prints > Digital Prints,8.89,16,632,19,2,1709,169,"Dorm room decor,Trendy newspaper,Bar cart wall art,Hot Girl prints,Vintage Wall art,Trendy Wall prints,Coastal Wall art,Coastal Poster,Coastal Cowgirl,New York Newspaper,Newspaper Print,Beachy wall art",United States,2023-07-22,yes,no,no,petitPaperies,https://www.etsy.com/listing/1514162050/coastal-cowgirl-wall-art-newspaper-print
"Movie Mega SVG Bundle, Magic Wizard Svg, Bundle Layered SVG, Svg Files for Cricut ",Art & Collectibles > Prints > Digital Prints,1.58,16,531,48,9,288,32,"wizard svg,magic svg bundle,Movie Svg,Movie Bundle svg,wizard hat svg,Mega Bundle Svg,Wizard Svg Bundle,Magic Svg,Movie mega bundle",United States,2023-03-11,yes,no,no,GoldenEggByRed,https://www.etsy.com/listing/1421686826/movie-mega-svg-bundle-magic-wizard-svg
Halloween Gallery Wall Set | Halloween Art Prints | Halloween Decoration | Halloween printable wall art | Digital Download | Spooky Wall Art ,Art & Collectibles > Prints > Digital Prints,8.25,16,64,13,6,363,101,"printable wall art,gallery wall art set,digital wall art,minimalist wall art,Halloween decor,Halloween wall art,Halloween home decor,Halloween prints,vintage Halloween,Halloween art prints,pumpkin decor,boho Halloween art,ghost print",United States,2023-07-19,yes,no,no,JMHolidayPrintables,https://www.etsy.com/listing/1512002786/halloween-gallery-wall-set-halloween-art
