title,Category,"price(""$"")",7-day sales,total_sales,total_reviews,7-day reviews,total_favorites,7-day favorites,tags,Ship From,release time,Best Seller,Etsy pick,Raving,store name,product_url
"Blue Willow wall art, vintage landscape painting, Chinoiserie printable art ",Art & Collectibles > Prints > Digital Prints,4.99,11,117,9,0,726,43,"Vintage painting,antique painting,vintage landscape,circaartcollection,warm tone wall art,Blue Willow wall art,landscape painting,Chinoiserie print,blue art print,blue and white,French wall decor,French painting",United States,2023-03-23,yes,no,no,CircaArtCollection,https://www.etsy.com/listing/1444705275/blue-willow-wall-art-vintage-landscape
Jesus PNG Tshirt Design Sublimation Designs Downloads Christian PNG Files for Sublimation DTF Prints Summer png He Makes All Things New ,Art & Collectibles > Drawing & Illustration > Digital,4.94,11,295,13,0,682,30,"Jesus PNG,Tshirt Design,Sublimation Designs,Christian Designs,Sublimation Download,Popular Trendy Png,retro png,Bible Clipart,dtf prints,love like Jesus,Faith png,religious png,retro summer png",United States,2023-05-19,yes,no,no,HarperPrintCo,https://www.etsy.com/listing/1471483324/jesus-png-tshirt-design-sublimation
Moody Landscape Painting Printable Wall Art | Antique Oil Painting | Dark Cottagecore Landscape Print | Vintage Moody Wall Art Digital Print ,Art & Collectibles > Prints > Digital Prints,2.81,11,359,16,1,468,30,"moody landscape,landscape painting,printable wall art,antique oil painting,dark cottagecore,moody wall art,moody painting,dark academia print,vintage print,gothic printable art,rustic wall decor,birds on branch,digital download",United States,2023-03-13,yes,no,no,RenArtPrint,https://www.etsy.com/listing/1422897062/moody-landscape-painting-printable-wall
"Nice Butt Wall Print, Funny Toilet Poster,  Retro Bathroom Wall Decor, Digital Download Print, Downloadable Prints, Large Printable Art ",Art & Collectibles > Prints > Digital Prints,5.85,11,386,17,2,944,29,"cute butt print,body positivity art,trendy wall print,aesthetic room decor,y2k apartment decor,funky wall art,dorm room decor,funny bathroom decor,funny toilet poster,retro wall print,nice butt poster,cool wall print",United States,2022-12-13,yes,no,no,FunkyFridayPrintsCo,https://www.etsy.com/listing/1369760153/nice-butt-wall-print-funny-toilet-poster
Hallothanksmas Sublimation PNG JPEG Files ,Art & Collectibles > Drawing & Illustration > Digital,1.0,11,380,42,7,413,52,"Halloween,Thanksgiving,Christmas,Hallothanksmas png,Lattes,Holiday Lattes,Halloween Latte,Thanksgiving latte,Christmas Latte,Sublimation,PNG File,Jpeg File",United States,2022-09-25,yes,no,no,GeauxGrafxDesigns,https://www.etsy.com/listing/1298482692/hallothanksmas-sublimation-png-jpeg
New York City Retro Art Print - INSTANT DOWNLOAD - Trendy College Apartment Decor - Wall Art Poster - City Girl Art - Bar Cart Decor ,Art & Collectibles > Prints > Digital Prints,8.24,11,460,30,0,5015,161,"Digital download,trendy art print,retro magazine art,city girl aesthetic,printable,college apartment,wall decor,bar cart decor,trendy college art,weekend art,nyc print,unframe art print,Pink city poster",United States,2023-01-07,yes,no,no,jennaprintz,https://www.etsy.com/listing/1387548227/new-york-city-retro-art-print-instant
"Freak in the Sheets SVG, Halloween Svg, Halloween Ghost SVG pooky Vibes SVG, Halloween Svg, Freaky Ghosts, Ghost Svg, Funny Halloween png ",Art & Collectibles > Drawing & Illustration > Digital,0.84,11,301,25,4,410,45,"halloween svg,halloween png,ghost svg,ghost png,halloween pin up svg,cute halloween svg,freak in the sheets,funny halloween svg,funny halloween png,halloween silhouette,horror svg,spooky season,scary svg",United States,2022-10-08,yes,no,no,decemberArtslab,https://www.etsy.com/listing/1321153543/freak-in-the-sheets-svg-halloween-svg
"Woodland Baby Animal Gallery Wall Set of 9 Prints, Nursery Decor, PRINTABLE Art, Nursery Wall Art, Forest Animal, Baby Room Art | AR6510 ",Art & Collectibles > Prints > Digital Prints,14.99,10,235,23,0,857,47,"PRINTABLE art,Nursery wall art,Deer print,Nursery forest print,Woodland decor,Woodland animal art,Cute animal prints,Baby animal prints,Baby animal nursery,gender neutral,baby shower,Gallery Wall Set",United States,2023-03-22,yes,no,no,NobleCrowShop,https://www.etsy.com/listing/1444635521/woodland-baby-animal-gallery-wall-set-of
"Educational Posters, 12 Homeschool Prints, Montessori Classroom Decor, Toddler Playroom, Neutral Kids Nursery, Boho Playroom Wall Art Print ",Art & Collectibles > Prints > Digital Prints,9.36,10,690,39,4,1094,42,"educational posters,educational set,neutral kids decor,neutral classroom,playroom decor,alphabet poster,neutral alphabet,shapes poster,nursery prints,girl room decor,set of 12 prints,alphabet numbers,montessori toddler",United States,2023-01-10,yes,no,no,LarkPrintables,https://www.etsy.com/listing/1375656700/educational-posters-12-homeschool-prints
Mightier Than The Waves Art Print Minimalist Christian Wall Art Ocean Poster Psalm 93:4 Print Bible Scripture Art Digital Download 1 Print ,Art & Collectibles > Prints > Digital Prints,3.2,10,214,13,0,663,55,"digital prints,christian print,bible poster,bible passage,bible quote,heart poster,pastor appreciation,gift for christian,bible scripture,jesus art,god poster,book of psalms,psalm 93",United States,2023-05-20,yes,no,no,FloralsPrints,https://www.etsy.com/listing/1471762894/mightier-than-the-waves-art-print
"Open When Letters Envelope Cards for College Student or Going Away Gift, PRINTABLE | Open When Labels, College Notes, College Care Package ",Art & Collectibles > Prints > Digital Prints,4.24,10,41,14,0,115,0,"open when labels,college student gift,college care package,open when letters,open when envelopes,open when cards,college notes,college gifts,back to college gift,going away gift,open when college,college printable,digital download",United States,2023-04-09,yes,no,no,LovelyLanePrints,https://www.etsy.com/listing/1443170852/open-when-letters-envelope-cards-for
"Retro Halloween png, Halloween smiling face png, Halloween sublimation design, spooky vibes png, leopard pumpkin png, digital download png ",Art & Collectibles > Drawing & Illustration > Digital,2.6,10,424,16,0,882,44,"Retro Halloween png,spooky sublimation,Leopard pumpkin png,Checkered lightning,Spooky pumpkin png,Leopard ghost png,Trendy Halloween,Spooky vibes png,halloween shirt png,Retro fall png,Halloween 2023 png,Womans graphic tee,Retro smile face png",United States,2023-06-07,yes,no,no,AzAddiDesigns,https://www.etsy.com/listing/1484021790/retro-halloween-png-halloween-smiling
"Female Disco Ball Head Poster, Funky Disco 70s Print, Black White Wall Art, Digital Artwork, Luxury Mirrorbal Printable, Girly Dorm Room Art ",Art & Collectibles > Prints > Digital Prints,8.24,10,616,18,0,2469,55,"Funky Disco Ball,Disco Ball Wall Art,Black White Poster,Funky Poster Print,Retro Disco Ball Art,Digital Artwork,Dorm Room Decor,Girly Wall Art,Disco Mirrorbal Art,Vintage Mirrorbal,Disco Party 70s,Female Disco Ball,Luxury Female Print",United States,2023-03-14,yes,no,no,CelebrityPrint,https://www.etsy.com/listing/1423778266/female-disco-ball-head-poster-funky
Gildan 18000 Sand Mockup Gildan Sand Sweatshirt Flat Lay Mockup Model Mockup Sand Gildan 18000 Mockup Bundle gildan 18000 sand mock ups sand ,Art & Collectibles > Prints > Digital Prints,0.75,10,638,41,14,229,56,"Hoodie Mockup,Model Mockup,sand mockup,oversized sand,gildan 18000,sand crewneck,sand gildan 18000,gildan 18000 sand,trendy sweatshirt,mock ups,mock up tshirt,sand sweatshirt,sand back mockup",United States,2023-04-24,yes,no,no,MockstarBoutique,https://www.etsy.com/listing/1453613636/gildan-18000-sand-mockup-gildan-sand
"Cute Smart And A Little Bit Dramatic Png, Unicorn Png, Unicorn Design, Cute Unicorn Png, Dramatic Png, Sublimation Designs, Digital Download ",Art & Collectibles > Drawing & Illustration > Digital,1.0,10,613,48,6,599,75,"instant download,sublimation design,unicorn png,cute unicorn png,unicorn png design,Cute smart png,colorful unicorn png,baby unicorn png,unicorn sublimation,dramatic png,hand drawn unicorn,unicorn sublimate,western dramatic png",United States,2023-07-06,yes,no,no,BRTDesignShop,https://www.etsy.com/listing/1503556852/cute-smart-and-a-little-bit-dramatic-png
Midjourney Prompts for Black Women | Afro American Women Digital Art | Black Girl Prompts AI Art | Ebony Women Wall Art | AI Art Generator ,Art & Collectibles > Prints > Digital Prints,4.2,10,146,22,1,213,10,"ai art,midjourney prompts,digital download,midjourney,digital art,digital prints,ai,black women art,black art,ai art print,black girl prompts,ai art guide,ai art generator,midjourney tutorial,Digital AI Prompts,AI Image Generation,Black Women Prompts,AI Art Styles,black women digital,ebony women art",United States,2023-06-24,yes,no,no,Vorty,https://www.etsy.com/listing/1495599338/midjourney-prompts-for-black-women-afro
"20oz Skinny Tumbler Christian Bible Verse Affirmations Sublimation Design Templates, Straight PNG Digital Download, Positive + Inspirational ",Art & Collectibles > Drawing & Illustration > Digital,1.78,10,600,54,1,643,10,"20 oz tumbler,20 oz skinny,tumbler designs Png,20oz skinny tumbler,skinny tumbler wraps,sublimation tumbler,seamless tumbler png,inspirational quotes,Motivational quotes,bible verse tumbler,christian tumbler,affirmations tumbler,christian affirmatio",United States,2022-11-02,yes,no,no,BaileyDesignedCo,https://www.etsy.com/listing/1337328395/20oz-skinny-tumbler-christian-bible
"Four Pumpkin Embroidery Design, Pumpkin Machine Embroidery Files, Autumn Pumpkin Embroidery Design, Fall Embroidery File - Digital Downloads ",Art & Collectibles > Fiber Arts > Embroidery,3.19,10,106,11,0,221,25,"Pumpkin Embroidery,Autumn fall Pumpkin,Autumn Embroidery,fall embroidery,halloween embroidery,embroidery pes files,embroidery patterns,Hello Pumpkin,Mini Halloween,Western embroidery,Four Pumpkin,four Howdy Pumpkin",United States,2022-09-26,yes,no,no,PremioEmbroidery,https://www.etsy.com/listing/1313039559/four-pumpkin-embroidery-design-pumpkin
Procreate Brushes GLITTER Brush Procreate Sparkle Brush Procreate Lettering Brush Set Shimmer Glitter Brush Strokes Procreate Glitter Brush ,Art & Collectibles > Drawing & Illustration > Digital,4.5,10,985,104,5,701,24,"procreate brushes,procreate brush,glitter brushes,procreate glitter,procreate sparkle,sparkle brushes,procreate brush set,procreate lettering,procreate script,lettering brushes,brush glitter,artworkbygabrielle,digital brush",United States,2023-02-09,yes,no,no,ArtworkbyGabrielle,https://www.etsy.com/listing/1398717256/procreate-brushes-glitter-brush
"Fall wall Art, Autumn Gallery wall Set of 16, Autumn Printable wall Art, Fall Decor, Fall Nature Poster, Thanksgiving Decor, Farmhouse print ",Art & Collectibles > Prints > Digital Prints,9.99,10,118,8,1,361,35,"fall wall art,fall decor,printable wall art,digital download,Gallery wall set,Fall print,Fall landscape print,Photography print,gallery wall prints,Halloween decor,thanksgiving decor,Autumn print",United States,2022-10-26,yes,no,no,NYCArtPrint,https://www.etsy.com/listing/1319367582/fall-wall-art-autumn-gallery-wall-set-of
Pebbles the Turtle Lovey Crochet Amigurumi Pattern ,Art & Collectibles > Fiber Arts > Crochet,5.5,10,228,30,0,814,15,"crochet turtle,crochet turtle lovey,turtle crochet,turtle lovey,turtle nursery,crochet lovey,lovey pattern,crochet pattern,amigurumi,turtle amigurumi,turtle pattern,granny hexagon,Pebbles the Turtle",United States,2022-09-23,yes,no,no,SarahDeeCrochet,https://www.etsy.com/listing/1296918118/pebbles-the-turtle-lovey-crochet
Western Art Prints Vintage Cowboy Art Wild West Art Retro Cowgirl Prints Western Gallery Wall Set Blue Wall Art Digital Download Set of 18 ,Art & Collectibles > Prints > Digital Prints,12.5,10,70,7,0,259,16,"printable art,southwestern decor,vintage western art,cowboy wall art,western art print,howdy poster,yeehaw poster,cowboy boot art,horse print,cowboy artwork,southern home art,art for ranch home",United States,2023-06-26,yes,no,no,FloralsPrints,https://www.etsy.com/listing/1511231027/western-art-prints-vintage-cowboy-art
"Sea Turtle, Cute Sea Turtle clipart, Ocean Animals Sea Turtle PNG, Sea Turtle png, Digital Download, sublimation design ",Art & Collectibles > Drawing & Illustration > Digital,1.38,10,224,20,1,162,3,"Sea Turtle,Sea Turtle png,Digital Download,sublimation design,Cute Sea,Turtle clipart,watercolor turtle,cute turtle clipart,sea turtle printable,sea turtle design,baby turtle,sea turtle designs",United States,2023-04-15,yes,no,no,RammDesignStudio,https://www.etsy.com/listing/1461490159/sea-turtle-cute-sea-turtle-clipart-ocean
"Taylor We Never Go Out Of Style Poster, Style Groovy Wall Art, Music Lyrics Print, Trendy Dorm Room Decor, Digital Artwork Girly Wall Art ",Art & Collectibles > Prints > Digital Prints,4.95,10,235,10,0,629,32,"Trendy Poster Print,Dorm Room Decor,Instant Download,Girly Wall Art,Swiftie Merch Gift,Music Lyrics Print,Funky Taylor Poster,1989 Album Song,Taylor Style Print",United States,2023-03-07,yes,no,no,CelebrityPrint,https://www.etsy.com/listing/1418549642/taylor-we-never-go-out-of-style-poster
"Trendy Hot Girls Print Newspapers Wall Art, New York News | That Girl Vintage Bar Cart, It Girl Dorm Retro Wall Art | Instant Download ",Art & Collectibles > Prints > Digital Prints,7.91,10,212,9,0,505,58,"retro newspaper art,Girly wall art,Dorm room decor,Trendy newspaper,IT girl print,Bar cart wall art,Hot Girl prints,Vintage Wall art,Trendy Wall prints,Dorm wall art,New York Newspaper,Vogue Hot Girls",United States,2023-06-27,yes,no,no,petitPaperies,https://www.etsy.com/listing/1497744388/trendy-hot-girls-print-newspapers-wall
No sew Sea Turtle | Amigurumi | Crochet ,Art & Collectibles > Prints > Digital Prints,2.5,10,116,23,3,206,10,"crochet sea turtle,no sew sea turtle,crochet sea animals,amigurumi sea animal,no sew Amigurumi,no sew pattern,no sew crochet,crochet turtles,amigurumi turtles,crochet turtle,Amigurumi turtle,crochet,amigurumi sea turtl",United States,2023-07-07,yes,no,no,ChassityAnnDesigns26,https://www.etsy.com/listing/1504246524/no-sew-sea-turtle-amigurumi-crochet
"Bad Bitch svg, Sage And Hood, Spiritual Clipart, Digital Download, Since you like to start shit, Funny SVG, Start shit svg, Jumper Cable ",Art & Collectibles > Drawing & Illustration > Digital,3.0,10,940,79,4,1639,18,"Digital Download,Silhouette Cameo,Cricut Design,Hazy Q Designs,Bad Bitch SVG,Sage that Shit,Jumper Cables,Bad Bitch Energy,Stop playin' svg,Don't try me svg,I'm Sage and Hood,Wish M'fer would,Start Shit svg",United States,2023-03-24,yes,no,no,HazyQDesigns,https://www.etsy.com/listing/1431484346/bad-bitch-svg-sage-and-hood-spiritual
Set of 2 Mexico Wall Art | Mexican Art | Mexico Painting | Digital Download Print | Mexico Wall Decor | Wall Art Bundle | Talavera Art Print ,Art & Collectibles > Prints > Digital Prints,7.49,10,196,12,1,1032,29,"mexican art,mexican decor,mexican wall art,mexican art for wall,mexico art,mexican art print,mexican home decor,talavera art,mexican wall decor,mexican,talavera wall art,modern mexican art,printable wall art,digital download,wall art bundle,painting bundle,mexico painting,mexico print,Home Decor,mexico,set of 2",United States,2023-05-10,yes,no,no,ArtisticMindscapes,https://www.etsy.com/listing/1464835328/set-of-2-mexico-wall-art-mexican-art
Mexican Flower Poster Mexico Wall Art Mexico Travel Poster Pink Floral Wall Art Mexican Poster Mexico Art Print Digital Download 1 Print ,Art & Collectibles > Prints > Digital Prints,3.2,10,359,11,0,1058,53,"mexico city,mexico city art,mexico gifts,digital prints,printable wall art,mexico art,gallery wall art,mexican decor,mexico,floral poster,modern mexico art,dorm decor,cute mexican art",United States,2023-04-08,yes,no,no,FloralsPrints,https://www.etsy.com/listing/1442815546/mexican-flower-poster-mexico-wall-art
"Mary with Alabaster Flask, DIGITAL  PRINT!!, John 12:3, Jesus Art, Bible Poster, Bible WALL art, Jesus Print, Bible Verse Art, Feet Washing ",Art & Collectibles > Prints > Digital Prints,4.67,10,112,18,0,401,15,"biblesketches,biblesketch,jesus art,christian modern,bible verse wall art,bible art,bible poster,bible verse print,jesus washing feet,mary and jesus,images bible verses,alabaster flask,Luke 7 38",United States,2023-05-17,yes,no,no,BibleSketches,https://www.etsy.com/listing/1483580943/mary-with-alabaster-flask-digital-print
"Retro Mascot PRINTABLE Poster, Let's Get This Bread, Motivational Kitchen Wall Art, Vintage Home Office Decor, Digital Download ",Art & Collectibles > Prints > Digital Prints,5.7,10,111,18,3,574,30,"lets get this bread,office decor,funny poster,soovia janis prints,office wall decor,office prints,motivational poster,fun office prints,cubicle decor,bread poster,breakfast buddies,bread mascot,motivational decor,kitchen art,office art,home office decor,funny wall art,vintage wall decor,let's get this bread,positive vibes,bread character",United States,2023-03-27,yes,no,no,ElisaPrints,https://www.etsy.com/listing/1433627186/retro-mascot-printable-poster-lets-get
"Horror Halloween png, retro Halloween sublimation design, horror squad Png, trendy Halloween shirt design, scary movie png, digital download ",Art & Collectibles > Drawing & Illustration > Digital,3.2,10,90,7,1,242,8,"Retro Halloween png,Horror movie png,Horror halloween png,Trendy halloween png,Halloween shirt,Cute halloween png,Fall png design,Horror sublimation,Spooky vibes png,Womens graphic tee,Digital download,Scary movie png,Halloween 2023 png",United States,2023-06-15,yes,no,no,AzAddiDesigns,https://www.etsy.com/listing/1503716641/horror-halloween-png-retro-halloween
35 Ready-Made .epub Kindle Lock Screens | DIGITAL DOWNLOAD | Kindle MUST be ad-free! ,Art & Collectibles > Drawing & Illustration > Digital,5.0,10,1850,714,40,1168,13,"kindle,kindle paperwhite,kindle lock screen,custom kindle",United States,2023-06-28,yes,no,no,TheLitHomebody,https://www.etsy.com/listing/1498606698/35-ready-made-epub-kindle-lock-screens
"Retro Flowers Checkered PNG Sublimation - Vintage Shirt Design DTG, Grunge Smile Face Daisy, Boho 70's Groovy Floral Dtf Transfer, Screen ",Art & Collectibles > Drawing & Illustration > Digital,4.5,10,252,10,0,687,30,"sublimation designs,groovy sublimation,vintage sublimation,checkered png files,retro flowers,retro floral png,Retro sweatshirt png,checkered flowers,kids shirt png,adorable shirt png,checkered shirt png,70's shirt design,groovy hoodie back",United States,2023-04-23,yes,no,no,KindPandaStudio,https://www.etsy.com/listing/1467587531/retro-flowers-checkered-png-sublimation
"Hip-Hop SVG,2pac, Big, SnoopDogg, Ice Cube, Silhouette SVG , Hip Hop png - Svg for cricut ",Art & Collectibles > Drawing & Illustration > Digital,1.39,10,206,19,2,421,39,"80s BABY SVG,70S NOSTALGIA,POPULAR SVG,Tupac Shirt,Digital Downloads,90s svg,90s hiphop,friends svg,snoop dogg svg,2pac svg,tupac svg,Old School Svg,Old hip hop",United States,2023-04-30,yes,no,no,TheDreamedDesign,https://www.etsy.com/listing/1457769912/hip-hop-svg2pac-big-snoopdogg-ice-cube
"Fall Floral png,Fall design,Fall Png for Sublimation,Vintage Fall Design,Autumn Sublimation,Thanksgiving,October PNG,Pimpkin Patch png ",Art & Collectibles > Drawing & Illustration > Digital,2.99,10,307,18,1,601,44,"Fall Vibes png,Vintage Fall Design,Autumn Sublimation,Fall Png for,Sublimation,trendy fall design,fall leaves png,fall screen print,FALL FLORAL PNG,thanksgiving png,Fall POD design,trendy autumn design,Pimpkin Patch png",United States,2023-05-20,yes,no,no,lunansoldesigns,https://www.etsy.com/listing/1486067611/fall-floral-pngfall-designfall-png-for
Tennessee d original Designer fb exclusive ,Art & Collectibles > Drawing & Illustration > Digital,5.0,10,722,64,2,805,27,"png,simply smooth design,Football,Home sweet home,Dog,Tennessee football,simplysmoothdesign",United States,2022-10-30,yes,no,no,SimplySmoothDesignCo,https://www.etsy.com/listing/1321494076/tennessee-d-original-designer-fb
"Mallard duck hunting name plate | Sublimation Design | Digital Download | Women’s, Kids Shirt PNG ",Art & Collectibles > Prints > Digital Prints,3.5,10,363,15,4,549,18,"sublimation,kids,tshirt,PNG,digital download,name plate,mallard,duck,duck hunting,boy",United States,2023-04-13,yes,no,no,SouthernPearlsStudio,https://www.etsy.com/listing/1460275959/mallard-duck-hunting-name-plate-o
"American Whiskey Tumbler design, wooden barrel background sublimation designs, whiskey barrel custom designs digital download, 20 oz skinny ",Art & Collectibles > Drawing & Illustration > Digital,2.1,10,297,26,1,367,39,"sublimation design,tumbler sublimation,sublimation tumbler,sublimation designs,funny tumbler,whiskey label,alcohol tumblers,tumbler template,american whisky,awesome american,4th july tumbler,wooden tumbler png,tumbler commercial",United States,2023-05-26,yes,no,no,PopShopTumblers,https://www.etsy.com/listing/1490346583/american-whiskey-tumbler-design-wooden
"Henri Matisse, Landscape at Collioure | Modern Painting | Abstract Art Print | Colorful Poster Print | Printable Wall Art | Digital Download ",Art & Collectibles > Prints > Digital Prints,3.0,10,365,23,2,881,31,"downloadable print,matisse poster,printable wall art,digital download,geometric print,eclectic print,matisse print,matisse painting,henri matisse,colorful wall decor,modern art print,abstract print,colorful print",United States,2023-01-07,yes,no,no,BienArtSpace,https://www.etsy.com/listing/1373466222/henri-matisse-landscape-at-collioure
"Afro Messy Bun Unapologetically Dope Virgo Png Sublimation Design, Black Woman Png, Messy Bun Virgo Png, Afro Virgo Png, Digital Download ",Art & Collectibles > Drawing & Illustration > Digital,2.35,10,142,14,1,206,13,"instant download,black women png,afro american png,juneteenth png,black power png,black people png,afro messy bun png,black history png,1865 vibes png,Dope Virgo png,afro virgo png,messy bun virgo png,black virgo png",United States,2022-09-19,yes,no,no,HRASeamlessPattern,https://www.etsy.com/listing/1294507358/afro-messy-bun-unapologetically-dope
"Hookin Ain't Easy  PNG, Digital Download, Sublimation Download, Fishing, Rod, Bobbers, Snarky, Men, Man, Guy, Male, Fish, DIGITAL ",Art & Collectibles > Drawing & Illustration > Digital,3.35,10,77,6,0,402,12,"sublimation,png,svg,digital,download,digital download,summer,fish,fishing,man,men,Mullet,Hookin Ain't Easy",United States,2023-04-03,yes,no,no,SDDByGinaandMindy,https://www.etsy.com/listing/1439338052/hookin-aint-easy-png-digital-download
"Unicorn 12oz Kids Flip Top Sippy Cup Tumbler Wrap, 12oz Straight Tumbler Sublimation PNG, Girl's Sparkly Unicorn Pretty Tumbler Wrap Design ",Art & Collectibles > Drawing & Illustration > Digital,0.96,10,733,60,8,387,25,"Sublimation PNG,Tumbler Sublimation,12oz tumbler wrap,Kids tumbler wrap,Sippy cup tumbler,Kids tumbler png,12oz tumbler png,Kids tumbler design,Unicorn tumbler wrap,Sparkly tumbler wrap,Childrens cup png,Girl's tumbler png,Little girl's png",United States,2023-05-17,yes,no,no,MagicMangoStudios,https://www.etsy.com/listing/1483991875/unicorn-12oz-kids-flip-top-sippy-cup
"Set of 6 Taylor Prints, Bestseller Gallery Posters, Trendy Bar Cart, Dorm Room Decor, Wall Art ",Art & Collectibles > Prints > Digital Prints,24.48,10,611,40,1,6026,38,"indie wall decor,funky poster print,printable wall art,instant download art,funky digital art,aesthetic wall art,Taylor gallery wall,Girly Preppy prints,Funky Girly Wall Art,retro aesthetics,taylor prints,set of 6 taylor",United States,2023-01-14,yes,no,no,HoneyIslandStudio,https://www.etsy.com/listing/1379184362/set-of-6-taylor-prints-bestseller
"dtf designs for shirt, sublimate designs for shirt, sublimation png for shirt, t shirt designs, hip hop png,lips png, png file for sublimate ",Art & Collectibles > Drawing & Illustration > Digital,1.77,9,885,77,6,806,21,"Sublimation designs,Png for sublimation,Downloads for shirts,abstract png,png for shirt,sublimation design,t shirt designs,png for sublimate,dtf designs,shirt designs,dtf png,graphic png,thrifty creators",United States,2023-03-18,yes,no,no,ThriftyCreators,https://www.etsy.com/listing/1426964794/dtf-designs-for-shirt-sublimate-designs
"Tigers PNG, Colorful Cheetah Print, School Spirit, Team Spirit, Digital Gile, Sublimation Download, DTF ",Art & Collectibles > Drawing & Illustration > Digital,5.0,9,125,11,0,350,0,"Tigers png,School spirit png,Team spirit png,Digital File png,Cheetah print png,Leopard print png,Sublimation download,Sublimation png,Dtf png",United States,2023-03-08,yes,no,no,CouncilRockCreations,https://www.etsy.com/listing/1419324010/tigers-png-colorful-cheetah-print-school
Funny Motherhood SVG PNG Rock It Motherhood Funny Mothers Day Svg Funny Mom Svg Trendy Mom Png Retro Mom Svg Sarcastic Mom Front and Back ,Art & Collectibles > Drawing & Illustration > Digital,3.06,9,819,45,3,1297,23,"Funny Motherhood SVG,Retro motherhood png,Trendy Mom Png,mom quotes svg,Sarcastic Mom Svg,funny mom svg,mom cricut designs,mom sublimation,skeleton mom svg,sassy mom svg,mom life svg,Retro Mother's Day,popular mom svg",United States,2023-05-16,yes,no,no,Joy7design,https://www.etsy.com/listing/1469224758/funny-motherhood-svg-png-rock-it
"T-shirt designs bundle , hip hop design bundle , rock design bundle , bikers design , rock bands t-shirts , hip hop t-shirt ",Art & Collectibles > Drawing & Illustration > Digital,4.65,9,434,35,1,598,38,"hip hop designs,bootleg png,bootleg design png,rock designs,rock band designs,motorcycle design,biker design,rappers design,men designs,t-shirt design png,bundle design,hip hop png,metal bands designs",United States,2023-01-18,yes,no,no,Raevy,https://www.etsy.com/listing/1381883906/t-shirt-designs-bundle-hip-hop-design
