title,Category,"price(""$"")",7-day sales,total_sales,total_reviews,7-day reviews,total_favorites,7-day favorites,tags,Ship From,release time,Best Seller,Etsy pick,Raving,store name,product_url
Fall Wall Decor Printable Pumpkin Still Life Painting Rustic Fall Art Vintage Autumn Wall Print Halloween Autumn Decor Thanksgiving Print ,Art & Collectibles > Prints > Digital Prints,2.8,187,842,87,15,1776,170,"rustic fall decor,autumn print,fall wall art,pumpkin wall art,farmhouse fall print,autumn decor,fall wall decor,earth tone decor,farmhouse decor,printable wall art,digital print,thanksgiving print,fall season decor",United States,2023-06-25,yes,no,no,IndiePixels,https://www.etsy.com/listing/1496079328/fall-wall-decor-printable-pumpkin-still
"Personalized floral Stitch png sublimation design download, custom name Stitch png, cute Stitch png, sublimate designs download ",Art & Collectibles > Drawing & Illustration > Digital,2.54,179,609,39,4,330,15,"instant download,sublimation design,stitch png,stitch png design,cute stitch png,floral stitch png,hand drawn stitch,personalized stitch,floral png,stitch character png,custom name stitch,stitch movie png,stitch sublimate",United States,2023-05-11,yes,no,no,AdoDesignShop,https://www.etsy.com/listing/1465743388/personalized-floral-stitch-png
"Halloween Sublimation Designs Bundle Png, Halloween Png Bundle, Halloween Designs Bundle, Sublimation Designs Downloads, Digital Download ",Art & Collectibles > Drawing & Illustration > Digital,1.99,150,352,31,14,597,131,"Sublimation Designs,Halloween png,Happy Halloween Png,Bad Witch Vibes Png,halloween shirt png,halloween vibes png,halloween design,pumpkin sublimation,halloween bundle png,sublimation bundle,png design bundle,png bundle,It's Spooky Season",United States,2023-07-12,yes,no,no,MintyCoffeeArtStore,https://www.etsy.com/listing/1507436090/halloween-sublimation-designs-bundle-png
"The Ultimate 100 Farmhouse Fonts Bundle, Cursive Font Bundle, Script Fonts, Canva Font, Procreate Fonts, Commercial Fonts, Calligraphy Font ",Art & Collectibles > Prints > Digital Prints,2.0,132,846,90,21,643,132,"Calligraphy Font,Font Bundle,Script Font,Crafting Font,Cricut Font,Canva Fonts,Procreate Fonts,Commercial Use,Fonts for Cricut,Farmhouse Font,Cursive Font,wedding font,handwriting font",United States,2023-07-22,yes,no,no,MyDesignKingdom,https://www.etsy.com/listing/1528209267/the-ultimate-100-farmhouse-fonts-bundle
Digital Download Horror / Halloween  20 oz Skinny  Tumbler Wrap Sublimation Design Sublimation PNG Designs Instant Download ,Art & Collectibles > Drawing & Illustration > Digital,1.5,131,1797,223,16,1693,60,"Art & Collectibles,Drawing & Illustration,Digital",United States,2023-06-13,yes,no,no,Trio3D,https://www.etsy.com/listing/1487914768/digital-download-horror-halloween-20-oz
"Floral Ghost Digital Print, Dark Romantic Ghost, Floral Ghost Download Print, Ghost Spooky Decor Alt Wall Art Halloween JPG 01 ",Art & Collectibles > Drawing & Illustration > Digital,4.26,131,378,44,17,1767,525,"Cute Ghost Art,Boo Ghost Print,Funny Ghost Poster,Spooky Wall Art,Haunted Decor Wall,Spooky Room Decor,Adorable Creepy Art,Moody Ghost Art,Quirky Ghost Art,Horror Art Poster,A Ghost Story,Ghost halloween,Ghost Flower",United States,2023-07-24,yes,no,no,EuartdecoPrints,https://www.etsy.com/listing/1515472032/floral-ghost-digital-print-dark-romantic
Just A Girl Who Loves Horror Digital Download Horror / Halloween  20 oz Skinny  Tumbler Wrap Sublimation Design PNG Designs Instant Download ,Art & Collectibles > Drawing & Illustration > Digital,1.42,116,1739,216,16,1744,52,"Art & Collectibles,Drawing & Illustration,Digital",United States,2023-06-17,yes,no,no,Trio3D,https://www.etsy.com/listing/1491011922/just-a-girl-who-loves-horror-digital
"Women Eating Pasta on Lake, Black and White Art, Vintage Wall Art, Funny Art, Pasta Picnic on Lake, Picnic on Lake, DOWNLOAD, PRINTABLE Art ",Art & Collectibles > Prints > Digital Prints,3.25,99,1702,158,12,6095,253,"Digital Download,Printable Wall Art,Vintage Wall Art,Black and White Art,Funny Wall Art,Retro Wall Decor,Women Eating Pasta,Spaghetti Wall Art,Old Photo,Pasta Picnic on Lake,Pasta on Lake,Women Friends,Floating Pasta Lunch",United States,2023-01-30,yes,no,no,VibrantVintagePrints,https://www.etsy.com/listing/1405835059/women-eating-pasta-on-lake-black-and
"Cat Ghost Embroidery Design, Four Halloween Ghost Cat Embroidery Design, Halloween Cat Machine Embroidery Files, Boo Ghost Kitten Embroidery ",Art & Collectibles > Fiber Arts > Embroidery,3.19,99,814,88,11,1581,91,"Halloween Cats,Сute ghost cat,Cat Ghost embroidery,Black Cat embroidery,Halloween embroidery,embroidery pes files,four Spooky cats,Boo Ghosts cats,Ghost embroidery,pumpkin embroidery,Ghost cat embroidery,spooky witch cat,Halloween dog ghost",United States,2022-09-27,yes,no,no,PremioEmbroidery,https://www.etsy.com/listing/1299741048/cat-ghost-embroidery-design-four
samsung frame tv art | halloween frame tv art | vintage ghosts | the frame tv art | spooky art for frame tv | kikiandnim | digital download ,Art & Collectibles > Prints > Digital Prints,3.2,93,312,33,10,483,119,"samsung frame tv art,living room tv art,halloween tv art,spooky decor,fall decor,the frame tv art,digital download,vintage ghosts,halloween decor,halloween,frame tv art,vintage landscapes,kikiandnim",United States,2023-07-28,yes,no,no,KIKIANDNIM,https://www.etsy.com/listing/1517839984/samsung-frame-tv-art-halloween-frame-tv
"Halloween Candy Dome SVG Bundle, Halloween Candy Holder SVG, Candy Ornaments SVG, Chocolate holder svg, Party Favor, Trick or Treat Gifts ",Art & Collectibles > Prints > Digital Prints,1.57,86,173,18,10,224,86,"candy dome ornaments,candy ornament svg,paper craft cut file,dome ornament svg,candy holder svg,candy party favors,trick or treat craft,halloween party gift,halloween ornament,halloween candy svg,Ghost candy dome,halloween candy dome,Halloween craft svg",United States,2023-08-06,yes,no,no,SVGplugDz,https://www.etsy.com/listing/1524108514/halloween-candy-dome-svg-bundle
"500+ T-shirt Designs Midjourney Prompts, AI Art, Midjourney Prompt, Midjourney AI Art, Learn Midjourney, Digital Art, AI Generate, Art Print ",Art & Collectibles > Prints > Digital Prints,2.45,84,2245,244,14,1567,91,"t-shirt design,print on demand,graphic design,customizable,creative,midjourney,midjourney prompt,ai art,midjourney art,digital art,digital print,ai prompt,midjourney guide",United States,2023-05-13,yes,no,no,PowerfulStyle,https://www.etsy.com/listing/1481412877/500-t-shirt-designs-midjourney-prompts
"Horror Character SVG, Horror SVG, Chibi Horror Svg, Halloween Svg, Cute Horror Svg, Horror png, Cute Halloween Svg, Horror Cut Files ",Art & Collectibles > Drawing & Illustration > Digital,1.87,79,255,30,14,238,67,"Horror SVG,halloween svg,Horror Character SVG,Horror PNG,Halloween PNG,cute Horror svg,Chibi horror Svg,Horror Cut Files,Cute Halloween Svg,Horror Cricut,Halloween clipart,Horror friends svg,Horror Birthday",United States,2023-08-02,yes,no,no,LittleLovelyMermaid,https://www.etsy.com/listing/1535606985/horror-character-svg-horror-svg-chibi
"Gildan 18000 Fall Mockup Bundle, G18000 Crewneck Thanksgiving Collection, Trendy Halloween Shop Bundle, Popular Unisex Sweatshirt Mock-ups ",Art & Collectibles > Drawing & Illustration > Digital,6.47,74,84,22,5,66,21,"trendsetter mockups,whole shop,fall mockup bundle,gildan 18000,crewneck sweatshirts,trendy halloween,spooky season,pumpkin thanksgiving,oversized tshirt,pullover model,sports grey ash,dark heather sand,white black orange",United States,2023-08-14,yes,no,no,TrendsetterMockups,https://www.etsy.com/listing/1529524450/gildan-18000-fall-mockup-bundle-g18000
Christmas Mockup Blank White Round Ceramic Christmas Ornament Mockup Bundle Tree Ornament Mockup Christmas Mock ups Canva Mock up Bundle ,Art & Collectibles > Photography > Color,0.75,73,452,89,15,186,30,"mock ups,mock up bundle,mockup bundle,ornament mockup,canva mockup,digital mockup,digital download,ornament mock ups,tree ornament,christmas mockup,holiday mockup,mockup ornament,ornament mock up",United States,2023-07-13,yes,no,no,MockstarBoutique,https://www.etsy.com/listing/1522255463/christmas-mockup-blank-white-round
"custom couple portrait, couple drawing, couple painting, faceless portrait print, Engagement portrait print , Engagement photo painting gift ",Art & Collectibles > Prints > Digital Prints,3.33,69,1152,396,25,1211,68,"Gift for him,boyfriend gift,couple art print,faceless print,faceless portrait,couple faceless,faceless drawing,faceless painting,couple drawing,couple painting,Engagement portrait,Engagement photo,paintint gift",United States,2023-04-15,yes,no,no,EmmaDigitalStudio,https://www.etsy.com/listing/1461977631/custom-couple-portrait-couple-drawing
Christmas Mockup Blank White Round Ceramic Christmas Ornament Mockup Bundle Tree Ornament Mockup Christmas Mock ups Canva Mock up Bundle ,Art & Collectibles > Photography > Color,0.75,67,359,68,11,112,14,"mock ups,mock up bundle,mockup bundle,ornament mockup,canva mockup,digital mockup,digital download,ornament mock ups,tree ornament,christmas mockup,holiday mockup,mockup ornament,ornament mock up",United States,2023-06-02,yes,no,no,MockstarBoutique,https://www.etsy.com/listing/1480461638/christmas-mockup-blank-white-round
"Breast Cancer SVG PNG Bundle, Pink Awareness Ribbon Svg, Breast Cancer Awareness Instant Download Digital, Fight Cancer Quote Svg ",Art & Collectibles > Drawing & Illustration > Digital,2.52,67,188,20,7,495,100,"breast,cancer awareness svg,fuck cancer shirt,ribbon svg,cancer svg,cancer survivor svg,breast cancer,cancer ribbon svg,awareness svg,pink ribbon svg,cancer fight svg,breast cancer png,cancer svg bundle",United States,2023-06-30,yes,no,no,Giftsheld,https://www.etsy.com/listing/1499804734/breast-cancer-svg-png-bundle-pink
"Ultimate Mockup Mega Bundle - High-quality mockups of popular shirts like Bella Canvas, Gildan, and Comfort Colors. ",Art & Collectibles > Drawing & Illustration > Digital,29.99,66,1214,320,17,1076,23,"whole shop bundle,tshirt mockup boho,shirt mockup retro,whole shop mockup,mockup tshirt black,pod mock up model,bella canvas mockups,gildan 18000 mockup,gildan 5000,Bella canvas 3001,comfort colors 1717,next level,cc1717 crewneck",United States,2023-03-27,yes,no,no,TrendsetterMockups,https://www.etsy.com/listing/1433546988/ultimate-mockup-mega-bundle-high-quality
"Cozy Season PNG, Cozy Sublimation Design, Thanksgiving Png, Fall Sublimation Design, Fall Png, Halloween png, Autumn Sublimation, Retro png ",Art & Collectibles > Prints > Digital Prints,2.97,64,99,10,4,651,117,"Cozy Season PNG,fall png,Cozy Sublimation,Cozy Png,Cute fall png,Autumn Sublimation,Halloween png,png sublimation,sublimation design,Thanksgiving Png,Autumn Png Cute fall,fall sublimation,retro fall png",United States,2023-08-03,yes,no,no,HeliosPrint,https://www.etsy.com/listing/1536782313/cozy-season-png-cozy-sublimation-design
Coffee Cup Mockup Black Handle Mug Mockup Tumbler Mock up Tumbler Mockup Canva Blank Mug Mock Ups Halloween Mockup Fall Mockup Black Mug ,Art & Collectibles > Photography > Color,0.75,63,292,58,11,134,33,"mug mockup,coffee mug mockup,11oz mug mockup,coffee cup mockup,mug mock up,coffee mug mock up,coffee cup mock up,black mug mockup,black coffee mug,halloween mockup,tumbler mock up,mock ups,tumbler mockup canva",United States,2023-05-25,yes,no,no,MockstarBoutique,https://www.etsy.com/listing/1489334817/coffee-cup-mockup-black-handle-mug
"Cat Ghost Embroidery Design, Halloween Witch Cat Embroidery Design, Halloween Cats, Pumpkin Bat Cats Digitizing Machine Embroidery Design ",Art & Collectibles > Fiber Arts > Embroidery,3.19,63,128,12,3,336,17,"Сute ghost cat,Cat Ghost embroidery,Pumpkin cat ghost,Black Cat embroidery,Halloween embroidery,embroidery pes files,Spooky witch cats,Ghost embroidery,ghost four pumpkins,pumpkin embroidery,Ghost cat embroidery,Halloween Cats,ghost dog zero",United States,2022-10-09,yes,no,no,PremioEmbroidery,https://www.etsy.com/listing/1307544826/cat-ghost-embroidery-design-halloween
Bella Canvas Mockup White Bella Canvas 3001 Mockup Tshirt Mockup Bundle Fall Mockup Halloween Mockup Model Mockup Print on Demand Mock ups ,Art & Collectibles > Photography > Color,0.75,62,247,49,1,123,4,"bella canvas 3001,mock ups,mock up bundle,mockup bundle,white bella canvas,bella canvas white,halloween mockup,fall mockup,tshirt mockup,shirt mockup,bella canvas mockup,model mockup,print on demand",United States,2023-06-22,yes,no,no,MockstarBoutique,https://www.etsy.com/listing/1494399772/bella-canvas-mockup-white-bella-canvas
"Retro Pink Daisy and Ghosts Painting, Cottagecore Wildflowers Pink Daisy Ghost Printable Art Print, Dark Academia, Cute Halloween Home Decor ",Art & Collectibles > Prints > Digital Prints,4.5,58,164,19,4,839,112,"halloween printable,halloween art print,cute ghost printable,cute ghost art print,ghost painting,cute ghost painting,spooky art print,vintage cottagecore,ghost with daisies,daisy ghost print,dark academia,retro ghost print,pink daisy print",United States,2023-07-25,yes,no,no,PaperCanoeCo,https://www.etsy.com/listing/1530544571/retro-pink-daisy-and-ghosts-painting
"Halloween SVG Bundle, Thanksgiving Svg Png, Gift Idea svg, Witch svg, Ghost svg, Halloween Shirt Svg, Spooky Vibes Boo Svg, Cut Files Cricut ",Art & Collectibles > Drawing & Illustration > Digital,5.91,57,158,20,5,179,53,"halloween glass cup,christmas gift women,christmas gift ideas,halloween png bundle,disneyland svg files,stitch svg bundle,mickey mouse svg,halloween toy story,halloween svg",United States,2023-08-11,yes,no,no,SVGDigitalBundle,https://www.etsy.com/listing/1527658300/halloween-svg-bundle-thanksgiving-svg
vintage halloween decor | 5 VINTAGE HALLOWEEN PRINTS | ghosts decor | spooky wall art | halloween home decor | kikiandnim | digital prints ,Art & Collectibles > Prints > Digital Prints,10.29,57,152,17,2,1315,65,"halloween decor,halloween,halloween prints,halloween wall art,halloween print,kikiandnim,halloween poster,halloween art,halloween printable,ghost print,vintage,vintage halloween,prints,ghosts decor,spooky wall art,halloween home decor,decorations,fall wall art,digital prints,printable wall art",United States,2023-06-30,yes,no,no,KIKIANDNIM,https://www.etsy.com/listing/1513549643/vintage-halloween-decor-5-vintage
Beetle Juice Horror / Halloween Digital Download  20 oz Skinny  Tumbler Wrap Sublimation Design Sublimation PNG Designs Instant Download ,Art & Collectibles > Drawing & Illustration > Digital,1.5,57,1112,138,8,1170,35,"Beetle Juice,Horror,Design,Tumble SVG PNG",United States,2023-06-06,yes,no,no,Trio3D,https://www.etsy.com/listing/1482913574/beetle-juice-horror-halloween-digital
"Nurse With Fall Element Png Sublimation Design, Nurse Png, Hello Fall Png, Fall Nurse Png, Fall Vibes Png, Nurse Life Png, Digital Download ",Art & Collectibles > Drawing & Illustration > Digital,2.54,56,198,11,2,148,11,"instant download,sublimation design,western nurse png,nursing png,nurse clipart,nurse life png,leopard nurse png,nurse sublimation,nurse png design,fall png,fall nurse png,fall pumpkin png,nurse equipments png",United States,2022-10-24,yes,no,no,AdoDesignShop,https://www.etsy.com/listing/1331763401/nurse-with-fall-element-png-sublimation
Decadent Young Woman | Woman Portrait | Vintage Wall Art | Emerald Green Art | After the Dance | Moody Wall Decor | PRINTABLE Art #214 ,Art & Collectibles > Prints > Digital Prints,3.25,55,2483,229,1,8583,322,"Digital Download,Printable Art,Woman Portrait,Vintage Wall Art,Moody Wall Decor,Emerald Green Art,Vintage Woman Print,Victorian Woman Art,Antique Wall Decor,Dark Aesthetic Art,Dark Academia Art,Decadent Young Woman,After the Dance",United States,2022-11-22,yes,no,no,VibrantVintagePrints,https://www.etsy.com/listing/1352672873/decadent-young-woman-woman-portrait
Christmas Be Gone - Funny 20 oz Skinny Tumbler Wrap Design Sublimation PNG Designs Straight Tumbler ONLY Instant Download ,Art & Collectibles > Drawing & Illustration > Digital,2.5,54,501,52,8,872,59,"Bitch Spray,bitch be gone,funny tumbler,bitch tumbler,bitches tumbler,20 oz tumbler,Christmas be gone,christmas tumbler,grinch tumbler,scrooge tumbler,bumble tumbler,jack tumbler,tumbler wrap",United States,2023-07-27,yes,no,no,DaisyBlingShop,https://www.etsy.com/listing/1531850291/christmas-be-gone-funny-20-oz-skinny
"Black girl magic png sublimation design download, black women png, fashion women png, afro png, sublimate designs download ",Art & Collectibles > Drawing & Illustration > Digital,1.38,54,521,67,0,940,30,"black women png,black queen png,black girl magic png,black woman png,afro american png,afro women png,afro fashion woman,fashion woman png,afro woman design",United States,2023-05-05,yes,no,no,RammDesignStudio,https://www.etsy.com/listing/1475319671/black-girl-magic-png-sublimation-design
Gallery Wall Prints SET Halloween Printable Art Gallery Wall Gothic Halloween Collage Wall Art Vintage Halloween Gothic Style Dark Academia ,Art & Collectibles > Prints > Digital Prints,12.53,54,118,11,8,544,178,"halloween poster,halloween printable,halloween art prints,halloween wall decor,set of nine,halloween gallery,vintage halloween,gothic decor,spooky halloween,victorian halloween,dark academia decor,whimsigoth decor,dark academia",United States,2023-08-21,yes,no,no,IndiePixels,https://www.etsy.com/listing/1534684824/gallery-wall-prints-set-halloween
"Positive Affirmations 20 oz Skinny Tumbler Sublimation Design Digital Download PNG Instant DIGITAL ONLY, Inspirational Butterfly Tumbler ",Art & Collectibles > Drawing & Illustration > Digital,2.57,52,308,25,2,314,56,"20 oz skinny,skinny tumbler,tumbler design,sublimation tumbler,sublimation skinny,skinny design,20oz skinny,20 oz tumbler,tumbler wrap,sublimation design,affirmation tumbler,motivational tumbler,butterfly tumbler",United States,2023-07-25,yes,no,no,BaileyDesignedCo,https://www.etsy.com/listing/1515794864/positive-affirmations-20-oz-skinny
Christmas Mockup Blank White Round Ceramic Christmas Ornament Mockup Bundle Tree Ornament Mockup Christmas Mock ups Canva Mock up Bundle ,Art & Collectibles > Photography > Color,0.75,52,216,31,5,59,9,"mock ups,mock up bundle,mockup bundle,ornament mockup,canva mockup,digital mockup,digital download,ornament mock ups,tree ornament,christmas mockup,holiday mockup,mockup ornament,ornament mock up",United States,2023-07-05,yes,no,no,MockstarBoutique,https://www.etsy.com/listing/1502517602/christmas-mockup-blank-white-round
"Fall Wall Decor Printable Pumpkin Still Life Painting, Rustic Fall Art, Vintage Autumn Wall Print, Halloween Autumn Decor Thanksgiving Print ",Art & Collectibles > Prints > Digital Prints,2.49,51,156,20,10,298,121,"autumn decor,autumn print,digital print,earth tone decor,fall season decor,fall wall art,fall wall decor,farmhouse decor,farmhouse fall print,printable wall art,pumpkin wall art,rustic fall decor,thanksgiving print",United States,2023-08-14,yes,no,no,PetalsPrintsDesign,https://www.etsy.com/listing/1529756448/fall-wall-decor-printable-pumpkin-still
Customizable Anime Girl Premade Vtuber (endless customization+rgb slider!) **READ DESC** ,Art & Collectibles > Drawing & Illustration > Digital,25.0,50,2498,699,7,4072,37,"twitch,vtuber,premade vtuber,stream,custom vtuber,customizable vtuber,twitch girl,kawaii",United States,2023-01-09,yes,no,no,azuyani,https://www.etsy.com/listing/1374909566/customizable-anime-girl-premade-vtuber
"Beach Tropical PNG, Christian Sublimation Design, Spirit Lead Me Shirt Design, Ocean Wave Bible Verse Digital Download, Vintage Faith DTF ",Art & Collectibles > Drawing & Illustration > Digital,3.0,49,120,9,1,217,12,"Christian,Sublimation Design,Spirit Lead Me,Shirt Design,Ocean Wave,Bible Verse,Digital Download,trendy,Ocean Sunset,scripture,Beach Tropical PNG,Vintage Faith DTF,Summer Christian",United States,2023-06-01,yes,no,no,TheSweetDownload,https://www.etsy.com/listing/1494365381/beach-tropical-png-christian-sublimation
Retro Christmas png bundle Howdy Santa Clause Sleigh Feelin Jolly Merry Mama Cozy Season Cold Outside Jingle bell rock Hot Cocoa Vibe smiley ,Art & Collectibles > Drawing & Illustration > Digital,2.0,49,177,14,3,274,82,"Christmas png,retro png,Christmas shirt,merry christmas png,retro christmas png,holiday png,Christmas png Bundle,merry mama png,Tis the Season,Hot Cocoa,santa claus png,christmas svg,christmas svg bundle",United States,2023-08-02,yes,no,no,PinkBaloonDesign,https://www.etsy.com/listing/1535956639/retro-christmas-png-bundle-howdy-santa
"Set Of 48 Educational Posters, Homeschool Prints, Montessori Classroom Decor, Neutral Kids Decor, Toddler Playroom Decor, Digital FILES,girl ",Art & Collectibles > Prints > Digital Prints,8.0,48,2829,236,4,5986,96,"Set Of 48,Educational Posters,Homeschool Prints,Neutral Kids Decor,girl PRINTS,Montessori Classroom,CLASSROOM Decor,Toddler Playroom,PLAYROOM Decor,GIRLS BEDROOM ART,GIRLS WALL ART,GIRLS WALL DECOR,LEARNING PRINTS",United States,2022-09-23,yes,no,no,ArtPrintsFactory,https://www.etsy.com/listing/1297149530/set-of-48-educational-posters-homeschool
"Fall Scarecrow  20 oz Skinny Tumbler Sublimation Design, Instant Digital Download PNG,  Sunflower Tumbler Wrap ",Art & Collectibles > Drawing & Illustration > Digital,1.98,48,356,49,11,418,46,"3d tumbler design,tumbler wrap,3d tumbler wrap,tumbler design,sublimation design,skinny tumbler wrap,tumbler wrap PNG,fall tumbler wrap,sunflower tumbler,pumpkin tumbler wrap,scarecrow tumbler,farm tumbler wrap,tumbler for kids",United States,2023-07-19,yes,no,no,TheUrbanArtisanCo,https://www.etsy.com/listing/1512090962/fall-scarecrow-20-oz-skinny-tumbler
Midjourney AI Prompts for Tumblers | Canva Tumbler Mockup | AI Tumbler Design | Sublimation Designs for Tumblers | Tumbler Wrap Bundle ,Art & Collectibles > Prints > Digital Prints,5.05,48,166,21,0,135,8,"ai tumbler design,midjourney tumblers,sublimation designs,ai art generator,tumbler wraps,tumbler wrap bundle,digital ai art,midjourney prompts,canva tumbler mockup,ai prompts tumblers,prompts for tumblers,ai sublimation wrap,prompt for ai art",United States,2023-07-16,yes,no,no,Vorty,https://www.etsy.com/listing/1524329523/midjourney-ai-prompts-for-tumblers-canva
Gildan 64000 Mockup Black Gildan 64000 Mockup Bundle Gildan 64000 Mock Up Mens Halloween Mockup Black Fall Mockup Shirt Mockup Gildan Mockup ,Art & Collectibles > Photography > Color,0.75,46,153,36,7,72,11,"gildan 64000 mockup,gildan 64000 mock up,tshirt mockup,gildan 64000,gildan mockup,gildan 5000 mockup,mockup bundle,mock up bundle,mock ups,shirt mockup,male model mockup,mens gildan 64000,64000 mockup mens",United States,2023-08-07,yes,no,no,MockstarBoutique,https://www.etsy.com/listing/1524892078/gildan-64000-mockup-black-gildan-64000
"60+ Manana sera bonito png, karol g mana sera bonito download, manana sera bonito digital download,karol g digital,karol g png,karol g album ",Art & Collectibles > Drawing & Illustration > Digital,2.64,45,635,71,5,332,14,"karol g download,manana sera bonito,karol g png,karol g svg,karol bichota,karol g,bichota png,Mañana será bonito,bichota,sera bonito png,karol g png bundle,karol g album,karol manana png",United States,2023-05-07,yes,no,no,CloverDesignUS,https://www.etsy.com/listing/1462559186/60-manana-sera-bonito-png-karol-g-mana
Gildan Sand 18000 Mockup | Gildan Sand Sweater Mock up | Oversized Sweatshirt Model Mockup | Front Gildan Sand G180 Mockup | Cozy Boho Chic ,Art & Collectibles > Prints > Digital Prints,3.36,45,677,109,12,460,47,"mockup,model mock up,gildan mock up,gildan sweatshirt,gildan 18000,cozy studio sweater,mockup bundle,crewneck mock up,sand sweatshirt,oversized sweater,mock ups,printful sweater,oversized sand mock",United States,2023-04-05,yes,no,no,MocksalaMode,https://www.etsy.com/listing/1440701418/gildan-sand-18000-mockup-gildan-sand
Gildan 18000 Mockup Bundle | G180 Group Oversized Sweater | Model Mockup Bundle | Gildan Sweatshirt Mock Ups | Crewneck Bundle | Cozy Boho ,Art & Collectibles > Prints > Digital Prints,12.33,45,679,161,10,632,49,"aesthetic bundle,shop sale bundle,Studio Mockup Bundle,whole shop bundle,sweater mock bundle,G18000 mockup bundle,cozy sweat bundle,Model Mockups 180,sand sweatshirt,oversized sweaters,crewneck mock up,gildan mock bundle,sweatshirt mocks",United States,2023-04-05,yes,no,no,MocksalaMode,https://www.etsy.com/listing/1454468097/gildan-18000-mockup-bundle-g180-group
"KG svg, eps, Bichota svg, Pink Hair, Mañana Será Bonito SVG, Bichota Season, Karol g Sublimation, La bichota svg ",Art & Collectibles > Drawing & Illustration > Digital,3.99,44,434,63,7,390,31,"Karol G,New Album,Mañana Será Bonito,High Quality,Bichota,Season,Manana Sera Bonito,png,svg,eps,Ready to Print",United States,2023-08-01,yes,no,no,DahliaTees,https://www.etsy.com/listing/1521156476/kg-svg-eps-bichota-svg-pink-hair-manana
"Land of the Free Because of the Brave 20 oz Skinny Tumbler Sublimation Design Digital Download PNG Instant DIGITAL ONLY, America Tumbler ",Art & Collectibles > Drawing & Illustration > Digital,2.57,42,610,57,3,335,5,"20 oz skinny,skinny tumbler,tumbler design,sublimation tumbler,sublimation skinny,skinny design,20oz skinny,20 oz tumbler,tumbler wrap,sublimation design,patriotic tumbler,america tumbler,land of the free png",United States,2023-05-17,yes,no,no,BaileyDesignedCo,https://www.etsy.com/listing/1483890515/land-of-the-free-because-of-the-brave-20
