title,"price(""$"")",7-day sales,total_sales,total_reviews,7-day reviews,total_favorites,7-day favorites,tags,Ship From,release time,Best Seller,Etsy pick,Raving,store name,product_url
Fluffy Slippers With Customized Title + Name - Bridesmaid Proposal - Bride to Be Gift - Getting Ready Bridal Party Slippers - Bridal Shower ,9.9,298,1469,259,48,888,82,"bridesmaid slippers,bride slippers,bridal slippers,slippers,bridesmaids slippers,wedding slippers,bridesmaid slipper,mrs slippers,fuzzy slippers,cozy slippers,birthday gift mom,spa slippers,personalized shoes,custom name,mama slippers,bridal party,bridesmaid proposal,bridal shower gift,maid of honor gift,Mrs and name",United States,2023-05-23,yes,no,no,strongconfidentYOU,https://www.etsy.com/listing/1473710424/fluffy-slippers-with-customized-title
"Rustic Personalized Wedding Cake Topper, Custom Script Cake Topper for Wedding, Mr and Mrs Cake Toppers ",12.45,147,482,130,36,573,71,"wedding cake topper,personalized cake,custom cake topper,rustic cake topper,gold cake topper,toppers for wedding,name cake topper,Mr and Mrs cake,boho cake topper,last name topper,gold caketopper,couple cake topper",United States,2023-06-28,yes,no,no,TheLocalKrafter,https://www.etsy.com/listing/1498101980/rustic-personalized-wedding-cake-topper
Custom Bride Robe | Satin with Lace Trim Robe | Bride Getting Ready Robe | White Bride Robe | Wedding Day Robe | Custom Satin Robe (EB3260P) ,14.0,122,1122,120,14,350,15,"bride robe,mrs robe,mrs,custom,personalized,bride gift,bride gift ideas,bridal shower gift,for bride,bride to be,future mrs,lace,last name",United States,2023-06-02,yes,no,no,ModParty,https://www.etsy.com/listing/1480964366/custom-bride-robe-satin-with-lace-trim
"Mother of the Bride Handkerchief from the Bride, Wedding Handkerchief from Daughter, Mother of the Bride Gift from Bride, Wedding Gift Mom ",19.98,79,525,98,13,726,96,"mother of bride gift,mother of the bride,personalized gift,printed handkerchief,wedding handkerchief,wedding gift for mom,wedding gift mother,gift from daughter,mom wedding gift,custom wedding gift,mother wedding gift,gift from bride,wedding hankerchief",United States,2023-06-27,yes,no,no,LoavesFishFellowship,https://www.etsy.com/listing/1497358634/mother-of-the-bride-handkerchief-from
"Groomsman 11oz Whiskey Glass, Engraved Old Fashion, Groomsmen Gift Idea, Personalized Groomsman - Best Man Gift, Wedding Shot Glasses ",9.94,76,435,100,18,565,62,"father of the groom,father of the bride,wedding favors,groomsman gift,groomsmen gift,Groomsmen proposal,Bachelor party,Wedding party gifts,Custom wedding gift,Best Man Gifts,personalized whiskey,custom whiskey glass,wedding shot glass",United States,2023-06-01,yes,no,no,CARVELITA,https://www.etsy.com/listing/1494314991/groomsman-11oz-whiskey-glass-engraved
Personalized Officiant Whisky Label/Officiant Gift/Officiant Proposal/Officiant Gift for Men/Officiant Wine Label/Gift for Wedding Officiant ,3.49,72,1059,241,17,630,10,"wine label,wine bottle label,label template,Groomsman Proposal,Proposal Card,Gift For Him,Wedding Officiant,Whisky Labels,Officiant Gift Idea,Officiant Duties,Will you marry us,champagne  label",United States,2023-03-31,yes,no,no,TheSpiritedLabels,https://www.etsy.com/listing/1436985244/personalized-officiant-whisky
"Wedding Decor, Wedding Sign, Custom 3D Wedding Welcome Sign, Wedding Welcome Sign, Personalized Wedding Sign, Sign for Wedding Entrance ",56.06,61,223,41,11,786,113,"wedding sign,wedding signs,wedding welcome sign,welcome sign wedding,wood wedding sign,wedding decor,wedding gift,custom wedding sign,signs for wedding,acrylic wedding sign,3D wedding sign,personalized wedding,wedding venue sign",United States,2023-05-01,yes,no,no,TimelessAccessoryInc,https://www.etsy.com/listing/1458569074/wedding-decor-wedding-sign-custom-3d
Custom Birth Month Jewelry Box | Personalized Flower Jewelry Organizer | Gift for Her | Birth Month Flower Bridesmaid Box - 31 ,5.25,57,144,21,0,57,14,"gift for her,personalized gift,bridesmaid gift,custom jewelry box,bridesmaid proposal,jewelry organizer,bridesmaid box,earring organizer,jewelry organization,custom bridesmaid,birth month jewelry,flower jewelry box,custom birth month",United States,2023-07-18,yes,no,no,ImprintandImpress,https://www.etsy.com/listing/1525201663/custom-birth-month-jewelry-box
"Custom Bride transparent tote bag, Bride to be beach bag, bride honeymoon bag, bridesmaids gifts, bride gifts, beach tote bag, Bride -patc ",9.99,57,680,112,10,1680,42,"bride honeymoon bag,bridesmaids gifts,beach tote bag,custom beach bag,custom beach totes,transparent bag,bride totes,Bride gift,Bridal Shower Gift,Clear tote bag,Bride bag,Custom Bride  bag,beach bride totes",United States,2023-05-10,yes,no,no,BridesmaidsHouse,https://www.etsy.com/listing/1478684211/custom-bride-transparent-tote-bag-bride
To My Mother on My Wedding Day Bride Mom Gift for Mother of The Bride Gift from Daughter Diamond April  Mothers day bracelet Wedding Jewelry ,17.5,48,497,113,7,413,56,"To My Mother,on My Wedding Day,Bride Mom Gift,for Mother,of The Bride,Gift from Bride,Mother Gift,Necklace Gift,Wedding Gift,Jewelry Gift,Mother of Bride Card,Diamond Necklace",United States,2023-03-29,yes,no,no,redcarnationdesign,https://www.etsy.com/listing/1435411244/to-my-mother-on-my-wedding-day-bride-mom
For Happy Tears Personalized/Embroidered Wedding Handkerchief w/date. Father of Bride Gift/Mother of the Bride or Groom Gift/ Ships FAST! BB ,25.0,47,519,137,14,1314,72,"wedding handkerchief,hankerchief,handkerchief wedding,wedding hankerchief,mother of the bride,custom hankerchief,something blue,Father of the Bride,Rehearsal DinnerGift,Dad Wedding Gift,Father Daughter Gift,Father Handkerchief,MonogramHandkerchief,Personalized hankie,Mother of Bride Gift,Mother of Groom Gift,Only Happy Tears,Happy Tears Hankie",United States,2023-04-20,yes,no,no,yourbabysroom,https://www.etsy.com/listing/1465000393/for-happy-tears-personalizedembroidered
"Bridesmaid Proposal with Can Cooler, Will You Be My Bridesmaid Personalized Gift Box Set Matron of Honor Maid of Honor Glass Tumbler ",30.59,46,679,156,14,942,71,"bridesmaid proposal,dusty blue,koozie,maid of honor,matron of honor,sage,bachelorette,bridesmaid tumbler,gift box,will you be my,orange burnt",United States,2023-04-17,yes,no,no,ChicBoutiqueByKat,https://www.etsy.com/listing/1463107963/bridesmaid-proposal-with-can-cooler-will
"Cake Knife and Server Set with 2 Dessert Forks - Personalized, engraved wedding or anniversary cake cutting gift for couples, wedding party ",52.0,43,115,33,6,146,0,"custom engraved,wedding server set,anniversary gift,cake server,wedding gift,colorful cake server,personalized cake,cake cutting set,Bridesmaid Groomsman,Wedding Party,black cake knife,knife and server set",United States,2023-05-20,yes,no,no,TimsWoodDesigns,https://www.etsy.com/listing/1471856078/cake-knife-and-server-set-with-2-dessert
bachelorette party shirts bridesmaid proposal shirts maid of honor shirts wedding party shirts minimalist bachelorette shirts - LCITLE ,11.3,38,115,16,0,66,3,"bridesmaid gift,bachelorette party,bridal party tshirt,Bridesmaid Proposal,wedding proposal box,bachelorette shirts,wedding party shirt,bridesmaid shirt,i do crew shirts,icecreamnlove,proposal box items,personalized wedding,left chest print",United States,2023-04-06,yes,no,no,icecreaMNlove,https://www.etsy.com/listing/1441595470/bachelorette-party-shirts-bridesmaid
Wedding Gift for Groom - Dog Tie clip - Custom Tie Clip - Tie Clip Personalize Pet Portrait -Engraved Tie Bar -Logo Tie Clip -Groomsman Gift ,14.99,36,331,68,0,257,18,"custom tie clip,tie clip personalize,Tie Clip for Groom,Tie Clip Mens,Engraved Tie Clip,personalized tie bar,Boyfriend gift,Groom gift,tie bar,logo tie clip,groomsmen tie clip,tie bar custom,Pet Picture Tie Bar",United States,2023-04-04,yes,no,no,AnaviaDesign,https://www.etsy.com/listing/1454181971/wedding-gift-for-groom-dog-tie-clip
"Personalized Coasters, Custom Engraved Marble Wooden Coaster, Wedding Coaster, Home Decor, Wedding Gifts, Housewarming Gift, Gift for Couple ",10.0,36,598,116,8,1892,137,"wedding coasters,custom coasters,housewarming gifts,anniversary gifts,personalized gifts,wedding favors,family coasters,wedding mementos,gifts for guests,rustic wedding,personalized coaster,engraved coasters,bulk wedding favors",United States,2023-05-18,yes,no,no,iCustomWeddings,https://www.etsy.com/listing/1484395461/personalized-coasters-custom-engraved
Mint To Be White Mints BULK SET OF 100 - White Butter Mints - Affordable Wedding Favor -  Individually Wrapped Wedding Candy - Wedding Mint ,16.95,33,262,81,7,651,60,"bridal shower favors,tic tac mints,Wedding Favor,Mint Favor,mint to be,wedding candy,wedding mints,mint to be mints,bridal shower mints,tic tacs,party favor mints,Butter Mints,White Mints",United States,2023-05-19,yes,no,no,WhiteConfettiBox,https://www.etsy.com/listing/1470967062/mint-to-be-white-mints-bulk-set-of-100
Live Edge Charcuterie Board Personalized Rustic Cheese Board Custom Olive Wood Board Live Edge Board 5th Anniversary Gift Wedding Gift ,64.3,33,385,56,4,906,74,"Custom cutting board,Wood cutting board,Olive wood board,Charcuterie board,5th anniversary gift,Live edge board,Engraved board,Personalized board,live edge,cutting board,cheese board,wedding gift,personalized wedding",United States,2023-04-20,yes,no,no,ForestDecorShop,https://www.etsy.com/listing/1451077946/live-edge-charcuterie-board-personalized
"Groomsmen Gifts Can Cooler Holder, Personalized Gift for Groomsmen, Beer Can Holder, Engraved Can Cooler Gift for Wedding Favors Party Gifts ",3.47,30,74,85,10,80,16,"Personalized Gifts,Groomsmen Proposal,Beer Can Coolers,Gifts Personalized,Groomsmen Gift Ideas,Groomsmen Can,Can Coolers,Cheap Groomsman Gift,Cheap Wedding Favors,Wedding Party Gifts,Gifts for Men,Fathers Day Ideas",United States,2023-04-25,yes,no,no,HisCorner,https://www.etsy.com/listing/1454201418/groomsmen-gifts-can-cooler-holder
"Welcome Wedding Sign, Personalized Welcome to our Wedding Sign, Brushed Acrylic Wedding Sign, Wedding Decor, Modern Wedding Welcome Sign ",45.0,30,220,44,3,419,31,"wedding welcome sign,welcome wedding sign,welcome wedding,wedding seating sign,wedding sign,brushed welcome sign,brushed wedding sign,acrylic wedding sign,acrylic welcome,ENGAGEMENT PARTY,wedding welcome,party welcome sign",United States,2023-06-02,yes,no,no,WoodlandShanty,https://www.etsy.com/listing/1495109663/welcome-wedding-sign-personalized
Handwritten Handkerchief Embroidered - Wedding Handkerchief- Wedding Keepsake ,25.0,29,386,60,7,973,182,"wedding handkerchief,hankerchief,handkerchief wedding,handkerchief,embroidery,wedding hankerchief,Wedding Accessories,wedding handkercheif,no ugly crying,gift from bride,Gifts and Momentos,wedding favor,wedding gift,bridesmaid proposal,wedding keepsake,bridesmaid gift",United States,2023-05-04,yes,no,no,WeddingTokens,https://www.etsy.com/listing/1474521433/handwritten-handkerchief-embroidered
"Custom Groomsmen Flask,Engraved Hip Flask,6OZ Flask, Stainless Steel Hip Flask,Groomsman Gift,Wedding Gift,Groomsman Proposal,Gift For Groom ",6.5,26,101,20,5,656,52,"personalized gifts,birthday gifts,wedding favours,custom flask,groomsmen flasks,gifts for groomsman,Groomsmen Proposal,Barware,engraved hip flask,gift ideas for men,wedding party gifts,Christmas Gifts,custom hipflask",United States,2023-06-30,yes,no,no,WeddingClub,https://www.etsy.com/listing/1499691250/custom-groomsmen-flaskengraved-hip
"Custom Wedding Gift Sign Name, Personalized Family Name Wood Letters Mr Mrs, Sleek, Modern Sweetheart Head Table Decor, Photo Prop, newlywed ",46.39,25,486,65,4,1098,73,"Personalized Name,custom name sign,wedding head table,sweetheart table,wedding photo prop,family last name,mr mrs table decor,custom wedding decor,wedding gift couple,wedding centerpiece,wood signage,custom mr mrs sign,keepsake anniversary",United States,2023-05-16,yes,no,no,KobasicCreations,https://www.etsy.com/listing/1483414813/custom-wedding-gift-sign-name
"Bridesmaid Robes Set of 4,5,6,7,8,9,10,11,12,13,14,15, Silk Bridesmaid Robes, Bridesmaid Gift, Bridal Robes, Wedding Robes, Lace Satin Robes ",76.5,24,443,105,10,939,50,"bridesmaid robes,wedding robe,silk robes,set of 6 robes,bachelorette party,gift for bridesmaid,set of 8 robes,set of 7 robes,bridal robes,set of robes,bachelorette robes,set of bridal robes,bridesmaid gifts",United States,2023-05-20,yes,no,no,LamarieeNewYork,https://www.etsy.com/listing/1485819553/bridesmaid-robes-set-of
"Gold Metallic Mirror Acrylic Wedding Card Box with Slot, Large 10x10x5.5 in, Wedding Reception Wishing Well Money Box, Birthday, Memory Box ",45.99,22,116,23,4,247,21,"card box,acrylic card box,card box for wedding,modern,wedding card box,bridal,envelope,grad card box,gold card box",United States,2023-05-29,yes,no,no,UniqoooShop,https://www.etsy.com/listing/1477943556/gold-metallic-mirror-acrylic-wedding
"Clear Acrylic Wedding Card Box with Slot, Large 10x10x5.5 in, Wedding Reception Wishing Well Money Box, Birthday, Memory Box ",42.59,22,50,10,1,90,6,"card box,acrylic card box,card box for wedding,modern,clear card box,wedding card box,bridal,envelope,grad card box",United States,2023-05-23,yes,no,no,UniqoooShop,https://www.etsy.com/listing/1488182743/clear-acrylic-wedding-card-box-with-slot
"If I Had One Wish, You Should Be Here Memorial, Wedding Memorial, Frosted Memorial Sign, Clear Memorial Wedding, Wedding Memorial, Julie ",15.49,21,485,34,4,1058,110,"Weddings Decorations,wedding sign,wedding sign clear,memory wedding sign,Wedding Memorial,Memorial For Loss,Acrylic Wedding,Loss of Loved One,Acrylic Memorial,memorial wedding,In Loving Memory,Remembrance Candle,Wedding Sign Loss",United States,2023-04-07,yes,no,no,BlessedBirdyBoutique,https://www.etsy.com/listing/1442284878/if-i-had-one-wish-you-should-be-here
"Bridesmaid Proposal Candle - Mini, Bridal Party Proposal Box Gift, Bridesmaid Proposal Box, Maid of Honor Gift ",13.49,20,506,87,4,2021,88,"bridesmaid proposal,bridesmaid box,maid of honor prop,moh proposal,funny bridesmaid,bridesmaid gift,proposal box",United States,2023-04-12,yes,no,no,BeMarryGifts,https://www.etsy.com/listing/1459509591/bridesmaid-proposal-candle-mini-bridal
"Wedding Party Socks with Funny Sayings, Officiant and Groomsmen Socks, Best Value Wedding Theme Socks for Each Wedding Role ",12.95,18,246,49,7,283,18,"personalized socks,wedding gift ideas,mens wedding socks,gifts for brother,fun socks,novelty socks,groomsmen socks,custom socks,personalized gift,wedding party gift,officiant gift,officiant,wedding party socks",United States,2023-04-21,yes,no,no,shopsockprints,https://www.etsy.com/listing/1451676174/wedding-party-socks-with-funny-sayings
Eras | Taylor Swift | Fearless | Speak Now | RED | 1989 | Reputation | Lover | Folklore | Evermore | Midnights | Silver | Gold | Rose Gold ,23.0,18,240,82,7,2108,100,"Eras Tour,Swift Jewelry,Mirrorball,Bejeweled,All Eras,Bejeweled Necklace,Necklace,lover,Midnights,reputation,Great gift,Eras Movie",United States,2023-05-26,yes,no,no,IcebergJewelry,https://www.etsy.com/listing/1475835830/eras-taylor-swift-fearless-speak-now-red
Bridesmaid Gift Box PINK Bridesmaid Box Gifts Personalized Pink Box Pink Bridesmaid Gift Idea (EB3388BPW) Bridesmaid Proposal Box EMPTY ,10.0,18,921,201,26,1613,106,"bridesmaid gift box,bridesmaid box,personalized box,bridesmaid proposal,will you be my,pink gift box,custom proposal box,proposal box,maid of honor box,be my bridesmaid,custom gift box,bridesmaid gift idea,magnetic gift box",United States,2023-03-26,yes,no,no,ModParty,https://www.etsy.com/listing/1433418614/bridesmaid-gift-box-pink-bridesmaid-box
ARCH Gold Silver or Rose Gold Mirror Please Sign Our Guestbook Personalized Acrylic Wedding Reception Party Decor Guest Book Sign ,24.99,17,148,29,2,133,1,"acrylic wedding sign,wedding reception,gold mirror arch,rose gold cards sign,arch mirror acrylic,guestbook sign,acrylic guestbook,gold guestbook sign,rose gold guestbook,gold mirror gifts,arch gold cards sign,arch gold guestbook,silver guestbook",United States,2023-04-12,yes,no,no,PinkPosiesandPearls,https://www.etsy.com/listing/1459310883/arch-gold-silver-or-rose-gold-mirror
Personalized Gift for Bride - Wedding Bouquet Charm Custom Pet Photos - Bridal Bouquet Pins Charm - Wedding Memory Bouquet Charm ,13.74,17,190,59,13,280,8,"bouquet charm,bridal bouquet charm,bouquet photo charm,bouquet charms,photo charm,charm for bouquet,bridal shower gift,bridal gifts,photo jewelry,bouquet charm pins,wedding gift,Photo charm pins,Charms for Bouquets,Photo Bouquet charm,Wedding Memory Charm,Pet memorial Jewelry,Custom Pet Photos,pet jewelry",United States,2023-05-18,yes,no,no,AnaviaDesign,https://www.etsy.com/listing/1484728527/personalized-gift-for-bride-wedding
Block heel wedding IVORY leather sandals/ Handmade ivory leather heels/ Bridal shoes/ Pearl wedding shoes/ Ivory bridal heels LINDA ,147.94,17,282,52,4,856,52,"wedding shoes,bridal shoes,heels for bride,ivory shoes,leather wedding shoe,magosisters,wedding pearls,white leather shoes,pearl bridal sandal,block heel bridal,size EU43,size US12",United States,2023-05-09,yes,no,no,magosistersgr,https://www.etsy.com/listing/1464200522/block-heel-wedding-ivory-leather-sandals
"Personalized Cake Knife and Server Set - engraved wedding or anniversary cake cutting gift for couples, unique keepsake, something new ",28.0,16,423,161,7,383,12,"custom engraved,cake knife,wedding server set,anniversary gift,cake server,wedding gift,personalized cake,cake cutting set,bridal shower,something new,wedding accessories,colorful cake server,Knife and server set",United States,2023-04-06,yes,no,no,TimsWoodDesigns,https://www.etsy.com/listing/1455321605/personalized-cake-knife-and-server-set
"White Acrylic Wedding Card Box with Slot, Large 10x10x5.5 in, Wedding Reception Wishing Well Money Box, Birthday, Memory Box ",43.59,15,116,23,0,215,28,"card box,acrylic card box,card box for wedding,modern,wedding card box,bridal,envelope,grad card box,white card box",United States,2023-05-26,yes,no,no,UniqoooShop,https://www.etsy.com/listing/1476107712/white-acrylic-wedding-card-box-with-slot
Guest Book Alternative - Custom Wedding Guest Book Decor -  Layered Wood Wedding Sign - New Home gift ,55.2,15,747,115,6,570,2,"Guest Book,Book Alternative,Custom Wedding,Wedding Decor,Layered Wood,3D Wedding Sign,New Home gift,Closing Gift,Boho Wedding",United States,2023-05-18,yes,no,no,EtchCraft,https://www.etsy.com/listing/1484630191/guest-book-alternative-custom-wedding
"Groomsmen Gift, Ace Of Spades Bottle Opener, Best Man / Groomsman, Personalized Name, Initial, Wallet Bottle Opener, Credit Card Beer Opener ",5.99,15,420,55,7,176,31,"groomsmen gift,groomsman gifts,groomsmen proposal,groomsmen gift ideas,best man gift,wallet bottle opener,card bottle opener,custom bottle opener,groomsman proposal,will you be my,groomsman,asking gifts,groomsmen",United States,2023-04-28,yes,no,no,SunshineLaserCo,https://www.etsy.com/listing/1470912331/groomsmen-gift-ace-of-spades-bottle
"Angel and Devil Earrings, Adorabl Hoop Earrings, Asymmetry Mismatched Angel Earrings, Handmade Jewelry Halloween Push Back Earrings ",24.83,15,278,30,2,663,70,"fun earrings,minimalist style,trendy earrings,Hip Hop Earrings,Stainless Steel,Small Earrings,Dangle Earrings,handmade Jewelry,stud Earrings,Angel Earrings,Hoop Earrings,korean earrings,mismatched earrings",United States,2023-04-04,yes,no,no,ellifam,https://www.etsy.com/listing/1453647501/angel-and-devil-earrings-adorabl-hoop
"5 Pack of Natural wood slices for wedding centerpieces, rustic wedding decor, woodland decor, tree slices, fall centerpiece for tables! ",18.0,14,60,31,4,168,30,"wedding decorations,wedding center piece,wedding decor,center pieces,spring centerpiece,table decor,woodland,rustic decor,wedding centerpieces,centerpieces,wood slices,rustic wedding decor,rustic",United States,2023-07-15,yes,no,no,RusticWoodSlices,https://www.etsy.com/listing/1509275570/5-pack-of-natural-wood-slices-for
"Boho Little Wildflower Cake Topper, Wildflower Birthday, Flower Baby Shower Decorations, Gender Reveal Decorations, Floral Birthday Party ",12.8,13,433,88,0,722,30,"Wildflower Birthday,Floral,Birthday Party,Gender Reveal,Flower,Baby Shower,Boho,Little Wildflower,Cake Topper,wildflower,birthday,party decor",United States,2023-04-26,yes,no,no,EstesDesignStudio,https://www.etsy.com/listing/1455379064/boho-little-wildflower-cake-topper
Bridesmaid satin scrunchies|Bridesmaid proposal gifts|Maid of honor gift||To have and to hold your hair back|Cant tie the knot without you ,2.8,13,859,229,9,1708,32,"Bridesmaid hair ties,Bridesmaid scrunchie,bridesmaid Proposal,satin hair scrunchie,to have and to hold,Maid of honor gift,Bachelorette party,I cant tie the knot,Personalized card,for bridesmaids,bridesmaid box,bridesmaid favors,stuff for bridesmaid",United States,2023-04-15,yes,no,no,PinkCoastCreations,https://www.etsy.com/listing/1447620656/bridesmaid-satin-scrunchiesbridesmaid
Ring bearer proposal set- will you be my ring bearer - ring security shirt sunglasses - ring bearer gift idea- groomsmen proposal gifts- ,19.54,12,90,30,2,224,21,"bridal party gift,bridal gifts,personalized gifts,ring bearer cups,groomsman proposal,groomsmen gift,ring bearer shirts,ring security shirt,ring bearer proposal,ring boy gifts,ring bearer gift,gift idea ring beare,Ring bearer sunglass",United States,2023-06-28,yes,no,no,HappilyChicDesigns,https://www.etsy.com/listing/1512243735/ring-bearer-proposal-set-will-you-be-my
ARCH Gold Silver or Rose Gold Mirror Photo Booth Guestbook Snap It Shake It Stick It Sign It Acrylic Wedding Leave A Note & Well Wishes Sign ,24.99,12,127,26,0,196,10,"acrylic wedding sign,photobooth wedding,photo guestbook,acrylic photo sign,shake it sign it,polaroid sign,photobooth sign,photo guest wedding,snap it stick sign,leave photo wishes,arch gold photo sign,gold photo guestbook,arch photo guestbook",United States,2023-04-12,yes,no,no,PinkPosiesandPearls,https://www.etsy.com/listing/1459318189/arch-gold-silver-or-rose-gold-mirror
Honeymoon Fund Acrylic Sign | Honeymoon Fund Sign | Wedding Honeymoon Fund Sign | Honeymoon Fund QR Code Sign | ,27.95,11,292,30,3,493,29,"Honeymoon Fund,Honeymoon QR Code,QR Code Sign,Honeymoon Wish,Honeymoon Sign,Honeymoond Fund Sign,Honeymoon QR Sign,Honeymoond Fund QR,Honemoon Wish Sign",United States,2023-04-15,yes,no,no,colorandetch,https://www.etsy.com/listing/1447334452/honeymoon-fund-acrylic-sign-honeymoon
Pop Cones  ,6.99,11,346,74,1,483,32,"Blunt Wraps,Rolling Paper,Vegan,Organic,flavored paper,pre-rolled,cones,raw,pop cones,sweet,flavored cones,pre rolled",United States,2023-04-19,yes,no,no,FrankiesSmokeShop,https://www.etsy.com/listing/1450266076/pop-cones-125-flavored-pre-rolled-cones
"Bride Undies, Underwear for Bride, Bride Briefs, Engagement Gift, Newlywed Gift, Bridal Shower Gift by Blissful Socks ",9.0,10,103,19,2,218,10,"Bride Undies,Underwear for Bride,Bride Briefs,Engagement Gift,Newlywed Gift,Bridal Shower Gift,Blissful Socks,Bachelorette Gift,day of outfit,Blissful Undies",United States,2023-04-28,yes,no,no,BlissfulSocks,https://www.etsy.com/listing/1470765259/bride-undies-underwear-for-bride-bride
Burnt Orange Natural Preserved Flowers Boho Pampas Bunny Tails Wedding Boho Bridal Bouquet Wedding Bouquet Dried Flowers Bridesmaid Bouquet ,59.99,10,58,16,1,484,32,"Wedding bouquet,Artificial flowers,Wedding,Bridal shower,Faux flowers,Boho,Bridal,Greenery,Dahlia,Roses,Lavender,Dusty blue,Steel bouquet",United States,2023-04-18,yes,no,no,HandyMadeTs,https://www.etsy.com/listing/1449341140/burnt-orange-natural-preserved-flowers
Handmade Paper Vow Books | Set of 2 | His and Hers | Personalized Vow Books ,19.12,10,484,133,10,991,52,"Vow Books,Vow Book,Vow Books Set of 2,Vows,Wedding Vow Book,Wedding Vow Books,Wedding Vows,Wedding Gift,Wedding Gifts,Wedding Shower Gift,Wedding Stationary,Bridal Shower Gift,To My Husband Wife",United States,2023-04-08,yes,no,no,WildADesignCo,https://www.etsy.com/listing/1456684753/handmade-paper-vow-books-set-of-2-his
"Wedding Gifts, Engagement Gift for Couple, Engagement Picture Gift, Where She Said Yes, Custom Map Location, Framed Gift ",58.49,9,323,102,3,651,31,"engagement gift,personalized gift,gift for engagement,engaged couple,engagement keepsake,engaged photo frame,gift for couple,gift with photo,engagement picture,where she said yes,personalized gifts,she said yes,wedding gifts",United States,2023-03-21,yes,no,no,EmmaAndTheBean,https://www.etsy.com/listing/1443225705/wedding-gifts-engagement-gift-for-couple
Bridesmaid Hangers Personalized Bridesmaid Gifts Hangers Wedding Hangers Bride Hanger Wedding Hanger Bridal Hanger Bride Engraved F2 ,6.09,8,895,181,19,315,0,"Bridesmaid Hangers,Personalized Hanger,Wedding Hanger,Engraved Hanger,Bridal Dress Hanger,Name Hangers,Bridesmaid gift,bridal robe,hangers,Custom wood Hanger,wedding photo prop,wedding party gift,wedding dress",United States,2023-04-20,yes,no,no,WeddingMinimalist,https://www.etsy.com/listing/1465597943/bridesmaid-hangers-personalized
Flower girl proposal gift box- will you be my flower girl- petal patrol- gift for flower girl sippy cup water bottle- daisy necklace ,25.49,8,92,34,2,206,14,"flower babe shirt,ring bearer gifts,gift for flower girl,flower girl shirt,petal patrol gift,flower girl box,junior bridesmaid,bridesmaid proposal,flower girl proposal,flower girl cup,flower girl gift,flower girl necklace,Flower girl tumbler",United States,2023-03-25,yes,no,no,HappilyChicDesigns,https://www.etsy.com/listing/1446480707/flower-girl-proposal-gift-box-will-you
