title,"price(""$"")",7-day sales,total_sales,total_reviews,7-day reviews,total_favorites,7-day favorites,tags,Ship From,release time,Best Seller,Etsy pick,Raving,store name,product_url
"6 Pcs Ceramic White Flower Hair Pins, Clay Blossom Hair pins, Pearl Floral Sliver Wedding Bridal Hair Pin Set ",37.57,5,177,20,1,307,23,"Polymer Clay HairPin,Bridal Hair Pins,Wedding Hairpiece,Gold or Sliver,Clay and Pearl,Hair Jewelry Set,Bridal Hair Picks,Wedding Gift,Clay Flower",United States,2023-05-12,yes,no,no,KombeWaren,https://www.etsy.com/listing/1480680355/6-pcs-ceramic-white-flower-hair-pins
Rock & Roll / Punk / Band / Music Embroidered Iron-on Patches DIY ,6.99,5,358,48,2,618,18,"iron on,patch,Embroidery,punk,rock,music,rock bands,gothic,reggae,dark,black,biker",United States,2023-03-20,yes,no,no,AntCollects,https://www.etsy.com/listing/1443078851/rock-roll-punk-band-music-embroidered
Rock & Roll / Punk / Band / Music Embroidered Iron-on Patches DIY ,6.99,5,367,49,2,579,17,"iron on,patch,Embroidery,punk,rock,music,rock bands,gothic,dark,black,biker,rock and roll",United States,2023-03-29,yes,no,no,AntCollects,https://www.etsy.com/listing/1449364377/rock-roll-punk-band-music-embroidered
"Mickey Pearls Ears, Mickey Ears, Minnie Ears, Sky Blue Ears, Mouse Ears Headband, Velvet Mickey Ears, Pink Ears, Mickey Ears, Mouse Ears ",21.49,5,66,47,4,1414,58,"Mickey ears,Minnie ears,Minnie mouse ears,Mickey mouse ears,mickey pearl ears,Mickey mouse pearls,Pink Mickey Ears,Sky blue Ears,Mickey pearls ears,White Mickey Pearls",United States,2023-04-04,yes,no,no,MinnieCastle,https://www.etsy.com/listing/1453824317/mickey-pearls-ears-mickey-ears-minnie
"Laptop Stickers, Phone Stickers, Adhesive Patches, Adhesive Letter Patch, 2 Inch Letter Patch, Rainbow Letters, Personalized ",2.99,5,150,20,0,165,11,"Adhesive Patches,Makeup Bag Patches,Do It Yourself,DIY Project,DIY Patches,Laptop Stickers,Phone Stickers,Personalized,Patch,Adhesive Letters,Stickers,Rainbow Patch,Rainbow Stickers",United States,2023-04-12,yes,no,no,ShopatBash,https://www.etsy.com/listing/1459809229/laptop-stickers-phone-stickers-adhesive
"Dinosaur Badge Reel, Glow in the Dark Badge Reel, Brontosaurus Badge Reel, Nurse Badge Reel ",14.0,5,367,55,0,1173,14,"Dinosaur Badge Reel,Glow in the Dark,Dark Badge Reel,Brontosaurus Badge,Badge Reel,Nurse Badge Reel,Nurse gift,acrylic badge reel,badge reel cute,badge holder,hospital id card,teacher badge reel,Pediatrics badge",United States,2023-04-15,yes,no,no,MISisterCreations,https://www.etsy.com/listing/1461770717/dinosaur-badge-reel-glow-in-the-dark
Oncology Nurse Badge | Oncology Nurse Rainbow Badge | Oncology Nurse Gift | No One Fights Alone Badge Reel ,14.99,5,178,21,0,334,12,"Oncology,oncology nurse,oncology nurse badge,oncology RN badge,oncology nurse reel,oncology badge reel,oncology rainbow,oncology lanyard,cute oncology badge,oncology nurse gift,no one fights alone,raimbow oncology,fun oncology gift",United States,2023-05-05,yes,no,no,ThePurplePlumShop,https://www.etsy.com/listing/1475842555/oncology-nurse-badge-oncology-nurse
"Father of the Bride Gift, Personalized Cufflinks, Custom Engraved Rose Gold Jewelry, My Favorite Walk, Modern Wedding Cuff links, FOTB Gifts ",38.7,5,253,35,4,185,0,"round cufflinks,gift from bride,traditional gifts,father of the bride,gift for dad,custom gift,personalised gift,customized gift,dad of the bride,wedding gift ideas,wedding party gift,engraved gift,unique keepsake",United States,2023-05-13,yes,no,no,RebelGiftCo,https://www.etsy.com/listing/1466850978/father-of-the-bride-gift-personalized
"Its ok if you need meds,Mental health badge reel, mental health matters, ",17.95,5,76,18,1,1288,21,"mental health,mental health badges,Badge holder,retractable badges,nurses accessories,medical badge reel",United States,2023-04-12,yes,no,no,paperwoodandcrafts,https://www.etsy.com/listing/1459475893/its-ok-if-you-need-medsmental-health
"Bridal Wedding Hair Piece,Silver Flower Bridal Headpiece,Silver Leaf Bridal Headpiece,Rhinestone Bridal Hair Piece,Pearl Wedding Hair Piece ",14.56,5,209,25,1,329,25,"Bridal jewelry,Bridal jewelry set,Hair jewelry,Bridal Headpiece,Bridal Hair Piece,Wedding Hair Piece,leaf,bridal,gift for her,bridal hair vine,vine,Bridal party gifts",United States,2023-04-18,yes,no,no,KombeWaren,https://www.etsy.com/listing/1449687734/bridal-wedding-hair-piecesilver-flower
"EYIP Scrub Cap, Terrazzo on Teal Ponytail Scrub Caps for Women, Surgical Caps, Scrub Hats, Soft Blue Ribbon ",18.98,5,136,37,4,193,15,"Ponytail Scrub Cap,Ponytail Scrub Hat,Scrub Cap for Women,Ponytail Scrub Caps,Surgical hat,Surgical Cap,Scrub Cap,Scrub Cap for Woman,Terrazzo Scrub Cap,Teal Scrub Cap,Surgical cap women,Womens surgical cap,Custom Scrub Cap",United States,2023-04-23,yes,no,no,EYIPShop,https://www.etsy.com/listing/1467083065/eyip-scrub-cap-terrazzo-on-teal-ponytail
Neon Trucker Hat - Trucker hat with patches - chenille hat patch hat - patch hat - bachelorette party hats - vacation hats - girls trip hat ,9.0,5,517,51,0,361,7,"neon,personalized gift,personalized hat,hat,gift,girls trip,bachelorette party,aviator nation,aviator nation hat,neon hat,patch hat,trucker hat",United States,2023-03-26,yes,no,no,BKLYNLNDN,https://www.etsy.com/listing/1432995348/neon-trucker-hat-trucker-hat-with
"Baby Name Announcement Sign with Birth Stats, Hospital Name Sign, Newborn Footprint Sign for Hospital, 3D Wood Name Announcement Sign ",9.99,5,82,28,4,71,14,"Baby Announcement,Wood Name Sign,baby arrival sign,baby birth stats,baby hospital sign,baby shower gift,baby name reveal,newborn name sign,sign with baby name,nursery decor,Baby Boy Name Sign,Baby Girl Name Sign,Baby Name Round",United States,2023-07-29,yes,no,no,TheMonogrammedPrep,https://www.etsy.com/listing/1532958531/baby-name-announcement-sign-with-birth
y2k miffy-inspired bunny phone/bag charm keychains ,15.4,5,193,40,0,4985,168,"miffy,kawaii,y2k,phone charm,acrylic charm,keychain,bunny,rabbits,star",United States,2023-04-06,yes,no,no,sonnyable,https://www.etsy.com/listing/1455151893/y2k-miffy-inspired-bunny-phonebag-charm
Bunny Ears Headband Rabbit Ears Realistic Bunny Ears Hair Band Bunny Ears Cosplay Accessory Viera Ears Headwear ,25.95,5,187,15,0,343,14,"Bunny Ears Headband,Bunny Headband,Cosplay Headband,Anime Cosplay,Rabbit Ears Headband,Cat Headband,Cat Ears Headband,viera ears,bunny ears,rabbit ears,realistic bunny ears,Women's Accessories,Rabbit Ears Headwear",United States,2023-04-12,yes,no,no,Ashleysproduction,https://www.etsy.com/listing/1445270874/bunny-ears-headband-rabbit-ears
"Personalized Acrylic Keychain, Backpack name Keychain, 3D name tag, Custom name tag, personalized acrylic name tag, diaper bag tag ",12.99,5,259,53,8,254,2,"retro keychain,acrylic keychain,custom keychain,personalized bag tag,name keychain,personalize keychain,backpack keychain,kids name,3d keychain,name tag,personalized name,personalized gift,backpack tag",United States,2023-04-23,yes,no,no,RevaCraft,https://www.etsy.com/listing/1452910280/personalized-acrylic-keychain-backpack
Personalized Keychain Tag 1/4 ,9.94,5,44,25,5,105,9,"mini keychain,back pack keychain,backpack tag,bag tag,name tag,key tag,kid tag,kid backpack,small tag,lunch bag tag,custom tag,Instrument tag,back to school",United States,2023-06-24,yes,no,no,EvyLittleDesign,https://www.etsy.com/listing/1495568458/personalized-keychain-tag-14-small
"Wedding Hair Accessory With Pearls,  Pearl Bridal Hair Vine, Flower Hair Comb for Bride, Silver Pearl Hair Vine, Ivory Clay Flower Hairpiece ",32.0,5,158,12,2,279,49,"bridal hair vine,opal hair vine,wedding hairpiece,bridal accessory,boho hair vine,boho hairpiece,bridal hair bun,champagne hairpiece,pearl hair comb,silver hair comb,pearls hairpiece,hair comb wedding,champagne hair vine",United States,2023-04-01,yes,no,no,VivianDesignBtq,https://www.etsy.com/listing/1437605012/wedding-hair-accessory-with-pearls-pearl
Lover Album Taylor Swift Sunglasses ,25.0,5,224,38,3,858,14,"Sunnies,tour,eras,lover,rhinestones,lover album,eras tour taylor,eras tour lover,eras tour outfit,lover album taylor",United States,2023-04-08,yes,no,no,BELUXEAccessories,https://www.etsy.com/listing/1442562698/lover-album-taylor-swift-sunglasses
"Smells Like A Masters Degree Scented Candle | Hand Poured 9 oz. Brown Jar | Minimal,Graduation Gift,Graduated, Two Degrees Hotter, MBA MS MA ",20.0,5,551,91,0,632,11,"mba,one degree hotter,two degrees hotter,mastered it,graduation gifts,graduation,goal digger,gift for graduate,college announcement,msw,funny masters degree,masters degree gift,mba ms ma",United States,2023-03-22,yes,no,no,HeraysusDrive,https://www.etsy.com/listing/1444501549/smells-like-a-masters-degree-scented
CUSTOM Dissociative Identity Disorder Dry Erase Pin || who is fronting name and pronouns badge || OSDD DID system pin button ,5.5,5,174,40,0,522,14,"disability,disabled,pin,pin button,pinback button,did,osdd,system,plural,Dissociative,did system,dry erase,dry wipe",United States,2023-04-13,yes,no,no,WCFreckles,https://www.etsy.com/listing/1445856158/custom-dissociative-identity-disorder
Personalized Keychain | Personalized Bag Tag | Personalized Gift | Backpack Tag | Gift for Boy | Gift for Girl | Bogg Bag Tag ,15.0,5,339,50,2,366,2,"handmade gift,personalized gift,gift for kids,custom bag tag,monogram bag tag,sports bag tag,personalized bag tag,backpack tag,name keychain,bogg bag tag,pool bag tag,luggage tag,acrylic keychain",United States,2023-03-30,yes,no,no,NewportHomeDecor,https://www.etsy.com/listing/1435964894/personalized-keychain-personalized-bag
"Personalized Glitter Pencil Keychain , Teacher Appreciation, Teacher Gift, End of School Year Gift, Gift for Teacher ",7.5,5,209,30,0,343,33,"teacher gift,teacher appreciation,glitter keychain,pencil keychain,end of year gift,glitter pencil,back to school,gift for teacher",United States,2023-05-05,yes,no,no,HeavenlyCraftsBoutiq,https://www.etsy.com/listing/1461357566/personalized-glitter-pencil-keychain
"Abalone Shell Hair Accessories, Hair Jewelry, Hair accessories for braids, Purple hair accessories, Blue Hair Jewelry, Pearl Hair Jewelry ",6.0,5,294,37,0,1106,12,"Hair beads,loc beads,braid beads,beads,Handmade,loc jewelry,braid jewelry,braid accessories,abalone shell,Pearl,mother of Pearl,hair accessories,hair jewelry",United States,2023-04-26,yes,no,no,ElevatedLocJewelry,https://www.etsy.com/listing/1455004528/abalone-shell-hair-accessories-hair
Driver Wave Cap | Distressed Baseball Cap | Ponytail Baseball Cap | Criss Cross Messy High Bun ,12.0,5,192,25,2,243,23,"jeep girl,jeep,distressed hat,embroidered hat,gift for her,custom,embroidery,jeep gifts,gift,jeeps,handmade,ponytail cap,ditressed cap",United States,2023-05-21,yes,no,no,FortheLoveofNoggins,https://www.etsy.com/listing/1486597041/driver-wave-cap-distressed-baseball-cap
Southwestern Turquoise Flecked Bolo Tie - Gifts for Him Cabochon Indian Leather Cowboy Necktie Accessories Mens Necklace Leather Cord Lariat ,30.0,5,82,19,1,395,33,"scarys,spider,desert,bug,insect,mexican,gift,present,cowboy,accessory,oval,groomsmen",United States,2023-06-02,yes,no,no,BeltsBucklesBolos,https://www.etsy.com/listing/1494687467/southwestern-turquoise-flecked-bolo-tie
"Shop Exclusive: Back and Body Hurts Euro Style Scrub Caps, Scrub Caps, Surgical Scrub Caps, Funny Scrub Caps, Scrub Cap ",22.0,5,304,41,2,388,7,"Euro style scrub cap,scrub cap,scrubhat,surgical scrub cap,fun scrub cap,medical worker gift,cotton scrub cap,funny scrub cap,healthcare worker,tech scrub cap,euro style scrub hat,chemo cap,cute scrub cap",United States,2023-03-19,yes,no,no,Itjustisntsewstudio,https://www.etsy.com/listing/1427671288/shop-exclusive-back-and-body-hurts-euro
The Goodest Boy Military Email Dog - Full Color Stitched Patch ,10.99,5,516,187,6,342,7,"goodest boy,military dog,army dog,military,morale patch,velcro patch,military patch,dog patch,air force patch,army patch,navy patch,military gift",United States,2023-04-01,yes,no,no,KatSLVisuals,https://www.etsy.com/listing/1437930710/the-goodest-boy-military-email-dog-full
"Goldfish Hair Claw Clip , Delicate Hair Claw , Acetate Hair Claw , Adorable Hair Claw ,  Hair Accessories , Perfect Gift For Her ",12.0,5,89,18,2,1401,117,"Goldfish Hair Claw,Acetate hair claw,delicate hair claw,cute hair claw,hair accessories,handmade accessories,adorable hair clip,perfect gift,gift for her,best friend gift,unique gift,Cottagecore Gift,acrylic hair claw",United States,2023-06-14,yes,no,no,TeddyBearStudioUS,https://www.etsy.com/listing/1488897958/goldfish-hair-claw-clip-delicate-hair
Fantasy Cosplay Slip-on Silicone or Latex Elf Fairy Ears ,10.0,5,119,21,1,290,25,"Fantasy,Cosplay,Elf,Elf Ears,Fairy Ears,Vampire Ears,Fantasy Sci-fi,Silicone Ears,Fantasy Ears,LARP,Renaissance Faire,OC Cosplay",United States,2023-05-20,yes,no,no,TouchoftheFae,https://www.etsy.com/listing/1486035147/fantasy-cosplay-slip-on-silicone-or
Baby Stitch | labor and delivery badge holder | nursing student badge reel | nurse accessories | work badge ,15.95,5,400,16,0,503,11,"Christmas badge,xmas badge,gingerbread,resin badge,badges,retractable reel,badge clip,xmas badge holder,nurses accessories,stitch",United States,2023-03-19,yes,no,no,paperwoodandcrafts,https://www.etsy.com/listing/1442119043/baby-stitch-labor-and-delivery-badge
"Blood types, blood Bag Badge holder |Blood Transfusion Badge Reel, IV bag Badge Reel, Phlebotomy badge reel, nursing school graduation gift ",25.0,5,434,101,16,1862,100,"zombie blood,blood drive,blood bank,healthcare worker,hematology,Red Cross,IV bag badge reel,medical badge reel,blood bag badge reel,nurses accessories,badgereel,retractable badges",United States,2023-06-13,yes,no,no,paperwoodandcrafts,https://www.etsy.com/listing/1488052514/blood-types-blood-bag-badge-holder-blood
"Childrens hat,   Embroidered hat, monogrammed hat, personalized hat, custom hat, kids hat, Custom hat ",13.95,5,965,198,7,282,7,"custom hat,embroidered hat,monogrammed gifts,personalized hat,kids hats,Childrens hats,monogrammed hat,kids beach hat,personalized gift,childrens beach hat,custom childs hat",United States,2023-03-20,yes,no,no,SterlingImageInc,https://www.etsy.com/listing/1428894594/childrens-hat-embroidered-hat
"Rebelde tie, Rebelde Corbata, Rebelde Tour, RBD ",20.0,5,264,32,5,311,14,"Rebelde tie,Rebelde corbata,RBD tie,Rebelde shirt,rebelde uniform,RBD tour,Rebelde tour,Rebelde merch,RBD,Rebelde uniforme",United States,2023-03-29,yes,no,no,malbshop,https://www.etsy.com/listing/1449590395/rebelde-tie-rebelde-corbata-rebelde-tour
"A Lot Going On At The Moment Badge Reel, I'm The Problem Badge Reel, Funny Badge Holder, Swift Badge, Nurse Gift, Nicu, Labor and Delivery ",4.4,5,34,9,1,220,14,"Funny Badge Reel,ID Badge Holder,ID Badge Reel,NICU Badge Reel,PhanCreations,its me hi im the,swift badge reel,labor and delivery,taylor lover,im the problem badge,anti hero badge,i'm the nurse badge,A Lot Going On Badge",United States,2023-06-15,yes,no,no,PhanCreations,https://www.etsy.com/listing/1503972451/a-lot-going-on-at-the-moment-badge-reel
NEW Pearl Minnie Mickey Silhouette with Bow 2.5 ,6.99,5,178,35,3,235,11,"glitter mouse,Personalized Gift,Chenille Patch,Best Friend Gift,Letter Patches,Wedding Gift,Cosmetic Bag,Birthday Gift,Glitter,bridesmaid gift,pearl minnie mouse,pearl patches,pearl mickey mouse",United States,2023-03-24,yes,no,no,BeemStyle,https://www.etsy.com/listing/1431366136/new-pearl-minnie-mickey-silhouette-with
Kawaii Dumpster Fire Badge Reel // Nurse Badge Reel // Funny Badge Reel // ER Nurse Badge Reel // Nursing Badge Reel ,14.0,5,338,49,2,793,22,"badge reel,belt clip,swivel clip,dumpster fire badge,funny badge reel,funny nurse badge,badge reel funny,meme badge reel,sarcastic nurse,nurse gift,ER nurse badge,nursing badge reel,alligator swivel",United States,2023-04-13,yes,no,no,FunkyZebraCo,https://www.etsy.com/listing/1445887326/kawaii-dumpster-fire-badge-reel-nurse
Personalized College Name Tag | Gift | Grads | Acrylic | University | Graduation | Dorm Keys | Keychain | Bag Purse Charm ,22.5,5,272,65,5,636,27,"Gift,Acrylic,Graduation,Summer Gift,Keychain,Bag Charm,College,University,Dorm Key,Varsity,Sorority,Fraternity,Personalized Nametag",United States,2023-04-30,yes,no,no,KateAndAnnaCo,https://www.etsy.com/listing/1472253411/personalized-college-name-tag-gift-grads
Order Of Draw Badge Card ,2.5,5,415,55,2,279,7,"Badge cards,Sticker,phlebotomy,laboratory,healthcare,cna,nurse,orderofdraw",United States,2023-03-22,yes,no,no,SolaraStudies,https://www.etsy.com/listing/1444208381/order-of-draw-badge-card
"Coffee Fuel IV Bag Badge holder |Blood Transfusion Badge Reel, IV bag Badge Reel, Phlebotomy badge reel, nursing school graduation gift, ",25.0,5,312,114,15,3074,90,"nurses accessories,badges,badgereel,resin badge reel,retractable badges,Badge holder",United States,2023-06-13,yes,no,no,paperwoodandcrafts,https://www.etsy.com/listing/1502234361/coffee-fuel-iv-bag-badge-holder-blood
Tooled Western Floral Engraved Leather Belt 100% Genuine Full Grain Cowhide with Snaps 1-1/2 ,32.0,5,283,39,3,364,18,"Personalized Belt,Handmade Belt,Engraved Belt,Leather Belt,Tooled Belt,Custom Belt,Belt For Dad,Anniversary Gift,Best Man Gift,Western Belt,Cowbow Belt,Father's Day Gift",United States,2023-05-16,yes,no,no,beltsnbeyond,https://www.etsy.com/listing/1482980449/tooled-western-floral-engraved-leather
Exercise Patience - 2023 Regional Convention of Jehovah's Witnesses - JW Ministry Gifts ,1.0,4,478,82,2,123,0,"JW,gift,magnet,pin,keychain,button,convention,regional,exercise patience,sticker,paradise,2023,floral",United States,2023-03-22,yes,no,no,PatternOfLoveGifts,https://www.etsy.com/listing/1443948427/exercise-patience-2023-regional
"Custom Cowboy Hat, Unique CowBoy Hat, Personalized Cowboy Hat, Custom Cowgirl Hat Made to order ",12.99,4,235,32,2,213,8,"Custom Cowboy Hat,cowboy hat,bachelorette party,party cowboy hat,Bride Cowgirl Hat,Felt Cowboy Hat,Personalized Cowboy,Nashville Bach,festival cowboy hat,cowgirl hat,cowgirl outfit,rave hat,bachelorette hat",United States,2023-03-23,yes,no,no,BigDayGift,https://www.etsy.com/listing/1430484892/custom-cowboy-hat-unique-cowboy-hat
"Taylor Swift Red Heart Sunglasses, She Found Her Lover Bachelorette Party, In My Lover Era, Eras Tour, I'm Feeling 22, Red Taylors Version ",5.0,4,337,25,2,404,6,"Bach party,Red Heart Sunglasses,she found her lover,lover bachelorette,swiftie,eras tour,in my lover era,red Taylors version,Loving him was red,I'm feeling 22,Taylor swiftie merc",United States,2023-04-11,yes,no,no,WildflowerWedamore,https://www.etsy.com/listing/1444520442/taylor-swift-red-heart-sunglasses-she
"Monogram bag tag, bag charm, acrylic bag tag, teacher bag charms, Bogg bag tag, Bogg bag charm, Bogg Bag decor, Bogg teacher bits ",11.0,4,207,40,1,468,7,"teacher bogg bag,teacher bag charms,bag tassel,bag tag,Bogg bag tag,Bogg bag charm,tassel accessory,Bogg bag accessory,initial bag tag,initial bag tassel,monogram bag charm,monogram bag tag",United States,2023-03-23,yes,no,no,6FarmhouseLane,https://www.etsy.com/listing/1444855833/monogram-bag-tag-bag-charm-acrylic-bag
"Anime Inspired Keychain, Dragonslayer Sword Keychain, Cosplay Prop, Anime Merch ",12.6,4,118,17,1,272,18,"berserk guts,berserk necklace,anime keychain,berserk sword,anime merch,berserk keychain,berserk miniature,guts sword,dragonslayer sword,berserk gift,berserk merch,berserk figures",United States,2023-03-20,yes,no,no,TomAndJewelry,https://www.etsy.com/listing/1442967443/anime-inspired-keychain-dragonslayer
"Birthday girl Crown ears, Mickey ears, Minnie ears,  birthday ears, birthday Mickey ears with Princess tiara, iridescent Mouse ears headband ",15.29,4,239,61,5,1125,70,"Mickey ears,birthday ears kids,birthday girl ears,Birthday Ears,Birthday Minnie ears,Minnie ears,Minnie mouse ears,Birthday Mickey ears,Birthday Mouse ears,birthday crown ears,Birthday ears Adults",United States,2023-04-30,yes,no,no,MinnieCastle,https://www.etsy.com/listing/1472403539/birthday-girl-crown-ears-mickey-ears
BIG SALE! Full Mask Of Ghost Call of Duty - Operator MW2 airsoft lub cosplay V1 ,116.66,4,138,15,0,398,21,"ghost,mask,mw2,callofduty,cosplay,simon riley,warzone,ghost mask,great ghost mask,handmade ghost mask,cosplay mask,mw2 ghost mask,cod ghost mask",United States,2023-04-16,yes,no,no,GhostShopOG,https://www.etsy.com/listing/1462183133/big-sale-full-mask-of-ghost-call-of-duty
Buzz light year stitch    Retractable ID Badge Reel nurse teacher badge reel ,9.9,4,163,53,1,534,16,"badge reel,cute badge reel,nurse badge reel,glitter badge reel,id badge reel,office badge reel,medical badge reel,teacher badge reel,nurse gift,stitch,buzz,mashup,lightyear",United States,2023-03-25,yes,no,no,MrsRhinoDesigns,https://www.etsy.com/listing/1446346447/buzz-light-year-stitch-retractable-id
Mouse Ears 500+ Colors | Rose Gold Mouse Ears | Black Sequin Mouse Ears | Candy Color Mouse Ears | Choose Ear + Bow Color ,9.94,4,889,363,16,1663,60,"Mouse ears with bow,Birthday Mouse ears,mouse ear headband,ears headband,mouse headband,mouse birthday,birthday ears,cutestlittleheadwear,cutest little,white mouse ears,rose gold mouse ear,Ears for kids ears,adult mouse ear",United States,2023-04-02,yes,no,no,CutestLittleHeadwear,https://www.etsy.com/listing/1438377676/mouse-ears-500-colors-rose-gold-mouse
Kids Personalized Pink or Black Heart Barbie Sunglasses. Barbie Birthday Favor. Barbie Accessories. Kids Personalized Sunglasses. ,12.99,4,210,23,2,462,8,"Barbie sunglasses,Barbie birthday,Barbie party favor,Personalized Barbie,Kids sunglasses,Heart sunglasses,Barbie decor,Barbie dress,Barbie charm,Personalized glasses,Barbie heart glasses,Barbie accessories,Personalized sunnies",United States,2023-05-24,yes,no,no,CharleyRoseKids,https://www.etsy.com/listing/1489051557/kids-personalized-pink-or-black-heart
"Euro Scrub Cap for Women, Surgical cap Satin Lined Option ",17.98,4,132,38,1,248,2,"Euro scrub cap,surgical scrub cap,womens surgical cap,scrub hat,surgery cap,flower scrub cap,mens scrub cap,mens scrub hat,surgical cap,Satin Lined",United States,2023-03-19,yes,no,no,ParadiseCaps,https://www.etsy.com/listing/1427811914/euro-scrub-cap-for-women-surgical-cap
Anime Jet Tag Keychain ,7.19,4,35,11,0,239,38,"keychain,anime decal,anime keychains,anime jet tag,anime keychain,anime sticker,embroidered keychain,anime,animes,anime merch,jet tag keychain",United States,2023-06-25,yes,no,no,itamisuns,https://www.etsy.com/listing/1510240515/anime-jet-tag-keychain
"Baby Name Swaddle, Newborn Name Swaddle, Personalized Baby Name Swaddle, Hospital Blanket, Baby Shower Gift, Baby Gift, Pink Baby Blanket ",18.75,4,61,14,1,41,0,"baby swaddle,name swaddle,newborn swaddle,newborn name,name announcement,baby keepsake,swaddle for baby,swaddle with name,swaddle blanket,newborn name blanket,pink baby blanket,pink newborn blanket",United States,2023-05-27,yes,no,no,HickoryMoments,https://www.etsy.com/listing/1490876761/baby-name-swaddle-newborn-name-swaddle
"Boho Baby Name Sign for Hospital - birth announcement, retro baby name sign, newborn photo prop, baby shower gift, baby boy name sign ",12.75,4,183,18,2,246,12,"hello my name is,baby name sign,monthly milestone,baby announcement,newborn,newborn name,baby shower gift,milestone marker,hello im new here,newborn name tag,wooden name tag,fresh 48,baby keepsake",United States,2023-04-08,yes,no,no,InTheSycamore,https://www.etsy.com/listing/1456936337/boho-baby-name-sign-for-hospital-birth
"Custom Color Picture Keychain for Daddy,Engraved Daughter Name Photo Keyring, Drive Safe Reminder to Dad,Gifts for Him,Fathers Day Gift ",14.39,4,260,41,0,133,11,"Keyring,photo key chain,Gift for Daughter,custom keychain,keychain for father,Engraved Keychain,picture keychain,keychain for husband,keychain for daddy,daddy daughter Gift,gift keychains,keychain gift dad,Father's Day Gift",United States,2023-05-16,yes,no,no,GemeJewel,https://www.etsy.com/listing/1468986456/custom-color-picture-keychain-for
SFX Version 2.0 Button Eyes with Buttons Included Silicone Prosthetic| Beldam | Special Effects Makeup | Halloween | Cosplay ,35.0,4,47,4,1,232,21,"halloween,cosplay,sfx makeup,special effects,coraline,other mother,beldam,spooky,prosthetic,laika,silicone,voodoo doll",United States,2023-05-29,yes,no,no,WickedWithinSFX,https://www.etsy.com/listing/1477634716/sfx-version-20-button-eyes-with-buttons
Coors Banquet Blue Corduroy Snapback with Red Rope | Vintage hat ,22.99,4,196,15,0,381,16,"racing,coors,beer,Coors Banquet,Banquet,nascar,hunting,fishing,Budweiser,vintage,ropehat,snapback,modelo",United States,2023-05-05,yes,no,no,HypeCondryAct,https://www.etsy.com/listing/1475738953/coors-banquet-blue-corduroy-snapback
"Neutral Boho Leaf Badge Reel, Interchangeable or Standard Option ",12.5,4,54,25,1,388,28,"boho badge reel,neutral badge reel,cute badge reel,teacher badge reel,scout and remy,nursing badge reel,nurse badge reel,polka dot badge reel,monstera badge reel,neutral boho badge,monstera leaf reel,neutral id holder,boho bead badge reel",United States,2023-05-27,yes,no,no,ScoutandRemy,https://www.etsy.com/listing/1476632460/neutral-boho-leaf-badge-reel
Spider-Man 2099 Charm ,11.99,4,230,45,1,1628,9,"spider-man 2099,spiderman 2099,miguel o'hara,o'hara keychain",United States,2023-06-10,yes,no,no,TriclopsRabbit,https://www.etsy.com/listing/1486040358/spider-man-2099-charm
Custom Cat/Therian Mask ,50.0,4,71,27,1,556,21,"Therian,Quadrobics,Gear,Mask,Cat,Warriors,RP,Otherkin,Tiktok,Feline,Tabby,Norwegian,Forest",United States,2023-05-05,yes,no,no,TheFeltedMask,https://www.etsy.com/listing/1461102756/custom-cattherian-mask
