title,"price(""$"")",7-day sales,total_sales,total_reviews,7-day reviews,total_favorites,7-day favorites,tags,Ship From,release time,Best Seller,Etsy pick,Raving,store name,product_url
New Fancy Handmade Embroidery Mirror Work Dupattas ,99.0,1,105,12,0,265,15,"dresses,dupattas,fancy,mirror work,zari work,silk,embroidery,pakistani party wear,traditional,handmade,2023 collection,beautiful article,multi-colors",United States,2023-05-26,yes,no,no,NHARTANDFASHIONHUB,https://www.etsy.com/listing/1490425059/new-fancy-handmade-embroidery-mirror
Can You Not | Badge Reel | Medical ID Badge | Nurse Badge Reel Funny | Funny Badge Holder | Funny Badge Reel | Coworker Gift ,8.99,1,19,37,6,1057,59,"funny badge holder,ER nurse gift,funny gift,funny nurse gift,funny badge reel,cute badge reel,badge reel clip,essential worker,retractable badge,belt clip badge reel,nurse gift,nurse badge reel,pinch clip badge",United States,2023-05-02,yes,no,no,TemeculaStudioArt,https://www.etsy.com/listing/1459422988/can-you-not-badge-reel-medical-id-badge
Link is Armed and Dangerous 1.5 Inch Gold Plated Hard Enamel Pin ,15.0,1,143,50,3,1645,68,"tears of the kingdom,breath of the wild,the legend of zelda,enamel pins,chibi,waifuarts,kawaii nerdy,ultrahand,zelda pin,totk botw 2,cute link fanart",United States,2023-06-24,yes,no,no,waifupins,https://www.etsy.com/listing/1509798171/link-is-armed-and-dangerous-15-inch-gold
"Ghost Cowboy badge reel, Western Ghost, Spooky Ghost, Badge Holder, Gifts for Nurses, Medical, Spooky Ghost, Glitter, Spooky Western ",14.0,1,101,43,12,2140,153,"gift for nurse,nurse gifts,cute badge reel,student nurse gifts,nursing student gift,Western badge reel,ghost cowboy,fall badge reel,ghost badge reel,cowboy badge reel,ghost cowboy badge,spooky ghost badge,glittered badge reel",United States,2023-06-29,yes,no,no,BeadedInGrace,https://www.etsy.com/listing/1513049605/ghost-cowboy-badge-reel-western-ghost
"Whale Hair Claw Clip, Large Acetate Resin Hair Claw, Delicate Hair Claw, Adorable Hair Accessories, Unique Gift, Perfect Gift For Her ",11.25,1,23,11,2,975,138,"Whale Hair Claw,Cute hair claw,delicate hair claw,acetate hair claw,tortoise resin,handmade accessories,hair accessories,best friend gift,unique gift,perfect gift,gift for her,Cottagecore Gift,adorable hair claw",United States,2023-06-28,yes,no,no,TeddyBearStudioUS,https://www.etsy.com/listing/1512403061/whale-hair-claw-clip-large-acetate-resin
"Three Arrows Flag Embroidered Patch | Anarchism Antifa | Hook and Loop, Iron-on & Sew-on Patches ",9.52,1,73,4,0,150,10,"Antifa Patch,Antifa Flag Patch,Anarchist Flag Patch,Antifa Flag,Three Arrows Patch,Three Arrows Flag,Punk Patch,Punk Patches,Anarchism Patch,Anarchism Flag Patch,Antifa hook and loop",United States,2023-05-06,yes,no,no,PerzikCompany,https://www.etsy.com/listing/1476042943/three-arrows-flag-embroidered-patch
Llama Potion | Llama Extract | Funny Badge Reel | Badge Reel | Medical ID Badge | Nurse Badge Reel Funny | Funny Coworker Gift ,8.99,1,98,28,3,1241,59,"funny badge holder,ER nurse gift,funny gift,funny nurse gift,funny badge reel,cute badge reel,badge reel clip,essential worker,retractable badge,belt clip badge reel,nurse gift,nurse badge reel,pinch clip badge",United States,2023-05-11,yes,no,no,TemeculaStudioArt,https://www.etsy.com/listing/1479836515/llama-potion-llama-extract-funny-badge
"Pink Mickey Ears with Gold Crown, Mickey Ears, Minnie Ears, Princess Ears, Pink and Gold Mouse Ears Headband, Birthday Ears, Mickey Ears ",15.29,1,175,71,8,1600,79,"Mickey ears for Kids,Pink Mickey Ears,Minnie Ears,Mickey Mouse Ears,Mickey ears,Minnie mouse ears,Birthday Ears,Princess Mickey Ears,Crown Mickey Ears,Pink Gold Mouse Ears,Crown Minnie Mouse",United States,2023-04-14,yes,no,no,MinnieCastle,https://www.etsy.com/listing/1446867336/pink-mickey-ears-with-gold-crown-mickey
1960s & 1970s Retro Reproduction pin back Buttons and Bottle Openers.  Set 32 ,2.5,1,43,25,3,321,36,"pin,button,badge,pin back,punk,rock n roll,goth,retro,vintage,reproduction,hippie",United States,2023-07-11,yes,no,no,FliptheRecord,https://www.etsy.com/listing/1506646820/1960s-1970s-retro-reproduction-pin-back
"Gray Cotton Summer Flat Cap, Peaky Blinders Hat, Baker Boy Hat, Irish flat cap, Lightweight Men Hat, Ivy League Hat, Spring Gatsby ",34.99,1,158,27,1,98,0,"Peaky Blinders Hat,Gatsby Cap,Fathers Day Gift,Men Summer Hat,Linen Flat Cap,Linen Summer Hat,Grooms Hat,Hatsquare Summer,Gray Man Cap,Gray Flat Cap,Gray Summer Cap,Gray Baker Boy Cap,Gray Newsboy Cap",United States,2023-04-11,yes,no,no,HatCapCo,https://www.etsy.com/listing/1459056471/gray-cotton-summer-flat-cap-peaky
Hot Girls Like Hockey Embroidered Hat | Hockey Hat ,32.0,1,128,23,1,262,5,"hockey,jack hughes,trevor zegras,girls hockey,womens hockey,nhl hat,cute hockey,carolina hurricanes,boston bruins,florida panthers,vegas golden knights,mitch marner,trendy hockey",United States,2023-06-06,yes,no,no,5forSparkling,https://www.etsy.com/listing/1482995896/hot-girls-like-hockey-embroidered-hat
Summer Turban Style Twist Headband | Topical Neutral Boho Plant Headband | Fruit Soft Stretch Knotted Headband | Beach Headbands for Women ,8.94,1,146,29,1,90,2,"Boho Headband,turban headband,knotted headband,twisted headband,yoga headband,summer headbands,tropical headband,plant headband,fruit headband,colorful headbands,strawberry headband,cherry headband",United States,2023-05-12,yes,no,no,DieselRoseCo,https://www.etsy.com/listing/1480644509/summer-turban-style-twist-headband
Personalized Birth Flower Tag|Stethoscope Id Tag Nurse|Stethoscope Name Tag|Preceptor Nurse Gift|Stethoscope Flower|Nurse Gift Set ,16.86,1,160,15,2,101,3,"peds nurse gift,stethescopes charm,hospital nurse gift,transgender nurse,stethoscope charm,stethoscope gift,stethoscope jewelry,preceptor gift nurse,nurse preceptor gift,New NICU nurse gift,trans doctor gift,lgbtq nurse gift",United States,2023-04-08,yes,no,no,Chicsky,https://www.etsy.com/listing/1457049673/personalized-birth-flower-tagstethoscope
"Initial Keychain, Acrylic Tag, Personalized Letter Clip, Backpack Keychain, Diaper Bag Tag, 3D Name Tag, Flower ",14.0,1,93,9,1,132,4,"gift,kids,clip,keychain,name tag,personalized,custom,backpack,diaper bag,gift bag,purse,acrylic keychain,back to school",United States,2023-04-06,yes,no,no,PainterPlaceHomeCo,https://www.etsy.com/listing/1440963198/initial-keychain-acrylic-tag
Personalized Retro Name Acrylic Keychain ,8.25,1,86,142,11,827,44,"keychain,retro keychain,aesthetic keychain,custom keychain,gift for her,acrylic keychain,cute keychain,personalized gift,name keychain,backpack tag,diaper bag tag,nametag,child's keychain",United States,2023-04-22,yes,no,no,LenAndLaine,https://www.etsy.com/listing/1466483653/personalized-retro-name-acrylic-keychain
"Miller Laryngoscope Scrub Cap, Scrub Hat, Surgical Scrub Hat, CRNA gift, anesthesia, anesthetist, its Miller time ",25.0,1,50,13,1,97,5,"scrub cap,scrub hat,surgical scrub hat,surgery cap,anesthesia,anesthetist,CRNA,anesthesiologist,laryngoscope,Miller time,Miller,miller blade",United States,2023-05-26,yes,no,no,CaptivatingScrubCaps,https://www.etsy.com/listing/1490163017/miller-laryngoscope-scrub-cap-scrub-hat
"Groomsmen Cufflinks & Tie Clip Set, Best Man Gift, Fathers Day Gift, Engraved Metal Cuff Links, Anniversary Gift for Him, Groomsmen Gifts ",10.73,1,13,7,1,21,0,"Metal Cufflinks,Custom Cufflinks,Groom Gift,Wedding Day Gift,Groomsmen Gifts,Groomsmen Proposal,Best Man Gift,Father of the bride,father of the groom,Gift for Dad,gift for men,engraved tie clip,fathers day gift",United States,2023-06-04,yes,no,no,CustomHappinessShop,https://www.etsy.com/listing/1496330637/groomsmen-cufflinks-tie-clip-set-best
"Back to School Sign, First Day of School Sign, Personalized Custom Reusable 1st Day of School Sign, Back to School Board, Daisy Flower ",49.99,1,71,10,0,229,1,"back to school,wood school sign,kindergarten,first day of school,back to school sign,1st day of school,reusable school sign,1st day school sign,last day of school,dry erase sign,preschool sign,school photo prop,back to school board",United States,2023-04-06,yes,no,no,harperandlo,https://www.etsy.com/listing/1441091736/back-to-school-sign-first-day-of-school
"Bridal bouquet with burgundy and rust orange flowers, burgundy and terracotta bridesmaids bouquet, terracotta fake bouquet, silk bouquets ",17.5,1,8,15,1,704,49,"terracotta bouquets,silk bouquets,boho bouquet,fake flowers wedding,bridesmaids bouquets,eucalyptus bouquet,groom boutonnire,Faux bouquet,fake bouquet wedding,bridal bouquet,terracotta burgandy,burgundy rust orange,rust orange bouquets",United States,2023-04-29,yes,no,no,RomancePlace,https://www.etsy.com/listing/1457193906/bridal-bouquet-with-burgundy-and-rust
"Custom Leather AirTag Keychain Case, AirTag Holder, Engraving Name leather Key Fob, Father's Day Gift ",9.11,1,118,15,1,95,3,"airtag case,airtag case leather,airtag cover,airtag holder,airtag keychain,apple tag keychain,backpack tag,engraved leather,fathers day gift,gift for husband,gift for wife,key fob keychain,leather keychain",United States,2023-05-17,yes,no,no,Muzidimi,https://www.etsy.com/listing/1469771842/custom-leather-airtag-keychain-case
"Badge Buddy, Customizable Badge Buddy, July 4th Badge Buddy, Medical Badges, Personalized Badge Buddy For Holidays, Vet Badges, Animal Badge ",12.75,1,176,29,1,117,4,"Badge buddy,customized badges,badge buddy custom,Custom badge buddy,Personalized badges,resin badge buddy,glitter badge buddy,glitter badges,medical badge buddy,medical name tags,custom name badges,Animal badges,July 4th badge buddy",United States,2023-06-03,yes,no,no,DaniellesFluidArt,https://www.etsy.com/listing/1481150182/badge-buddy-customizable-badge-buddy
Mouse Ears 500+ Colors | Rose Gold Mouse Ears | Black Sequin Mouse Ears | Candy Color Mouse Ears | Choose Ear + Bow Color ,7.96,1,161,48,0,132,3,"Mouse ears with bow,Birthday Mouse ears,mouse ear headband,ears headband,mouse headband,mouse birthday,birthday ears,cutestlittleheadwear,cutest little,white mouse ears,rose gold mouse ear,Ears for kids ears,adult mouse ear",United States,2023-03-21,yes,no,no,CutestLittleHeadwear,https://www.etsy.com/listing/1429087930/mouse-ears-500-colors-rose-gold-mouse
Smile Face Trucker hat ,19.5,1,130,6,0,168,19,"trucker hat,hat,foam hat,howdy,summer hat,funny hat,beach hat,custom hat,baseball cap,smiley hat",United States,2023-05-24,yes,no,no,CGreyCollective,https://www.etsy.com/listing/1474485310/smile-face-trucker-hat
"Personalized Stethoscope Birthflower Initial Name Tag, Stethoscope Charms with ID Tag Accessories, Gift for Nurse, Doctor, Medical Assistant ",10.34,1,162,24,2,108,1,"Stethoscope Name Tag,Stethoscope Charms,Nurses Week Gift,Doctor,Medical Assistant,Custom Stethoscope",United States,2023-04-16,yes,no,no,Cidaier,https://www.etsy.com/listing/1447907638/personalized-stethoscope-birthflower
"Brown Leopard Harley Headband, Women's Soft Stretchy Wide Twisted Headband, Motorcycle Headband for Women, Harley Head Wrap, Bad Hair Days ",10.0,1,229,32,0,131,5,"stretchy headband,Harley Headband,motorcycle wrap,motorcycle headband,biker headband,motorcycle head wrap,harley women,harley davidson wrap,Harley Wrap,harley hair band,davidson headband,Womens Bike Wrap,harley Head wrap",United States,2023-05-13,yes,no,no,CraftiestConcepts,https://www.etsy.com/listing/1481193647/brown-leopard-harley-headband-womens
Beach Bag Shadow Monogram Pool Bag | Large - Bridesmaids Wedding Custom Bachelorette Name School Everyday ,7.99,1,490,51,0,243,2,"custom,lake,beach,waterproof bag,Bridesmaid Gift,Miami,Palm Springs,California,Bachelorette Bag,Pool Bag,Waterproof,Bahamas,Beach Bag",United States,2023-03-22,yes,no,no,KinzMarieCo,https://www.etsy.com/listing/1429720206/beach-bag-shadow-monogram-pool-bag-large
Funny Badge Reel | Badge Reel | Medical ID Badge | Nurse Badge Reel Funny | Funny Badge Holder | Funny Gift | Trying My Best | Name Tag ,8.99,1,304,87,4,2821,144,"funny badge holder,ER nurse gift,funny gift,funny nurse gift,funny badge reel,cute badge reel,badge reel clip,essential worker,retractable badge,belt clip badge reel,nurse gift,nurse badge reel,pinch clip badge",United States,2023-04-06,yes,no,no,TemeculaStudioArt,https://www.etsy.com/listing/1441496740/funny-badge-reel-badge-reel-medical-id
Personalized TIE CLIP for Dad Bar Clasp Tieclip Custom Engraved Groomsmen Gifts for Him Boyfriend Gift Men Groomsman  Wedding Gold Silver ,19.98,1,45,21,0,31,0,"custom tie clip,groomsmen gifts,groomsman gift,father of the bride,boyfriend gift,gifts for boyfriend,father of the groom,gift for men,personalized gift,engraved tie clip,gift for dad,gift for him,engraved tip clip",United States,2023-04-30,yes,no,no,PrecisionMemory,https://www.etsy.com/listing/1472293307/personalized-tie-clip-for-dad-bar-clasp
Custom Headband Glitter Headband School Headband Dance Headband Coach Gift School Fundraiser irdea Gift for Teacher School Hair Accessory ,16.98,1,68,6,1,99,10,"dance headband,school headband,glitter headband,custom headband,teacher gift,school fundraiser,gift for mom,gift for teacher,back to school Gift,school mascot,gift for principle,dance headwear,back to school goft",United States,2023-04-19,yes,no,no,BOWSandBALLERS,https://www.etsy.com/listing/1450507158/custom-headband-glitter-headband-school
Heated Glow Hand Fan | Beyonce | Renaissance | Limited Edition | Fan Myself Off | Rave Fan | 360 Camera Prop | Large Hand Fan ,25.0,1,174,23,1,120,0,"bachelorette party,bridal shower,vacation,gay fan,personalized fan,Cuff It,Drag,House music,Renaissance,concert,disco cowboy hat,Thique,Girl's Trip",United States,2023-03-30,yes,no,no,ShadyBFans,https://www.etsy.com/listing/1436058868/heated-glow-hand-fan-beyonce-renaissance
Extra Fluffy Mega Volume Messy Bun Big Hair Bun for Updo Hairstyles ,12.0,1,107,20,3,99,7,"messy bun,hair bun,chignon,updo,big hair bun,faux hair bun,clip on bun,easy hair bun,fluffy hair bun,XL messy bun,thick messy bun,fake hair bun",United States,2023-04-16,yes,no,no,HAIRinaMINUTE,https://www.etsy.com/listing/1462169281/extra-fluffy-mega-volume-messy-bun-big
"Backpack name keychain, 3d name keychain, name keychain, acrylic name keychain, backpack name tag, diaper bag tag, retro name keychain ",15.0,1,82,10,1,118,3,"3d acrylic keychain,3d keychain,retro keychain,backpack tag,acrylic keychain,custom keychain,name keychain,kids bag tag,backpack keychain,kids name keychain,personalized bag tag,backpack name tag,diaper bag name tag",United States,2023-03-20,yes,no,no,MyCallieGirl,https://www.etsy.com/listing/1428365850/backpack-name-keychain-3d-name-keychain
"Retractable Reel Add-on for Keys, Badge - Retractable Attachment to Lanyards - Extends up to 12 ",3.5,1,209,23,0,114,9,"retractable lanyard,teacher lanyard,badge reel lanyard,badge reel add-on,lanyard add-onn",United States,2023-05-25,yes,no,no,LolaandLaly,https://www.etsy.com/listing/1475177090/retractable-reel-add-on-for-keys-badge
Patches Clip ,10.0,1,177,35,1,238,2,"Patches,Wonderfold,wagon,w1,w2,w4,clip,w-series",United States,2023-03-28,yes,no,no,3DNA2Designs,https://www.etsy.com/listing/1434622054/patches-clip
Taylors Version  Dad hat ,26.95,1,336,49,0,451,5,"anti hero,era tour merch,evermore,taylors version,swiftie,girlfriend gift,wife present,im the problem,taylor merch,lavender haze,reputation,taylor hat",United States,2023-04-12,yes,no,no,LocalGrocer,https://www.etsy.com/listing/1459472777/taylors-version-dad-hat
"You Can Be Yourself With Me Pin, Pride Ally Pin, Safe With Me Pin, LGBT Pin, Gift for LGBT Ally, LGBTQIA Ally Pin, Gift for Pride Ally ",5.0,1,171,23,0,198,0,"Pride pin,Pride Ally pin,Rainbow Pride pin,Be yourself pin,Be yourself with me,LGBT Ally pin,Safe with me pin,Ally Pride pin,Be yourself gift,Rainbow Ally pen,Lgbtqia ally pin,Pride Ally gift,Pride gift",United States,2023-06-03,yes,no,no,kdcphotosART,https://www.etsy.com/listing/1495359187/you-can-be-yourself-with-me-pin-pride
Black Smiley Teacher Lanyards ,36.0,1,90,12,1,195,4,"teacher,lanyard,id,badge,holder,retro,neutral,rainbow,pastel,checkered,smiley",United States,2023-04-07,yes,no,no,ChansLans,https://www.etsy.com/listing/1455918267/black-smiley-teacher-lanyards
"Personalized Name Doormat, Flocked Coir Door Mat, Welcome Mat, Engagement Wedding Gift, Realtor Client Gift, Outdoor Rug, Double Door ",50.15,1,274,35,0,113,9,"doormat,door mat,personalized doormat,custom doormat,welcome mat,outdoor doormat,personalized rug,funny doormat,custom rug,wedding gift,engagement gift,initials doormat,flocked coir rug",United States,2023-04-26,yes,no,no,DoormatDecor,https://www.etsy.com/listing/1469295735/personalized-name-doormat-flocked-coir
"Cow abduction badge reel, nurse accessories,alien abductions. ",20.0,1,87,34,1,936,7,"Cow abduction,Alien,badgereel,nurse accessories,cute alien,groovy,badge clip,badgeholder",United States,2023-04-07,yes,no,no,paperwoodandcrafts,https://www.etsy.com/listing/1441649408/cow-abduction-badge-reel-nurse
"MENS Scrub Cap, Backorder, Surgical Hat, Guys Scrub Cap, Funny Scrub Cap ",25.0,1,96,11,0,71,3,"mens scrub cap,scrub cap,surgical cap mens,funny scrub cap,surgical scrub cap,funny surgical cap,mens surgical hat,surgical scrub hat,funny mens cap,mens surgical cap,mens scrub hat,scrub hat mens,mens funny cap",United States,2023-03-23,yes,no,no,graycapco,https://www.etsy.com/listing/1445023053/mens-scrub-cap-backorder-surgical-hat
"Personalized Family Reunion, Ready to Press Decal, Family Reunion Heat Transfer, Family Iron on Transfer ",6.0,1,133,20,0,128,7,"ready to press,heat transfer vinyl,iron on decal,vinyl decal,Heat Transfer Decal,Iron on,family vacation,matching shirts,family reunion,personalized decals,reunion decal,reunion iron on",United States,2023-05-15,yes,no,no,ExpressVinylStudio,https://www.etsy.com/listing/1482130363/personalized-family-reunion-ready-to
"Mickey Ears, Velvet Mouse Ears, Minnie Ears, Mouse Ears Headband, Minnie Charm Mickey Ears, Velvet Mickey Ears, Mickey Ears, Mickey Ears ",12.79,1,44,16,1,322,43,"black Mickey Ears,Mickey ears,Velvet Mickey ears,Minnie Ears,Mickey Mouse Ears,mouse ears headband,Minnie mouse ears,Velvet Minnie ears,Cream Mickey Ears,Beige Mickey Ears,White Mickey Ears,Mickey Charm Ears",United States,2023-04-07,yes,no,no,MinnieCastle,https://www.etsy.com/listing/1456528121/mickey-ears-velvet-mouse-ears-minnie
UPS Bucket Hat ,24.95,1,106,11,0,83,5,"ups hat,ups bucket hat,ups socks,ups,ups hats,ups trucker hat,ups polo shirts,ups boonie hat,ups vest,upshats,ups underwear,ups t shirt,ups sun shirt,ups driver,logo cap,ups logo cap,go brown,ups apparel,ups cap,brown,Ups sun hat,Brown bucket hat,ups logowear,ups summer hat",United States,2023-05-23,yes,no,no,BlueSuedeStitches,https://www.etsy.com/listing/1473742158/ups-bucket-hat
"RUSH ORDER, ships next business day---Wedding Hanger, Name Hanger, Personalized Bridal Gift, Bride gift ideas, Dress hanger ",25.5,1,72,30,3,37,3,"wedding hangers,bridal gift,Custom Hanger,Bride Gift Idea,Dress Hanger,Wedding Shower gift,wire hanger,personalized hanger,bridal hanger,name hanger,RUSH",United States,2023-04-07,yes,no,no,elegantbridalhangers,https://www.etsy.com/listing/1441712724/rush-order-ships-next-business-day
Song Keychain Custom Scan Code Playlist or Song - Translucent Keyring QR Code Tag ,9.41,1,110,18,2,101,7,"song keychain,spotify keychain,spotify code,qr code keychain,spotify plaque,song code keychain,backpack charm,song code,song plaque,custom song,wedding song,scannable song code,playlist code",United States,2023-05-19,yes,no,no,Omnilectix,https://www.etsy.com/listing/1471098400/song-keychain-custom-scan-code-playlist
TEXAS MESSY  Double Stack OR Single Extra Messy Bows | Knot-Free Comfort | Big Bow Headwraps | Permanently Sewn Secure | Fluffy & Oversized ,15.0,1,73,13,0,125,8,"eyelet lace,skipper Avenue,Big headband bows,big bow headbands,shredded bows,over the top bows,shredded headwraps,big messy bows,boujee bows,big bows nylon,huge toddler bows,big ruffle headwrap,texas messy bow",United States,2023-04-21,yes,no,no,SkipperAvenue,https://www.etsy.com/listing/1465790603/texas-messy-double-stack-or-single-extra
Custom Full Color Lanyards | Personalized Lanyards | Logo Lanyards | Custom Printed Lanyards | Badge Holders + Breakaways + ID Card Holder ,4.5,1,259,54,2,128,2,"Custom Logo Lanyards,Logo Lanyards,Lanyard Badge Holder,Personalized Lanyard,Lanyard for Keys,Custom Lanyard Bulk,Custom Lanyard,Lanyard Logo,Lanyard Badge,Teacher Lanyards,Lanyard,Breakaway Lanyard,Cruise Lanyard",United States,2023-03-24,yes,no,no,imprintinc,https://www.etsy.com/listing/1445804281/custom-full-color-lanyards-personalized
"Shadow Monogram Pool Bag, Large - Custom small toiletry bag ",7.99,1,609,63,0,210,2,"lake,beach,Bridesmaid Gift,Palm Springs,Bachelorette Bag,Personalized Travel,Custom Zipper Bag,Bachelorette Beach,Water resistant bag,Monogram Pool Bag,Custom Toiletry bag,Waterproof Pouch,Beach Vacation Bag",United States,2023-03-22,yes,no,no,KinzMarieCo,https://www.etsy.com/listing/1443931067/shadow-monogram-pool-bag-large-custom
"Medium or Large Monogrammed Back to School Hair Bow, First Day of Kindergarten, PreK Personalized Apple Hairbow with Initials, Pencil Bows ",11.0,1,53,28,4,233,4,"first grade 1st,Initials,Name,uniform,personalized,kinder,first grade,custom hairbows,pre k pre-k 3rd,second 2nd,apple apples,pencils crayon",United States,2023-05-29,yes,no,no,MrsBowItAll,https://www.etsy.com/listing/1492056743/medium-or-large-monogrammed-back-to
Backpack Keychain Personalized Name Tag Kid Name Keychain Diaper Bag Tag Lunchbox Name Tag Personalized Keychain Acrylic Bag Tag 3D Keychain ,12.5,1,221,34,7,124,3,"Gift for Her,Acrylic Keychains,Gift,Personalized Gift,Custom Keychain,Name Tags,Back to School,Name Keychain,Bag Tags,Personalized,Keychain,Name,Custom Tag",United States,2023-05-04,yes,no,no,OakandMossDesign,https://www.etsy.com/listing/1460348866/backpack-keychain-personalized-name-tag
Custom Bogg Bag Charms / Bag tags / Keychains - Cheer - Pom poms - Megaphone - Sublimation design s ,12.0,1,115,13,0,103,5,"bogg,bag,charm,bogg bag charms,personalized,custom charm,sublimation,cheer,pom poms,gymnastics,megaphone",United States,2023-04-18,yes,no,no,TripleBsDesigns,https://www.etsy.com/listing/1449887796/custom-bogg-bag-charms-bag-tags
13 Point Bolt Embroidered Snapback Trucker Hat (Richardson 112) ,29.7,1,124,16,2,94,8,"Phish lot,Phish,John Mayer,phish trucker,Grateful Dead hat,Jerry Garcia hat,13 point bolt hat,bolt hat,Grateful Dead,phish snapback,Flexfit bolt hat",United States,2023-04-01,yes,no,no,ClawmaTried,https://www.etsy.com/listing/1437348098/13-point-bolt-embroidered-snapback
The Last of Us Button Pins - Abby and Lev from Part 2 | 1.25in Button Pins ,2.0,1,21,25,2,116,13,"The Last of Us,the last of us 2,the last of us art,the last of us joel,the last of us ellie,TLOU,TLOU2,the last of us abby,the last of us lev,abby anderson,the last of us pin,The Last of Us P2,the last of us wlf",United States,2023-06-28,yes,no,no,SaraBaileyArt,https://www.etsy.com/listing/1498065648/the-last-of-us-button-pins-abby-and-lev
Goose Hat Vintage Baseball Cap Silly Hat Humorous Hat Vintage Cap Animal Hat for Animal Lover ,22.94,1,162,13,1,451,6,"Silly Goose,Silly Goose Hat,funny hat,vintage hat,vintage style hat,vintage baseball cap,silly hat,vintage cap,funny baseball hat,outdoor hat,fun hat,women's baseball hat",United States,2023-04-27,yes,no,no,FindingGrowthShop,https://www.etsy.com/listing/1455547930/goose-hat-vintage-baseball-cap-silly-hat
"Tooled Leather Hair Clip, Leather Hair Clip Set Design, Digital Laser File, Hair Clip Design SVG File, Claw Clip Design, Instant Download ",5.0,1,182,22,0,196,3,"Laser Cut File,Instant Download,Glowforge Designs,Claw Clip,Hair Clip Design,Hair Clip Template,Claw Clip Design,Leather Claw Clip,Leather Hair Clip",United States,2023-03-26,yes,no,no,CirrusLeeCuteDesigns,https://www.etsy.com/listing/1447433201/tooled-leather-hair-clip-leather-hair
"Cowboy Hat SMALL Patch, diy patch, Cowboy Hat with Gold Glitter, iron on patch ",3.99,1,62,15,0,105,3,"Vols,yellow cowboy hat,black cowboy hat,pink cowboy hat,Knoxville,Nashville,chenille hat patch,cowboy hat patch,cowboy hat,chenille patch,iron on patch",United States,2023-04-13,yes,no,no,stitchedoriginals,https://www.etsy.com/listing/1446018332/cowboy-hat-small-patch-diy-patch-cowboy
Desert Coral solid plain Self tie Neck tie 3.5 ,13.75,1,137,18,3,35,1,"hankie,handkerchief,dusty,davids,azazie,bridal,rose,galina,signature,charmeuse,birdy,grey,satin",United States,2023-04-09,yes,no,no,BowieUSA,https://www.etsy.com/listing/1457486417/desert-coral-solid-plain-self-tie-neck
"Cheer Ribbon Zipper Pull Name Tags, Cheer Bag Tag Customized, Personalized Cheer Name Tag, Ribbon Cheer Bag ID with Name, Girl Gift ",16.0,1,116,14,1,97,7,"Keychains Lanyards,Custom Charm,Cheer Charm Tag,Zipper Pull RIbbon,Cheer Bag Tag,Sports Bag Charm,Personalized Tag,Ribbon Zipper Charm,Ribbon Keychain,Personalize Keychain",United States,2023-05-26,yes,no,no,MadyJays,https://www.etsy.com/listing/1490166807/cheer-ribbon-zipper-pull-name-tags-cheer
"Surprise Gender Reveal Announcement Sign, Little Sister Little Brother Photo Prop, Gender Reveal Sign for Hospital,Boy or Girl Gender Reveal ",10.99,1,138,23,0,145,1,"Baby Announcement,Baby Name Reveal,Baby Birth Stats,Sign for Hospital,Mom to be gift,Baby Name Sign,sign with baby name,baby arrival sign,Gender Reveal Sign,Gender Announcement,Hello World Sign,Baby Photo Prop,Baby Sign Photo Prop",United States,2023-05-03,yes,no,no,PersonalizeKeepsake,https://www.etsy.com/listing/1474295289/surprise-gender-reveal-announcement-sign
