title,"price(""$"")",7-day sales,total_sales,total_reviews,7-day reviews,total_favorites,7-day favorites,tags,Ship From,release time,Best Seller,Etsy pick,Raving,store name,product_url
Glow In the Dark Jewelry · Silicone Bracelets · Matching Bracelet · Friendship Bracelet · Dainty Ankle Bracelet · Adult Friendship Bracelet ,9.3,6,685,123,4,339,2,"glow in the dark,jewelry,bracelets,matching bracelet,friendship bracelet,ankle bracelet,dainty bracelet,adult friendship,silicone bracelet,couple bracelet,glow jewelry,best friend bracelet,stretch bracelets",United States,2023-04-14,yes,no,no,HuedBracelets,https://www.etsy.com/listing/1460929425/glow-in-the-dark-jewelry-silicone
"Titanium Flowers Zircon Screw Back Stud Earrings, Non Tarnish, Implant Grade Titanium Waterproof Earrings, Vintage Style, Minimalist ",22.05,6,174,32,1,390,15,"titanium earrings,titanium studs,titanium earring,stainless earrings,Nickle Free,no tarnish earrings,cool earrings,waterproof earrings,minimal earrings,sensitive earrings,non tarnish earrings,earrings titanium,heart earrings",United States,2023-04-26,yes,no,no,OhlalajewelryUS,https://www.etsy.com/listing/1455009440/titanium-flowers-zircon-screw-back-stud
"Cross Name Bracelet, Baptism Gift, Personalized Cross Bracelet with Name, Christian Gifts for Christening, Custom Bracelet , Gift For Her ",23.6,6,314,65,4,614,12,"cross name bracelet,cross bracelet,cross jewelry,personalized jewelry,personalized gift,custom bracelet,name bracelet,gold bracelet,baptism gift,Christian gifts,confirmation gifts,first communion gift,14k gold bracelet",United States,2023-05-02,yes,no,no,StayChicJewelry,https://www.etsy.com/listing/1473254393/cross-name-bracelet-baptism-gift
"Natural Turquoise Stone Starfish Charms Silver Rice Beads Turtle Charm Multilayered Tropical Island Hawaii Beach Anklet, Unique Dainty Wear ",14.39,6,312,59,2,446,10,"beach anklet,beach bracelet,turquoise bracelet,turquoise anklet,sea turtle,turtle charm,starfish anklet,starfish bracelet,turtle bracelet,summer vacation,vsco,aesthetic,cute anklet",United States,2023-05-07,yes,no,no,KrissyJewelryCo,https://www.etsy.com/listing/1462802610/natural-turquoise-stone-starfish-charms
"Zodiac Crystal Bracelet, Zodiac Healing Crystal Bracelet, Stretch Bracelet, Gemstone Zodiac Gift, Zodiac Birthday Gift, Birthstone Crystals ",14.0,6,255,31,7,301,14,"crystal bracelet,crystal jewelry,gemstone bracelet,zodiac crystals,zodiac bracelet,healing crystal,zodiac jewelry,handmade jewelry,bracelets for women,bracelet for men,may birthstone,april birthstone",United States,2023-04-14,yes,no,no,IconGemStones,https://www.etsy.com/listing/1460901523/zodiac-crystal-bracelet-zodiac-healing
The Lavender Necklace ,29.99,6,273,76,0,802,14,"phoebe bridgers,smoke signals,lavender,stranger in the alps,pharb,jewelery,boygenius",United States,2023-04-28,yes,no,no,moonnandearth,https://www.etsy.com/listing/1470671455/the-lavender-necklace
"Gold Clover Bracelet, Four Leaf Clover, Gold Plated Jewellery, Minimalist Jewellery, Does Not Fade, Hypoallergenic, Mothers Day Gift for Her ",15.67,6,150,8,1,474,28,"gold bracelet,handmade bracelet,charm bracelet,clover bracelet,gold clover bracelet,gold charm bracelet,minimalist bracelet,four leaf clover,clover necklace,designer jewellery,designer bracelet,bracelet for women,bridesmaid bracelet",United States,2023-04-19,yes,no,no,JenniesJewellery,https://www.etsy.com/uk/listing/1450146286/gold-clover-bracelet-four-leaf-clover
"Gold Filled Loop Earplug Earrings, Earplug Chain, Loop Earplug Holder, Chain Earrings, Double Piercing Earrings,Double Handcuff Hoop Earring ",24.0,6,166,35,1,882,44,"earplug earrings,loop earrings,ear plug earrings,loop earplug holder,loop earplug,raven stone usa,loop earring holder,loops earrings,ear plugs,loop earplug earring,Loop Earplugs,Adhd Earrings,ADHD Jewelry,earbud earrings,Double Handcuff Hoop,Double Piercing,Chain Earrings,Earplug Holder,babeina",United States,2023-05-06,yes,no,no,BABEINA,https://www.etsy.com/listing/1461984120/gold-filled-loop-earplug-earrings
"New In Box Vivienne Westwood Heart Necklace,Gift For Her ",32.57,6,124,5,0,579,35,"vivienne westwood,westwood necklace,vivienne necklace,Gift For Him,Orb chain,saturn necklace,Fritillaria necklace,shell necklace,heart necklace,Rose Gold Necklace,Rose Gold Chain,viviennewest,Rose Gold Saturn",United States,2023-05-17,yes,no,no,NGBestWish,https://www.etsy.com/listing/1484134463/new-in-box-vivienne-westwood-heart
"Cowrie Shell Puka Shell Seashell Adjustable Tropical Island Hawaii Beach Braided Wax Rope Choker Necklace, Summer Festival Vacation Necklace ",14.99,6,293,54,1,650,15,"cowrie shell,puka shell necklace,seashell necklace,seashell choker,cowrie choker,puka shell choker,summer vacation,summer festival,vsco,aesthetic necklace,cute choker necklace,trendy",United States,2023-05-10,yes,no,no,KrissyJewelryCo,https://www.etsy.com/listing/1464824296/cowrie-shell-puka-shell-seashell
"Lotus Flower Necklace, Sacred Lotus Necklace, Lotus Pendant, Silver Lotus Flower Necklace, Jewelry For Women, Lotus Pendant Sterling Silver ",34.42,6,130,13,0,286,29,"lotus necklace,lotus pendant,flower necklace,yoga jewelry,gift for her,gift for women,silver lotus charm,sacred lotus,lotus flower,sterling silver,gift for mother,dainty lotus pendant,silver flower gift",United States,2023-04-30,yes,no,no,PurpleSilverShop,https://www.etsy.com/listing/1457724090/lotus-flower-necklace-sacred-lotus
"Sterling Silver Tiny Skull Wax Seal Earrings, Skull Jewelry, Wax Seal Jewelry, Gothic Earrings, Mortality Earrings, Memento Mori Jewelry ",32.2,6,70,20,0,643,46,"skull jewelry,skull earrings,wax seal jewelry,wax seal earrings,wax seal skull,gothic earrings,goth earrings,Memento Mori Jewelry,memento mori charm,tiny skull earrings,mortality earrings,mortality jewelry,silver tiny skull",United States,2023-05-17,yes,no,no,MathewandMarieCo,https://www.etsy.com/listing/1469440884/sterling-silver-tiny-skull-wax-seal
"Set of 6 Everyday Layering Bracelets, Gift for Mom, Gold Chain Bracelet, Dainty Simple Bracelet, 18k Gold Filled Bracelet Set ",14.39,6,222,46,2,731,10,"bracelet set,anklet bracelet,gift for mom,bracelet stack,link bracelet,stacking bracelet,gold bracelet,bracelet for women,everyday bracelet,tiny bracelet set,stackable bracelets,double bracelet,Hipoallergenic chain",United States,2023-04-26,yes,no,no,AgataStoreJewelry,https://www.etsy.com/listing/1454875130/set-of-6-everyday-layering-bracelets
TWO Butterfly Croc Shoe Charm Jibbitz / Purple Pink / Green / Orange / Handmade / Cute / Unique / Boho / Y2K / Whimsical / Chrome / Gift ,3.37,6,378,20,1,933,38,"butterfly charm,iridescent charm,croc charms,cute croc charms,cute shoe charm,butterflies,y2k,butterfly jibbitz,butterfly croc charm,y2k croc charm,pink croc charm,purple croc charm,butterfly jibbit",United States,2023-05-18,yes,no,no,poutybaddie,https://www.etsy.com/listing/1484642215/two-butterfly-croc-shoe-charm-jibbitz
"18K Silver Turquoise Blue Pendant Necklace, Turquoise Stone Pendant Men, Men's Black Stone Necklace, Stainless Steel, Perfect Gift for Him ",24.25,6,241,27,1,337,13,"man necklace,necklace for man,man necklace pendant,compass necklace,man pendant necklace,gold necklace man,silver necklace man,compass pendant,pendant for man,gift for him,onyx stone pendant,waterproof necklace",United States,2023-05-21,yes,no,no,DiViomo,https://www.etsy.com/listing/1486651919/18k-silver-turquoise-blue-pendant
"Dainty Pearl Necklace, 18k Gold Pearl Necklace, Tiny Pearl Necklace, Gold Pearl Necklace, Dainty Necklace, Bridesmaid Gift, Wedding Jewelry ",26.4,6,182,48,3,653,8,"bridesmaid gifts,gold necklace,dainty necklace,pearl chain necklace,gold pearl necklace,pearl jewelry,gold pearl choker,gift for her,wedding jewelry,bridesmaid jewelry,bridesmaid gift,gift for women,minimalist",United States,2023-04-14,yes,no,no,dylanraejewelry,https://www.etsy.com/listing/1446459520/dainty-pearl-necklace-18k-gold-pearl
Engraved Rings- Wedding Day Gift- Personalized Rings -Stacking Rings- Gift for Her- Rings for Women- Name Rings- Custom Rings- Wedding Ring ,13.0,6,294,46,7,521,21,"Graduation Gift,Personalized Ring,Wedding Ring,Wedding Day Gift,Engraved Gift,Custom Ring,Anniversary Gift,Friendship Gift,Birthday Gift,Gift for her,Gift for mom,Mother Day",United States,2023-03-25,yes,no,no,LimerenceNJ,https://www.etsy.com/listing/1446834657/engraved-rings-wedding-day-gift
Custom Text Engraved Dagger Pendant -Sterling Silver - Personalized Engraved Sword Pendant ,50.0,6,112,34,2,403,8,"dagger pendant,sterling silver,custom pendant,custom jewelry,name necklace,gifts for her,sword pendant,custom name pendant,personalized jewelry,gifts for him,custom text pendant",United States,2023-04-21,yes,no,no,lizlalune,https://www.etsy.com/listing/1451880944/custom-text-engraved-dagger-pendant
"Handmade Heishi Bead Bracelet Sets, Clay Bead Bracelets, Bracelet Stacks, Summer Boho Beach Jewelry, Surfer Bracelet, Vacation Bracelet ",15.0,6,224,27,1,775,22,"surfer bracelet,vacation bracelet,Heishi bracelet set,Heishi bracelet,beach bracelets,boho bracelet,stacking bracelets,beaded bracelet,stretch bracelet,beach bracelet,Heishi beads,gifts for her,colorful Heishi",United States,2023-05-11,yes,no,no,MySoCalCreations,https://www.etsy.com/listing/1479595245/handmade-heishi-bead-bracelet-sets-clay
Gold Zodiac Necklace (Unisex) ,34.0,6,612,165,7,1516,0,"zodiac necklace,mens zodiac chain,mens zodiac necklace,zodiac chain,zodiac jewelry,18k gold jewelry",United States,2023-05-05,yes,no,no,ChristinMarieStudio,https://www.etsy.com/listing/1461520516/gold-zodiac-necklace-unisex
To An Old Poet Necklace ,30.99,6,170,57,5,626,70,"Jewelry,Necklaces,Charm Necklaces",United States,2023-06-28,yes,no,no,moonnandearth,https://www.etsy.com/listing/1512504979/to-an-old-poet-necklace
Bearded Dragon Earrings • Hand-Painted • 3D Printed • Quirky • Funny • Weird • Dangle • Halloween • Gift ,14.69,6,32,8,1,541,60,"Bearded Dragon,beardies,animal skull earring,weird earring,dangle earring,fake gauges,3d printed,funny earrings,quirky earrings,gag gift,Pogona,vitticeps",United States,2023-05-28,yes,no,no,KookiStudios,https://www.etsy.com/listing/1491575485/bearded-dragon-earrings-hand-painted-3d
"Birth Flower Bracelet with Birthstone, Gold or Silver, Gift for Her, Mothers Day Gift, Birthday Gift, Bridesmaid Gift ",10.26,6,509,44,0,287,21,"birthstone bracelet,birth flower jewelry,Gift for Her,Mothers Day Gift,Birthday Gift,Bridesmaid Gift,best friend gift,gift for women,mom gift,anniversary gift,personalized gift,bridal party gift,CHAIN BRACELET",United States,2023-05-26,yes,no,no,SonjaJewellery,https://www.etsy.com/listing/1476145632/birth-flower-bracelet-with-birthstone
"Fingerspelling Name Necklace, Fingerspelling Word Necklace, Personalized, Customized, Stainless Steel, American Sign Language, ASL, ILY, ",55.0,6,90,17,0,270,33,"ILY,I love you necklace,ILY Necklace,Deaf Necklace,Sign Necklace,Sign Language,Deaf,Deaf Gifts,Deaf Community,Hand Pendant,Interpreter,Deaf Products,ILY Pendant",United States,2023-05-30,yes,no,no,SweetSignshine,https://www.etsy.com/listing/1492473757/fingerspelling-name-necklace
Silver Vintage Birth Month Flower Necklace Floral Silver Pendant WATERPROOF Jewelry Personalized Birthday Gift Minimalist Birth Flower Gift ,15.75,6,38,10,1,392,41,"maid of honor gift,bestfriend gift,layering necklace,waterproof necklace,dainty necklace,personalized jewelry,silver necklace,custom necklace,birthflower necklace,flower necklace,statement necklace,birth flower jewelry,gift for mom",United States,2023-05-24,yes,no,no,wavesjewels,https://www.etsy.com/listing/1488612009/silver-vintage-birth-month-flower
20G/18G/16G Star Push Pin Labret • Threadless Flat Back Earring • Tragus Stud • Helix Stud • Cartilage Stud • Nose Stud ,15.6,6,698,182,5,1967,73,"stud earrings,tiny stud earrings,dainty stud earrings,minimalist gold stud,threadless push pin,18g push pin stud,16g push pin stud,20g push pin stud,flat back stud,tragus stud,cartilage stud,conch stud,helix stud",United States,2023-03-26,yes,no,no,Aftersundaystudio,https://www.etsy.com/listing/1433019278/20g18g16g-star-push-pin-labret
Beautiful Rainbow CZs  cartilage piercing/Various Post Bar externally thread and 20G is available ,14.0,6,78,15,1,335,17,"cartilage piercing,helix stud,tragus stud,conch,tiny piercing,16G piercing,tragus piercing,16G cartilage,stud piercing,CZ piercing,rainbow piercing,rainbow earrings,colorful rainbow",United States,2023-06-02,yes,no,no,Mignonrose,https://www.etsy.com/listing/1494680105/beautiful-rainbow-czs-cartilage
"Sterling Silver Name Necklace with Balloon Letters, Bubble Jewelry, Personalized Dainty Name Necklace Gold, 3d Balloon Jewelry,  AU 37 ",25.8,6,171,21,1,279,20,"puff name necklace,bubble letter,bubble name necklace,name necklace,balloon necklace,balloon name,gift for mom,personalized jewelry,balloon letters,custom name necklace,initial necklace,silver name necklace",United States,2023-03-28,yes,no,no,Funufco,https://www.etsy.com/listing/1434908272/sterling-silver-name-necklace-with
Bloodstone Gemstone Bracelet | Protective Talisman | Strength + Courage | Root Chakra Stone | 6mm Gemstone Bracelet | ,24.0,6,107,24,3,245,18,"bloodstone,gemstone bracelet,encouragement,illness gifts,get well soon,rainy day apothecary,gemstone gifts,heliotrope,healing gifts,north carolina,metaphysical,body mind spirit,crystals",United States,2023-05-31,yes,no,no,rainydayapothecarync,https://www.etsy.com/listing/1493591137/bloodstone-gemstone-bracelet-protective
"Family Heart Rainbow Matching Bracelets, First Day of Kindergarten ",32.95,6,513,51,2,131,0,"rainbow,heart,adjustable,girl bracelet,bracelet,kindergarten,mom gifts,bracelets,braided bracelets,mother daughter,matching bracelets,back to school,mommy and me",United States,2023-06-05,yes,no,no,GiftsandKnots,https://www.etsy.com/listing/1482260576/family-heart-rainbow-matching-bracelets
MOVEABLE Dragonfly Brooch Dragonfly Pin Moving Wings  Dragonfly Brooch Wings that move Unisex ,14.0,6,54,14,2,130,13,"christmas gift,girl gift,gift for her,dragonfly brooch,dragonfly pin,vintage brooch,Insect brooch,Insect pin,Moving Wings,mother's day gift,MOVEABLE brooch,MOVEABLE dragonfly",United States,2023-06-27,yes,no,no,Melodylinen,https://www.etsy.com/listing/1511644815/moveable-dragonfly-brooch-dragonfly-pin
"Genuine Carnelian Necklace, Carnelian Tear Drop  Pendant, Healing Necklace, July Birthstone, Orange Gemstone Necklace, Gift for Mom ",25.72,6,209,27,1,330,24,"dainty necklace,handmade jewelry,Gemstone Necklace,Healing Necklace,carnelian necklace,gold minimalist,carnelian pendant,carnelian jewelry,red jasper necklace,crystal necklace,red stone gem,tear drop carnelian,carnelian minimalist",United States,2023-05-02,yes,no,no,lapetitemuse,https://www.etsy.com/listing/1459217438/genuine-carnelian-necklace-carnelian
Peace + Protection Bracelet | Raw Black Tourmaline • Amazonite • Selenite  | Protective Talisman | 6mm Gemstone Bracelet | ,26.0,6,85,19,2,248,23,"balance,rainy day apothecary,healing,inspiration,grief,spiritual,body mind spirit,good karma,black tourmaline,gifts,protection bracelet,encouragement gifts,friendship gifts",United States,2023-05-04,yes,no,no,rainydayapothecarync,https://www.etsy.com/listing/1475229593/peace-protection-bracelet-o-raw-black
Natural Bumblebee Jasper Stone Bracelet - 8mm Yellow Gemstone Stretch Bracelet Spiritual Healing Bracelet Anxiety Stress Relief Handmade ,10.9,6,222,35,1,289,14,"stretch bracelet,healing bracelet,spiritual bracelet,handmade bracelet,8mm beads bracelet,yoga bracelet,gift to her,bumblebee jasper,jasper bracelet,yellow jasper stone,meditation bracelet,natural yellow stone,sea sediment stone",United States,2023-05-15,yes,no,no,SofiaDesignsBoutique,https://www.etsy.com/listing/1482575633/natural-bumblebee-jasper-stone-bracelet
"Anime Movie Inspired Necklace, Adjustable Blue Chalcedony and Carnelian Gemstone Necklace, Unisex Anime Cosplay Necklace, Handmade Jewelry ",24.0,6,151,25,1,350,12,"anime necklace,gemstone necklace,halloween,handmade jewelry,cosplay necklace,unique gift,jewelry gift,birthday gift,anime earrings,cosplay earrings,drop necklace,blue necklace",United States,2023-04-01,yes,no,no,FelizJewelryArt,https://www.etsy.com/listing/1437691856/anime-movie-inspired-necklace-adjustable
Halloween Honey Bear & Piglet Earrings/Pooh Bear/Winnie The Pooh/Handmade/Stud Earrings/Nickel Free/Hypoallergenic ,6.37,6,35,10,1,131,17,"mouse earrings,Mickey Earrings,Minnie Earrings,Pooh Earrings,Tigger earrings,Piglet Earrings,Eeyore Earrings,Winnie the pooh,Hundred Acre Wood,Pooh Bear,Pooh Mouse Ears",United States,2023-06-23,yes,no,no,PineapplePixieDustCo,https://www.etsy.com/listing/1509239363/halloween-honey-bear-piglet-earringspooh
"Personalized Handwriting Ring, Actual Handwriting Ring, Minimalist Ring, Eternity Ring, Memorial Gift, Mothers Day Gift, Gift For Her ",21.99,6,272,38,1,803,31,"Actual Handwriting,Custom Handwriting,Personalized Ring,Handwriting Jewelry,Wedding Bands Women,Handwriting Rings,Personalized Gift,Memorial Ring,Couple Rings,engagement ring,promise ring,matching rings,Stackable Rings",United States,2023-04-10,yes,no,no,TiaMinimals,https://www.etsy.com/listing/1444008954/personalized-handwriting-ring-actual
"14k Gold Name Necklace, Personalized Gifts For Her, Nameplate Necklace, Custom Name Necklace, Personalized Jewelry for Women ",25.62,6,755,181,7,620,8,"Name Necklace Gold,Name Necklace,Name Jewelry,Dainty Name Necklace,Custom Name Necklace,14k Gold Necklace,Personalized Jewelry,Personalize Necklace,Gold Name Necklace,Gift for Mom,Personalized Gifts,Name Plate Necklace,necklace with name",United States,2023-03-24,yes,no,no,CustomGoldFlower,https://www.etsy.com/listing/1445761143/14k-gold-name-necklace-personalized
Heart Ear Weights Heart Ear Hangers 2g(6mm) Ear Lobe Piercing Ear Weights For Stretched Ears Heart Shape Jewelry ,19.95,6,258,18,1,406,23,"heart hangers,Ear Tapers,spirals,ear hangers,ear hanger,expander,ear weights,Piercing Ring,Gauge Piercing,heart jewelry,gauge weights,alternative jeweller",United States,2023-03-31,yes,no,no,Ashleysproduction,https://www.etsy.com/listing/1436916272/heart-ear-weights-heart-ear-hangers
Vintage Hoop Ear Weights Hoop ear Hanger Hoop Gauges 6g(4mm) Earrings for Stretched Ears Round Hoop Ear Weights ,22.95,6,245,29,3,387,19,"hoops,ear hangers,ear hanger,earweights,ear weights,hoop weights,vintage hoops,hanger,ear gauge,ear gauges,6g gauges,gauge and plug,ear stretcher",United States,2023-05-25,yes,no,no,Ashleysproduction,https://www.etsy.com/listing/1489377889/vintage-hoop-ear-weights-hoop-ear-hanger
Tiny Flower cz stud earrings - Cz stud earrings - Dainty stud earrings -Stud earrings -flower stud earrings -Tiny studs (PAIR) ,15.82,6,43,22,5,338,79,"handmade earring,gift for girlfriend,gift for daughter,earring for women,earring for wedding,small gold earring,Sterling silver stud,gold stud earring,dainty stud earring,minimalist gold stud,gold plated earring,tiny gold earring,flower stud",United States,2023-05-28,yes,no,no,AnotherEast,https://www.etsy.com/listing/1491196561/tiny-flower-cz-stud-earrings-cz-stud
Sterling Silver Hammered Circle Name Necklace | Custom Engraved Mom Necklace Pendant | Handmade Personalized Jewelry ,46.75,6,35,8,0,77,8,"personalize necklace,custom jewelry,engraved jewelry,custom keepsake,circle name necklace,necklace for mom,mom jewelry,family necklace,necklace for her,coordinates necklace,gift for her,mom necklace,silver name necklace",United States,2023-05-27,yes,no,no,LyndyLouDesigns,https://www.etsy.com/listing/1490778309/sterling-silver-hammered-circle-name
Herkimer Diamond Stud Earrings by Caitlyn Minimalist • Raw Crystal Earrings • Bohemian Gemstone Jewelry • Perfect Bridesmaid Gifts • ER342 ,18.55,6,112,34,2,644,110,"CAITLYN MINIMALIST,MINIMALIST EARRINGS,DAINTY EARRINGS,GEMSTONE EARRINGS,STUD EARRINGS,LIGHTWEIGHT EARRINGS,EVERYDAY EARRINGS,DIAMOND EARRINGS,RAW CRYSTAL EARRINGS,GEMSTONE JEWELRY,BRIDESMAID GIFTS,GIFT FOR HER,HERKIMER DIAMOND",United States,2023-05-16,yes,no,no,CaitlynMinimalist,https://www.etsy.com/listing/1468862390/herkimer-diamond-stud-earrings-by
"Bible Verse Morse Code Bracelet, Jeremiah 29-11 or any other bible verse. Customizable with silver and gold filled beads for every day wear ",24.5,5,27,5,1,86,20,"get well soon,get well gift,be strong,encouragement,strength Morse code,hope motivation,Friendship Gift,Morse Code Bracelet,Friend Gift,Strength Bracelet,jeremiah 29,bible verse bracelet,morse code custom",United States,2023-07-08,yes,no,no,MorseandDainty,https://www.etsy.com/listing/1518958039/bible-verse-morse-code-bracelet-jeremiah
"Beasts Library, Laser Cut Dangle Earrings , Bookshelf patterned Crystal Acrylic Earrings, Dangle Earrings, Belle inspired earrings ",9.6,5,162,39,2,230,11,"mickey earrings,glowforge earrings,laser cut,laser earrings,handmade earrings,bookcase earrings,beauty and the beast,book earrings,bookworm",United States,2023-06-03,yes,no,no,MagicWares,https://www.etsy.com/listing/1495307181/beasts-library-laser-cut-dangle-earrings
"Stunning Cream Flower Earrings, Flower with Center Studs, Floral Dainty Earrings, Perfect Weather Jewelry, Perfect Gift, Earrings for Women ",11.99,5,118,12,1,323,28,"flower earrings,floral earrings,flower svg,flower jewelry,floral designs,summer jewelry,beach jewelry,floral dress,floral arrangements,flower girl dress",United States,2023-04-09,yes,no,no,LaurenLotusShop,https://www.etsy.com/listing/1443310842/stunning-cream-flower-earrings-flower
Eras Tour Bracelets Gold Collection | Eras Tour Friendship Bracelets | Custom Name Bracelet | Custom Word Bracelet | Custom Bracelet ,10.0,5,153,11,0,225,25,"Eras Tour,Swiftie,friendship bracelet,friendship bracelets,Eras Taylor,eras tour bracelet,swiftie tour merch,custom word bracelet,custom bracelet,eras bracelet",United States,2023-03-29,yes,no,no,AllTooWellBracelets,https://www.etsy.com/listing/1449672705/eras-tour-bracelets-gold-collection-eras
Kpop pin sets group band / Badges/ Stray Kids / Ateez / Blackpink / Seventeen / New Jeans / Twice /Kpop Band / Kpop Merch ,6.4,5,197,32,2,548,10,"Kpop merch,Kpop,kpop pc holder,kpop pins,ateez pin,stray kids pin,kpop badge,blackpink pin,twice pin,new jeans,new jeans merch,seventeen pin",United States,2023-04-27,yes,no,no,shopgoldencarat,https://www.etsy.com/listing/1455884276/kpop-pin-sets-group-band-badges-stray
Skye Kite Green Moss Agate Ring- 14K Rose Gold Vermeil Natural Agate Engagement Ring- Promise Ring Green Gemstone Anniversary Gift For Her ,95.0,5,129,32,2,1650,98,"green moss agate,green agate ring,kite ring set,engagement ring,birthday gift,October birthstone,Dainty promise ring,GIFTS FOR HER,GIFTS FOR MOM,PERSONALIZED RING,CUSTOM NAME JEWELRY,GIFT FOR WIFE,PERSONALIZED GIFTS",United States,2023-05-17,yes,no,no,Aquamarise,https://www.etsy.com/listing/1483593047/skye-kite-green-moss-agate-ring-14k-rose
Non-Piercing Nipple Loop Adjustable Ring Fake Body Jewelry For Women - Best Seller ,16.48,5,164,26,3,294,9,"breast jewelry,breast piercing,faux piercing,Fake piercing,nipclip",United States,2023-04-28,yes,no,no,AllBodyArt,https://www.etsy.com/listing/1470804969/non-piercing-nipple-loop-adjustable-ring
"New In Box Vivienne Westwood Necklace,Gift For Her ",33.27,5,234,24,2,380,10,"vivienne westwood,westwood necklace,vivienne necklace,Orb chain,saturn necklace,Saturn Pendants,Saturn jewelry,space necklace,Gifts,Silver Chain,Silver Necklace,Silver Saturn,viviennewest",United States,2023-05-19,yes,no,no,NGBestWish,https://www.etsy.com/listing/1471498634/new-in-box-vivienne-westwood
"Mirrorball Star Earrings, Disco Ball Earrings, Mirror Ball Earrings, Discoball Earrings, Silver Star Earrings ",8.99,5,286,45,0,284,19,"mirror ball,mirrorball Earrings,mirror ball earrings,eras tour,swifties,mini tiny small,midnights,renaissance tour,dangle drop earrings,I am a mirrorball",United States,2023-04-06,yes,no,no,aMAYSEingDesignCo,https://www.etsy.com/listing/1440879012/mirrorball-star-earrings-disco-ball
"Honeycomb Necklace, Geometry Shape, Layering Necklace, Birthday Necklace, Gift For Her, ",22.0,5,184,14,0,236,21,"Brass Necklace,Honeycomb,Bee,Friends Necklace,Birthday Gift,Animals Necklace,Family Gift,Mothers Day Sale,Math Gift,bridesmaid,Layering Necklace,Naturel,For On",United States,2023-05-12,yes,no,no,LibraMinimalist,https://www.etsy.com/listing/1480803975/honeycomb-necklace-geometry-shape
Opal Inlay Huggie Hoops by Caitlyn Minimalist • Black Opal Hoops • Everyday Earrings • Gift for Her • ER212 ,22.05,5,98,28,4,261,19,"CAITLYN MINIMALIST,HUGGIE EARRINGS,DAINTY EARRINGS,OPAL EARRINGS,OPAL JEWELRY,GEMSTONE EARRINGS,BLACK EARRINGS,PINK EARRINGS,PURPLE EARRINGS,SUMMER JEWELRY,GIFT FOR HER,BIRTHDAY GIFT,LAVENDER EARRINGS",United States,2023-07-05,yes,no,no,CaitlynMinimalist,https://www.etsy.com/listing/1502511710/opal-inlay-huggie-hoops-by-caitlyn
Soccer Charms. Futbol charms. Cute charms for soccer lovers ,4.0,5,425,79,6,145,11,"shoe charms,Cr7,messi,haaland,manchester city,mbappe,soccer charm,chelsea charm,liverpool charm,manchester,USA charm,Real madrid,Cristiano charm",United States,2023-05-27,yes,no,no,EZtoPick,https://www.etsy.com/listing/1490859803/soccer-charms-futbol-charms-cute-charms
"Fishing Line-Whiskey Barrel & Deer Antler Wedding Band, Mens Outdoor Hunting Ring, Mens Promise Rings ",81.59,5,182,37,3,221,10,"men anniversary ring,mens birthday gift,custom engraving,mens engagement ring,Mens Hunting Ring,Mens Outdoor Ring,Mens Fishing Ring,Outdoor Mens Gift,thin blue line ring,whiskey barrel ring,mens wedding band,fishing hunting gift,fishing line ring",United States,2023-04-27,yes,no,no,TheBoldRingCo,https://www.etsy.com/listing/1455612502/fishing-line-whiskey-barrel-deer-antler
