title,"price(""$"")",7-day sales,total_sales,total_reviews,7-day reviews,total_favorites,7-day favorites,tags,Ship From,release time,Best Seller,Etsy pick,Raving,store name,product_url
"Good Egg Earrings, Bad Seed Earrings, Smart Cookie Earrings, Cool Bean Earrings, Couch Potato Earrings, Teacher Earrings, Teacher Gift ",8.0,3,180,19,0,159,17,"Jewelry,Earrings,Dangle & Drop Earrings",United States,2023-03-26,yes,no,no,SunKissedCoraBout,https://www.etsy.com/listing/1433015970/good-egg-earrings-bad-seed-earrings
Natural Gemstone Smooth Round Beaded Elastic Bracelet Size 4mm 7.5'' Length ,1.99,3,180,64,8,133,6,"Gemstone Bracelet,Beaded Bracelet,Elastic Bracelet,Amazonite Bracelet,Angelite Bracelet,Tourmaline Bracelet,Tiger Eye Bracelet,Turquoise Bracelet,Yooperlite Bracelet,Amethyst Bracelet,Sodalite Bracelet,Morganite Bracelet,Garnet Bracelet",United States,2023-03-25,yes,no,no,CrcbeadsShop,https://www.etsy.com/listing/1446779423/natural-gemstone-smooth-round-beaded
"Selenite Minimalist Crystal Necklace 14K Gold Plated, Gemstone Jewelry for Her, Selenite Dainty Necklace , Crystal Necklaces ",26.29,3,122,15,1,159,11,"crystal necklace,healing jewelry,crystal jewelry,raw necklace,14k gold necklace,18k gold necklace,gemstone necklace,crystal pendant,selenite,selenite necklace,selenite crystal,selenite jewelry",United States,2023-05-10,yes,no,no,lapetitemuse,https://www.etsy.com/listing/1464602230/selenite-minimalist-crystal-necklace-14k
"Devil Eye Charm, authentic pandora bracelet, Charms for Bracele, Girl Dangle Charm, Patronus Charm ",13.84,3,88,7,3,212,35,"Gifts for Her,Pandora Bracelet,Charm Bracelet,Pandora Beads,Patronus Charm,Silver Bracelets,Bracelet Charms,Pandora Charm,Best Gifts,Girl Dangle Charm,charm bracelets,DIY Bracelet Charms,good luck bracele",United States,2023-05-10,yes,no,no,BestWishDesigns,https://www.etsy.com/listing/1479158865/devil-eye-charm-authentic-pandora
"Pearl Drop Earrings, Baroque Pearl Earrings, Vintage Style Earrings, Pearl Jewelry, Wedding Earrings, Bridesmaid Gifts, Bridal Earrings ",32.0,3,368,54,5,1322,5,"pearl earrings,wedding earrings,pearl jewelry,pearl drop earrings,baroque pearl,bridal earrings,gold earrings,bridesmaid gifts,handmade jewelry,minimalist earrings,dangle earrings,vintage jewelry,mothers day gift",United States,2023-04-23,yes,no,no,StayChicJewelry,https://www.etsy.com/listing/1453315210/pearl-drop-earrings-baroque-pearl
Gold Cherry Earring Jackets - Handmade - Lightweight Statement Earrings - Unique Design ,35.0,3,114,20,1,219,7,"FoxCraftCustom,Liz Fox Roseberry,ear jackets,behind the ear,earring jackets,Handmade Jewelry,Earring attachment,cherry earrings,cherries,summer earrings,statement earrings,funky",United States,2023-04-23,yes,no,no,FoxCraftCustomShop,https://www.etsy.com/listing/1453127568/gold-cherry-earring-jackets-handmade
"High Quality Four Leaf Clover Earrings,White Mother of Pearl Earrings,Flower Stud,Gift For Her ",23.96,3,145,28,0,162,7,"clover earrings,lucky earrings,four leaf earrings,Silver earrings,Gold earrings,Rose Gold earrings,flower earrings,luxury earrings,wedding earrings,party earrings,graduation earrings,mother of pearl,white shell earrings",United States,2023-03-21,yes,no,no,BestNecklacesDesign,https://www.etsy.com/listing/1443887873/high-quality-four-leaf-clover
"ID Bracelet for Baby, Personalized Infant Bracelet, Call Me By my name Braclet, Name Braclet Baby, Name Bracelet Girl, Girls Jewellery, ",24.0,3,76,5,1,270,21,"Kids NAmeplate,Baby Name Bracelet,Bracelet infant girl,Girls Name Bracelet,Nameplate Jewellery,Infant Name Bracelet,Baby Bracelet Gold,Custom kid bracelet,kids name bracelet,girl name bracelet,toddler bracelet,Braclet For Baby,Gold Baby Braclet",United States,2023-03-31,yes,no,no,WritzJewelry,https://www.etsy.com/listing/1436725234/id-bracelet-for-baby-personalized-infant
Italian 925 Solid Sterling Silver Herringbone Chain Necklace Unisex ,22.4,3,270,38,0,140,8,"Sterling Silver,Silver Chain,Silver Necklace,Chain Necklace",United States,2023-03-31,yes,no,no,DonatelloShop,https://www.etsy.com/listing/1450818455/italian-925-solid-sterling-silver
Evil Eye DAINTY Miyuki Bead ,10.0,3,104,17,0,144,13,"Adjustable bracelet,dainty evil eye,dainty bracelet,minimal bracelet,Kabbalah bracelet,Nazar,evil eye bracelet,protection bracelet,good luck bracelet,pulsera mal de ojo,Greek evil,Mati,glam evil eye",United States,2023-05-25,yes,no,no,PaulaCuoreShop,https://www.etsy.com/listing/1489145443/evil-eye-dainty-miyuki-bead
"Natural Obsidian Ring, Gemstone Ring, Crystal Rings, Solid Band Ring ",8.09,3,93,19,2,162,18,"black,good luck",United States,2023-04-24,yes,no,no,HappinessJewelsCo,https://www.etsy.com/listing/1453529956/natural-obsidian-ring-gemstone-ring
"Ring Holder Necklace, Gold Plated Ring Holder Necklace, Minimalist Ring Keeper Necklace For Doctor, Nurse And Women, Gift For Her ",21.89,3,172,17,2,171,21,"Gold Ring Holder,Ring Holder Necklace,Necklace Holder Ring,Holder Ring Necklace,Necklace Ring Holder,Ring Keeper Necklace,geometric necklace,pendant necklace,ring necklace holder,minimal necklace,minimal jewellery,minimalist jewelry,Holder Necklace Ring",United States,2023-05-24,yes,no,no,DeziJewelry,https://www.etsy.com/listing/1488465707/ring-holder-necklace-gold-plated-ring
Ear Weights Ear Hangers Ear Weight Hangers Ear Weight Hoop Heavy Ear Weight Jewelry Stretched Ear Guage Earrings ,19.95,3,99,14,0,263,11,"hoops,Ear Tapers,ear hangers,ear hanger,expander,earweights,ear weights,weighted gauges,hoop earrings,magnetic hoops,gauge jewelry,weighted jewelry",United States,2023-03-31,yes,no,no,Ashleysproduction,https://www.etsy.com/listing/1436958738/ear-weights-ear-hangers-ear-weight
"Three Layer Necklace, Minimalist Layered Necklace Set, Tiny Chain Necklaces, Layering Necklaces, Gold Necklace Set, Silver Necklace Sets ",15.0,3,82,6,1,145,22,"Layered necklaces,Silver necklaces,Layering necklaces,three Layer necklace,Simple gold necklace,gifts for her,dainty jewelry,delicate necklace,Layer necklace set,3 Layer necklace,tiny chain necklaces,delicate necklaces,dainty link necklace",United States,2023-04-28,yes,no,no,LuxJewy,https://www.etsy.com/listing/1456363038/three-layer-necklace-minimalist-layered
20G/18G/16G Climber Push Pin Labret  •  Threadless Flat Back Earring • Tragus Stud • Flat Back Stud • Helix Stud •Cartilage Stud ,14.8,3,52,147,23,1870,215,"stud earrings,tiny stud earrings,dainty stud earrings,minimalist gold stud,threadless push pin,16g push pin stud,20g push pin stud,flat back stud,tragus stud,cartilage stud,conch stud,helix stud,18g push pin stud",United States,2023-07-03,yes,no,no,Aftersundaystudio,https://www.etsy.com/listing/1501258040/20g18g16g-climber-push-pin-labret
"14K Gold Custom Name Necklace , Dainty Gold Necklace , Mother's Day Necklace , Gift For Her , Personalized Necklace , Handmade Jewelry Gift ",51.6,3,465,123,5,552,5,"name necklace,handmade jewelry,handmade gift,custom name necklace,dainty gold necklace,mothers day necklace,mothers day gift,gift for her,personalize necklace,14k gold necklace,gold name necklace,silver name necklace,gift for women",United States,2023-04-04,yes,no,no,AngelMinimalist,https://www.etsy.com/listing/1454232187/14k-gold-custom-name-necklace-dainty
Texas Shoe charms. Gun shoe charm. Pistol Shoe charm. 2nd Amendment Charm. Texas map charm. Military charm. The Alamo. AK47 charm. 2A charms ,2.0,3,212,25,0,79,1,"shoe charms,bandera mexicana,mexico,san antonio,2nd Amendment charm,the alamo charm",United States,2023-05-10,yes,no,no,EZtoPick,https://www.etsy.com/listing/1478962485/texas-shoe-charms-gun-shoe-charm-pistol
"60th Birthday Gift, 60th Birthday Gift For Women, 60th Birthday Necklace, 60th Birthday Jewelry, 60th Birthday Gift Ideas, Gifts for 60th ",45.0,3,181,26,0,132,7,"60th birthday,happy 60th birthday,60th birthday gift,women turning 60,birthday necklace,60th birthday ideas,gifts for 60th,unique 60th birthday,60 birthday necklace,sixty birthday ideas,60th birthday wishes,love knot necklace,happy sixty birthday,60th birthday woman,60 birthday jewelry,60 birthday gifts",United States,2023-03-30,yes,no,no,BaeAndFriends,https://www.etsy.com/listing/1450043395/60th-birthday-gift-60th-birthday-gift
"Titanium Double Chain Earrings, Non Tarnish, Implant Grade Titanium Waterproof Earrings, Vintage Style Earrings, Minimalist ",23.85,3,95,10,1,184,14,"titanium earrings,titanium studs,titanium earring,stainless earrings,no tarnish earrings,cool earrings,waterproof earrings,minimal earrings,sensitive earrings,non tarnish earrings,earrings titanium,heart earrings",United States,2023-05-04,yes,no,no,OhlalajewelryUS,https://www.etsy.com/listing/1475209197/titanium-double-chain-earrings-non
College Emblem Signet Ring by Caitlyn Minimalist • Bold Custom Engraved Class Ring • Chunky Statement Ring • Perfect Graduation Gift • RM77 ,24.5,3,144,66,2,689,27,"CAITLYN MINIMALIST,ENGRAVED RING,CUSTOM JEWELRY,HANDMADE JEWELRY,PERSONALIZED GIFT,COLLEGE RING,CLASS RING,SIGNET RING,STATEMENT RING,CHUNKY RING,MINIMALIST RING,PINKY RING,GRADUATION GIFT",United States,2023-03-21,yes,no,no,CaitlynMinimalist,https://www.etsy.com/listing/1443260617/college-emblem-signet-ring-by-caitlyn
"New In Box Vivienne Westwood Earrings,Silver Pin Earrings,Gift For Her ",31.92,3,51,4,0,153,13,"Gift For Him,Silver Earrings,Silver Stud,saturn Earrings,Silver Saturn,Friend Gift,Pin stud,Gifts,vivienne westwood,vivienne Earrings,westwood Earrings,viviennewest",United States,2023-05-20,yes,no,no,NGBestWish,https://www.etsy.com/listing/1486218469/new-in-box-vivienne-westwood
"Anime Croc Charms 18 Styles, Anime Jibbitz, High Quality, ",2.25,3,216,19,1,231,5,"jibbitz,croc jibbitz,anime,anime charms,anime jibbitz,jujutsu kaisen,jujutsu kaisen charm,jujutsu kaisen pin,Naruto,naruto jibbitz,naruto stickers,croc charms anime,jibbitz anime",United States,2023-04-06,yes,no,no,thetrendcollectionn,https://www.etsy.com/listing/1455263241/anime-croc-charms-18-styles-anime
"Mommy and Me Blue Macrame Matching Bracelets, First Day of School ",16.0,3,356,40,4,265,3,"first day of school,dinosaur,blue,adjustable,girl bracelet,bracelet,kindergarten,bracelets,braided bracelets,mother daughter,matching bracelets,back to school,mommy and me",United States,2023-03-28,yes,no,no,GiftsandKnots,https://www.etsy.com/listing/1448550091/mommy-and-me-blue-macrame-matching
"14K Gold Dainty Initial Tag Necklace , Custom Engraved Letter Pendant Necklace in Box Chain ,Bridesmaid Gift ,Gold Bar Necklace with Initial ",53.2,3,22,5,0,119,18,"name necklace,initial necklace,gift for her,personalized gift,best friend gift,letter necklace,charm necklace,bar necklace,bridesmaids gift,dainty necklace,engraved necklace,custom necklace,gold letter necklace",United States,2023-06-14,yes,no,no,GoldChicJewelry,https://www.etsy.com/listing/1503314747/14k-gold-dainty-initial-tag-necklace
Turquoise Blue Silicone Rubber Bracelets · Waterproof Beachy Surf Bracelet · Friendship Stackable Bracelet for Men and Women and Teens ,8.0,3,458,45,1,67,1,"blue bracelets,silicone bracelets,friendship bracelets,rubber bracelets,rubber band bracelet,waterproof bracelet,beachy bracelet,surf bracelet,bracelet for women,colorful bracelet,stackable bracelet,stacking bracelets,bracelets for women",United States,2023-04-18,yes,no,no,HuedBracelets,https://www.etsy.com/listing/1463610913/turquoise-blue-silicone-rubber-bracelets
RBD Rebelde metal enamel pin Tecate pin USVT sad heart shaped pin Bad Bunny Rebelde novelas latina Mía Colucci Mexican hat pins metalic pin ,6.99,3,167,10,0,201,25,"latino,Mexican,metallic,bad bunny,un verano sin ti,UVST,latina,pins,tecate,rbd,enamel pin,pin",United States,2023-03-19,yes,no,no,ConHuevosMex,https://www.etsy.com/listing/1427618688/rbd-rebelde-metal-enamel-pin-tecate-pin
ROTTMNT 4 Pack Button Pin Set ,6.0,3,95,17,2,540,36,"Circle,Purple,Orange,Button pin,Accessory,Cute,Rottmnt",United States,2023-06-01,yes,no,no,SamsCustomPins,https://www.etsy.com/listing/1479988652/rottmnt-4-pack-button-pin-set
"High Quality Four Leaf Clover Bracelets,Black Onyx Bracelets,Gift For Her ",26.35,3,461,44,1,201,6,"clover Bracelets,clover Chain,Silver Bracelets,Gold Bracelets,Rose Gold Bracelets,Gifts For Her,luxury Bracelets,wedding bracelet,party bracelet,graduation bracelet,Black Onyx Bracelet",United States,2023-03-24,yes,no,no,BestNecklacesDesign,https://www.etsy.com/listing/1432023972/high-quality-four-leaf-clover
"Dainty Mimi Necklace, Sterling Silver, Gold, Mimi Necklace, Gift for Grandma, Minimalist Mimi Monogram, Gift for New Nana, Mothers Day Gift ",23.2,3,258,37,0,152,11,"GIFT FOR MOM,NAME NECKLACE,MOM JEWELRY,Mama Necklace,Nana Necklace,New Nana Gift,Grandma Gift,Gifts for Nana,Dainty Nana Necklace,New Mimi Gift,Mothers Day Mimi,Mother's Day Gift,Script Mimi Necklace",United States,2023-04-17,yes,no,no,APersonalizedJewelry,https://www.etsy.com/listing/1462985159/dainty-mimi-necklace-sterling-silver
"Personalized Wedding Ring Box, Wide Wood Double Ring Box, Ring Bearer Box, Slim Unique Ring Holder, Ring Box Proposal, Modern Rustic Wedding ",11.67,3,128,13,1,251,19,"Wedding Ring Box,wooden ring box,Proposal Ring Box,Ring Box Holder,custom ring box,Ring box displays,Engraved ring box,Double ring box,Bride and groom gift,Bridal Shower Gift,Monogram Ring Box,Mr and Mrs Ring Box,Walnut Ring Box",United States,2023-05-18,yes,no,no,EncounterCraftshop,https://www.etsy.com/listing/1484739705/personalized-wedding-ring-box-wide-wood
"Stylish Fox Necklace, Handcrafted Woodland Charm, Sterling Silver Pendant - Perfect Gift for Fox Lovers, Unique Boho Jewelry ",21.87,3,40,11,1,234,21,"Fox Necklace,Animal Jewelry,Nature Inspired,Wildlife Lover,Handcrafted Pendant,Sterling Silver,Gift for Her,Boho Style,Woodland Charm,Unique Design,Fashion Accessories,Fox Lover",United States,2023-06-19,yes,no,no,LaPerlaSilver,https://www.etsy.com/listing/1492433506/stylish-fox-necklace-handcrafted
"Vintage Opal Stud Earrings, Tiny Opal Stud Earrings, Moonstone Stud, S925 Silver and Gold Earrings, Tiny Gemstone Studs, Women's Earrings ",18.85,3,113,6,0,372,19,"opal stud earrings,opal stud,vintage stud earring,stud earrings,tiny earrings,dainty earrings,minimalist earrings,gold stud earrings,silver stud earrings,opal earrings,vintage earrings,tiny stud earrings,gemstone earrings",United States,2023-05-15,yes,no,no,QuaintAndQuality,https://www.etsy.com/listing/1468195026/vintage-opal-stud-earrings-tiny-opal
BRAIDED DESIGN Champagne lucky stacking layering Thai temple jewelry   waterproof classy bracelet lightweight bangle charm all weather bling ,30.0,3,149,28,0,205,11,"Mothers Day,braided bracelet,party favors,gift bags,stackable bracelets,bangle",United States,2023-05-11,yes,no,no,DanouchaDesign,https://www.etsy.com/listing/1480015063/braided-design-champagne-lucky-stacking
Opal Inlay Huggie Earrings • Fire Opal Hoop Earrings • Dainty Handmade Gemstone Earrings • Gift for Her • ,22.79,3,435,93,1,822,6,"CAITLYN MINIMALIST,HUGGIE EARRINGS,HANDMADE JEWELRY,DAINTY EARRINGS,ELEGANT EARRINGS,OPAL EARRINGS,OPAL JEWELRY,GEMSTONE EARRINGS,GIFT FOR HER,MOTHERS DAY GIFT,BLUE EARRINGS,GREEN EARRINGS,WHITE EARRINGS",United States,2023-05-15,yes,no,no,MeraShopUS,https://www.etsy.com/listing/1482323989/opal-inlay-huggie-earrings-fire-opal
"Pink Croc Charms, Choose your own trendy croc shoe charms, Pink Croc jibbitz, Shoe charms, Popular now Croc jibbitz, Girls Pink croc charms ",2.75,3,354,19,0,358,9,"croc charms,clog charms,charms for crocs,croc compatible,croc jibbitz,trending gift,adult croc charms,summer jibbitz,pink croc charms,pink croc jibbitz,pink shoe charms,gilrs pink jibbitz,all pink croc charms",United States,2023-05-22,yes,no,no,LynnesLoftCo,https://www.etsy.com/listing/1473036792/pink-croc-charms-choose-your-own-trendy
Hug from Heaven Gift from Angel Wings Necklace Gift from Heaven Birthday Christmas Keepsake Letter from Heaven Sympathy Condolence Gift ,22.6,3,294,71,1,640,14,"Hug from Heaven,Gift from Heaven,Angel Wings Necklace,Birthday Gift,gift from angel,Christmas Gift,Keepsake gifts,Letter from Heaven,Sympathy gift,Condolence Gift,Memorial Gifts,from passed dad,from passed mom",United States,2023-04-10,yes,no,no,WhiteCarnationDesign,https://www.etsy.com/listing/1458219313/hug-from-heaven-gift-from-angel-wings
"Hoop Earrings for Men, Huggie Earrings, Sleeper Earrings, Men Jewelry, Mens Earrings, Mens Hoop Earrings, Fathers Day Gift, Gift for Him ",21.0,3,24,10,1,105,5,"sleeper earrings,hoops for men,earrings for men,gift for him,men jewelry,mens hoop earrings,mens earrings,huggies for men,waterproof earrings,gift for boyfriend,gold hoops,everyday earrings,simple earrings",United States,2023-05-31,yes,no,no,URGlden,https://www.etsy.com/listing/1478900492/hoop-earrings-for-men-huggie-earrings
TaylorSwift Album Bracelets / Friendship Bracelets / Eras Tour Accessories / Swiftie Merch Jewelry ,6.0,2,416,76,0,376,1,"friendship bracelets,Eras Tour,Midnights,Evermore,Lover,Reputation,1989,Red,Speak Now,Fearless,taylorswift,swiftie",United States,2023-04-02,yes,no,no,BeadsatMidnight,https://www.etsy.com/listing/1438126458/taylorswift-album-bracelets-friendship
"Black and Silver Round Stud Earrings for Men and Women, Stainless Steel Stud Earrings, Dumbbell Stud Earrings, Minimalist Earrings ",7.49,2,220,30,1,357,3,"black stud earrings,silver stud earrings,stainless steel,unisex earrings,earrings for men,earrings for women,round stud earrings,dumbbell earrings",United States,2023-03-23,yes,no,no,EleganJewelryUS,https://www.etsy.com/listing/1430918372/black-and-silver-round-stud-earrings-for
"Taylor Swift Inspired Eras Tour Friendship Beaded Bracelets, Gift for Swiftie, Tradable Bracelets Taylor Swift Eras Tour ",6.6,2,1843,478,0,982,5,"eras tour merch,swift bracelet,friendship bracelet,eras tour,eras tour jewelry,beaded bracelets",United States,2023-04-03,yes,no,no,BestieBeadz,https://www.etsy.com/listing/1439047528/taylor-swift-inspired-eras-tour
"Empowerment Bracelet: Amethyst, Black Obsidian, & Sodalite Combo, 8 mm Round Courage and Confidence Crystals (Crystal Bracelet) ",10.95,2,31,18,0,230,7,"Gemstone Bracelet,Healing Bracelet,Gemstone Jewelry,Stretch Bracelet,Amethyst Bracelet,Amethyst Jewelry,Protection Bracelet,Black Obsidian,Obsidian Bracelet,Sodalite Bracelet,Anxiety Bracelet,Black Obsidian Beads,Beaded Bracelet",United States,2023-04-14,yes,no,no,Worldincensestore,https://www.etsy.com/listing/1446476384/empowerment-bracelet-amethyst-black
The Original UFO Alien Cow Abduction Retractable Badge Reel with Glowing Beam Funny Alligator or Belt Clip | Glow in the Dark | Gift Nurses ,26.99,2,138,27,3,229,5,"badge reel,retractable badge,alien badge reel,glitter badge reel,cute badge reel,unique badge reel,space badge reel,ufo cow abduction,funny badge reel,Glow in the dark,nurse badge reel,nurse graduation,cryptid badge reel",United States,2023-05-16,yes,no,no,Hayhayshandmade,https://www.etsy.com/listing/1483020257/the-original-ufo-alien-cow-abduction
Personalized Wedding Gift / Speckled Minimalist Ring Dish / Jewelry Dish  / Engagement Gift / Bridesmaids Gift / Personalized Gift for Her / ,19.0,2,66,18,5,91,12,"Wedding Gift,Bridesmaids Gift,Engagement Gift,Jewelry Dish,Ring Dish,Gift for Couple,Personalized Gift,Personalized Jewelry,Personalized Ring,Gift for Bride,Jewelry Display,Gift for mom,Anniversary Gift",United States,2023-07-01,yes,no,no,ThePaintedPress,https://www.etsy.com/listing/1500263950/personalized-wedding-gift-speckled
Friendship Bracelet Gold filled Inspirational Jewelry/ Meaningful Gift/ group friend gift/ Best Friend Gift LL ,17.0,2,116,26,4,191,5,"quote jewelry,friend gift,unique gift,bridesmaid gift,wish bracelet,friendship bracelet,friend christmas,layering bracelet,adjustable bracelet,sterling bracelet,string bracelet,ankle bracelet,meaningful gift",United States,2023-04-20,yes,no,no,VERSETHREE,https://www.etsy.com/listing/1465584587/friendship-bracelet-gold-filled
"Rope Chain Necklace, Twisted Rope Chain, Rope Chain Necklace, Gold Chain, Layering Necklace, Gold Rope Chain, 2mm 3mm 4mm 5mm Chain for Men ",22.05,2,131,23,1,166,3,"rope chain necklace,rope chain choker,layering necklace,gift for him,gift for her,thick rope chain,gold chain,twisted rope chain,mothers day gift,rope necklace,waterproof chain,dainty gold necklace,chain for men",United States,2023-05-04,yes,no,no,URGlden,https://www.etsy.com/listing/1474634977/rope-chain-necklace-twisted-rope-chain
"Dainty Tag Necklace 14k Solid Gold & 925 Silver Bar Necklace Anniversary Gift Custom Name, Initial, Date Necklace Bridesmaid Necklace Gift ",23.25,2,82,10,2,127,18,"personalize necklace,anniversary gift,engraved necklace,name tag necklace,custom name necklace,Initial Tag Pendant,Dog Tag Charm,Gold Tag Necklace,bar necklace,Gold Mini Tags Gift,date bar necklace,14k gold necklace,dainty neclace",United States,2023-03-19,yes,no,no,moysoro,https://www.etsy.com/listing/1427542556/dainty-tag-necklace-14k-solid-gold-925
2mm Clip On Hoop Earrings No Piercing Hoop Earrings Basic Hoop Earrings Gold/Steel/Silver Color Non Pierced Gold Earrings 11-60mm Hoop ,17.95,2,344,35,0,411,5,"Cartilage earring,minimalist hoops,aesthetic hoops,no piercing hoops,ear clip earring,clip on earrings,gold clip on hoops,silver clip on hoops,black clip on hoops,no piercing ear cuff,simple clip on hoops,plain clip on hoops,2mm clip on hoops",United States,2023-04-06,yes,no,no,Ashleysproduction,https://www.etsy.com/listing/1441220378/2mm-clip-on-hoop-earrings-no-piercing
"Crystal Bracelet,Stretchy Chip Bracelet, Chakra Crystal Bracelet, Healing Crystal Chip Bracelet, Gift Crystal Bracelets.Handmade Bracelet ",2.33,2,226,56,0,68,2,"Gemstone Bracelet,Healing Bracelet,Gemstone Jewelry,Beaded Bracelet,Stretch Bracelet,Protection Bracelet,crystal bracelet,raw crystal bracelet,crystal jewelry,friendship bracelet,charm bracelet,mens bracelet,citrine bracelet",United States,2023-04-02,yes,no,no,MtShastaEnergy,https://www.etsy.com/listing/1452657445/crystal-braceletstretchy-chip-bracelet
"Tiny Bar Necklace, Custom Necklace, Dainty Bar Necklace Gift For Her, Handmade Jewelry, Personalized Gifts, Gifts for Women, Gold Necklace ",30.0,2,335,43,8,251,12,"gold bar necklace,name bar necklace,personalized jewelry,bar necklace,custom necklace,custom bar necklace,Personalized bar,personalized gifts,Name plate,Tiny bar necklace,Handmade Jewelry,personalized gift,name plate necklace",United States,2023-04-13,yes,no,no,CustomBrites,https://www.etsy.com/listing/1445686334/tiny-bar-necklace-custom-necklace-dainty
Batman and cat woman matching beaded bracelets ,8.99,2,64,13,1,412,58,"bat,catwoman,cat,matching braceletes,couple bracelets",United States,2023-07-10,yes,no,no,LluviaJewels,https://www.etsy.com/listing/1505840916/batman-and-cat-woman-matching-beaded
925 Sterling Silver Engraved Mens Cross Necklace - Personalized Cross Pendant Necklace for Men - Custom Fathers Day Gift - Cross Jewelry ,25.5,2,153,22,3,177,8,"men necklace,gift for boyfriend,fathers day gift,necklace for men,gift for father,men jewelry,cross necklace,cross pendant,silver cross jewelry,engraved cross,tiny cross necklace,small cross necklace,new dad gift",United States,2023-04-28,yes,no,no,DaxosMen,https://www.etsy.com/listing/1456492948/925-sterling-silver-engraved-mens-cross
Custom Multi-Stone Ring by Caitlyn Minimalist • Dainty Birthstone Ring • Mothers Ring • Minimalist Ring • Personalized Gift For Mom • RM99 ,22.05,2,141,59,4,723,26,"MOTHERS RING,DAINTY STACKING RING,GIFT FOR HER,BIRTHSTONE RING,GEMSTONE RING,BIRTHSTONE JEWELRY,PERSONALIZED GIFT,CUSTOM JEWELRY,GIFT FOR MOM,CAITLYN MINIMALIST,HANDMADE JEWELRY,MINIMALIST JEWELRY,DIAMOND RING",United States,2023-04-06,yes,no,no,CaitlynMinimalist,https://www.etsy.com/listing/1455399961/custom-multi-stone-ring-by-caitlyn
15% code** 1+ lb gold tone jewelry mixed lot | WEARABLE | Grab Bag | Costume | Crafters | Crafting | Resell | Vintage to Mod ,22.0,2,142,21,1,190,21,"jewelry,bulk,lot,necklaces,bracelets,mixed,costume,vintage,craft,wearable,broken,gold,tone",United States,2023-04-12,yes,no,no,WhistlepigMarket,https://www.etsy.com/listing/1459771261/15-code-1-lb-gold-tone-jewelry-mixed-lot
"Silver Boho Ring, Multi Layer Ring, Boho Statement Ring, Inlay Ring, Thick Ring, Chunky Ring, Bohemian Style Ring, Boho Jewelry ",15.5,2,123,21,1,180,7,"silver boho ring,multi layer ring,boho statement ring,inlay ring,chunky ring,boho jewelry,rings for women,statement ring,silver ring,Boho style ring,multi band ring,bohemian style ring",United States,2023-03-19,yes,no,no,Iasjewlershop,https://www.etsy.com/ca/listing/1427671504/silver-boho-ring-multi-layer-ring-boho
"14K Gold Egypt Cartouche Necklace, Egyptian Hieroglyphic Cartouche Jewelry, Egypt Name Necklace, Ancient Symbol Necklace, Gift for Mom ",50.56,2,114,14,0,196,8,"cartouche necklace,egyptian cartouche,cartouche pendant,egyptian necklace,hieroglyph necklace,ancient egypt,custom made necklace,ancient necklace,Egypt Pendant,Gift for Her,Egypt Name Necklace,gift for mom,personalized gifts",United States,2023-04-26,yes,no,no,GoldnYouStore,https://www.etsy.com/listing/1469616553/14k-gold-egypt-cartouche-necklace
Blue Glow In the Dark Jewelry · Silicone Bracelets · Matching Bracelet · Friendship Bracelet · Dainty Ankle Bracelet · Friendship Bracelets ,8.0,2,106,24,0,52,1,"glow in the dark,jewelry,matching bracelet,friendship bracelet,ankle bracelet,dainty bracelet,adult friendship,silicone bracelet,couple bracelet,glow jewelry,best friend bracelet,stretch bracelets,blue bracelets",United States,2023-05-09,yes,no,no,HuedBracelets,https://www.etsy.com/listing/1477985017/blue-glow-in-the-dark-jewelry-silicone
