title,Category,"price(""$"")",7-day sales,total_sales,total_reviews,7-day reviews,total_favorites,7-day favorites,tags,Ship From,release time,Best Seller,Etsy pick,Raving,store name,product_url
"Personalized Makeup Bags, Rose Pink Cosmetic Bag, Rose Gold Bridesmaid Bag, Clear Personalized Makeup Bag, Cute Bridesmaid Gift Ideas ",Bags & Purses > Cosmetic & Toiletry Storage > Cosmetic Bags,12.0,9,658,86,0,146,1,"engagement ring dish,trinket dish,ring holder dish,wedding ring dish,gift for bride,bridal shower gift,bride to be gift,gift for couple,jewelry ring dish,ring dish engagement,engagement gift idea,wedding ring holder,gift box",United States,2022-11-22,yes,no,no,GiftBoxLoveCo,https://www.etsy.com/listing/1352169349/personalized-makeup-bags-rose-pink
Golden arches | mcdonald bags | mcdonald sling bag | Recycled Polyester | Quirky Design | Spoof packs ,Bags & Purses > Handbags > Crossbody Bags,17.89,9,263,32,1,688,45,"Bags & Purses,Handbags,Crossbody Bags",United States,2023-05-10,yes,no,no,SAM3DSTUDIOART,https://www.etsy.com/listing/1465021448/golden-arches-mcdonald-bags-mcdonald
Perfect Leather RFID Wallet Christmas Engraved Genuine Leather Wallet Anniversary Gift For Him Husband Boyfriend Men Father Dad son Friend ,Bags & Purses > Wallets & Money Clips > Wallets,28.0,8,1189,294,4,632,18,"Fathers Day Gift,Leather Wallet,Personalized Wallet,Engraved Wallet,Gift For Boyfriend,Mens Wallet,Slim Leather Wallet,Gift For Him,Bifold Wallet,Custom Wallet,Travel Wallet,Gift For Men,RFID Leather Wallet",United States,2022-10-25,yes,no,no,PremiumEngrave,https://www.etsy.com/listing/1332103759/perfect-leather-rfid-wallet-christmas
"Floral Letter Tote Bag, Bridesmaid Tote, Birthday Tote, Personalized Tote Bag, Gift For Her, Bride Tote Bag, Bachelorette Tote, Mom Gift ",Bags & Purses > Totes,4.9,8,71,22,1,108,6,"Canvas Totebag,personalized Totes,Bride Tote Bag,Bachelorette Totes,Bridalshower gift,Birthday Totes,Tote Bag,Bridesmaid Tote,Personalized Tote,Custom Tote Bag,Mothers Day Gift,Letter Tote Bag,Bride Toteb bag",United States,2023-03-03,yes,no,no,KsfGiftCraft,https://www.etsy.com/listing/1429394239/floral-letter-tote-bag-bridesmaid-tote
"Ita Bag Backpack, Shoulder and Crossbody, 3 Carries Style Versatile Ita bag, With 2 Inserts ",Bags & Purses > Backpacks,29.9,8,544,137,1,1208,25,"ita bag,itabag,ita bags,ita bag crossbody,ita bag Shoulder,pin bag,pin display bag,window bag,itabag crossbody,Shoulder ita bag,pin purse,ita crossbody bag,ita backpack bag",United States,2022-11-21,yes,no,no,NancyPursesGifts,https://www.etsy.com/listing/1337583718/ita-bag-backpack-shoulder-and-crossbody
NEW!! LARGE Fanny Packs | Park Fanny Pack | Travel Bag | Patch Bag | Magical Vacation Bag | Bag with Mouse Patches | Belt Bag for the Parks ,Bags & Purses > Fanny Packs,26.0,8,446,103,2,1008,15,"belt bag,fanny packs,nylon patch bag,stoney clover,bag with patches,fanny pack,fanny pack with name,large fanny pack,jumbo fanny pack",United States,2023-04-22,yes,no,no,PinkJoyCo,https://www.etsy.com/listing/1466394837/new-large-fanny-packs-park-fanny-pack
"Monogram Belt Bag, Belt Bag, Custom Fanny Packs, Crossbody Bag, Crossbody Belt Bag, Women's Belt Bag, Personalized Belt Bag, Embroidered ",Bags & Purses > Cosmetic & Toiletry Storage > Cosmetic Bags,20.0,8,238,61,10,252,5,"Waterproof,fanny pack,Monogram Belt Bag,Belt Bag,Crossbody Bag,Crossbody Belt Bag,Personalized Belt,Bag,Embroidered,trendy belt bag,dupe,Women's Belt Bag,lesiure wear",United States,2023-03-04,yes,no,no,ShopatBash,https://www.etsy.com/listing/1430360849/monogram-belt-bag-belt-bag-custom-fanny
"Classic Size ita Bag Crossbody, 8 Colors,Small Anime Ita Bag, Mini ita Shoulder Bag, Small Window Bag, Pin Display Bag. ",Bags & Purses > Handbags > Crossbody Bags,9.9,8,479,122,4,776,18,"ita bag,ita bag crossbody,ita crossbody bag,ita shoulder bag,small ita bag,ita bags,pin purse,pin collector bag,pin display bag,itabag,mini ita bag,kids ita bag,Small Window Bag",United States,2022-11-20,yes,no,no,NancyPursesGifts,https://www.etsy.com/listing/1337026984/classic-size-ita-bag-crossbody-8
"Personalized Luggage Tag, Vegan Leather Luggage Tag, Travel, Personalized Gift, Wedding Gift, Gift for Couple, Event Place Cards, Gift Tags ",Bags & Purses > Luggage & Travel > Luggage Tags,10.0,8,634,104,10,469,27,"Personalized gifts,customised gifts,gifts for couples,custom luggage tag,monogram luggage tag,place cards,monogrammed gifts,vegan leather tag,bestman gift,wedding gifts,personalised tag,custom gift,travel tag",United States,2023-02-14,yes,no,no,PersonalizedGiftsbyC,https://www.etsy.com/listing/1416980777/personalized-luggage-tag-vegan-leather
Jute Tote Carryall Bag | Shadow Monogram Jute Tote Personalized Bag | Shopping Bag ,Bags & Purses > Totes,17.98,8,1045,149,5,485,1,"Bachelorette Tote,Jute Tote,Jute Tote Bag,Carry All,Reusable Grocery Bag,Eco Friendly Bag,Grocery Shopping,Beach Tote Bag,Shopping,Girls Trip Gift,Wedding Party Gift,Bridal Party Gift,Destination Wedding",United States,2022-11-08,yes,no,no,KinzMarieCo,https://www.etsy.com/listing/1341758511/jute-tote-carryall-bag-shadow-monogram
CUSTOMIZABLE L Pill Bottle Hangover Kit Pill Bottle Bachelorette Hangover Kit Recovery Kit Hangover Kit Welcome Gift Nursing Graduation ,Bags & Purses > Cosmetic & Toiletry Storage > Cosmetic Bags,1.74,8,329,63,6,377,23,"nashville,disco cowgirl,Hangover kit,recovery kit,nursing graduation,wedding party,pill bottle,pill bottle kit,bachelorette party,Nashville recovery,bridesmaid,bach,moh gift",United States,2023-03-22,yes,no,no,NollyCo,https://www.etsy.com/listing/1429909194/customizable-l-pill-bottle-hangover-kit
"EARS Bag, Magical EARS Bag, XL Nylon Bags, Summer Travel Bags, Nylon Pouch Bags Chenille Patches, Magical Bags Collection, Vacation Bag ",Bags & Purses > Cosmetic & Toiletry Storage > Cosmetic Bags,40.0,8,169,35,1,529,21,"magical collection,ears holder,mouse ears,mouse headband,ears bag",United States,2023-04-10,yes,no,no,HoneyBoutiqueAL,https://www.etsy.com/listing/1458135345/ears-bag-magical-ears-bag-xl-nylon-bags
"Personalized Monogrammed Duffle Bag, Weekender Bag, Overnight Bag, Weekend Travel Bag, Bridesmaid Gift Bag, Baby Bag, Bridal Shower Gift ",Bags & Purses > Luggage & Travel > Duffel Bags,19.98,7,44,12,4,223,29,"custom travel bag,personalized bag,monogram travel bag,weekender bag,custom weekender bag,Duffle Bag,custom duffle bag,monogram duffle bag,waterproof bag,bridesmaid Gifts,gift for women,gym bag,duffel bags",United States,2023-06-14,yes,no,no,MTKIDS,https://www.etsy.com/listing/1503264959/personalized-monogrammed-duffle-bag
"Jute Tote Carryall Bag, Striped Shadow Monogram Bag, Jute Tote, Personalized Bag, Custom Bag, Shopping Bag ",Bags & Purses > Totes,20.99,7,1293,323,4,1246,14,"Bachelorette Tote,Jute Tote,Jute Tote Bag,Carry All,Reusable Grocery Bag,Eco Friendly Bag,Grocery Shopping,Beach Tote Bag,Shopping,Girls Trip Gift,Wedding Party Gift,Bridal Party Gift,Destination Wedding",United States,2022-11-21,yes,no,no,KinzMarieCo,https://www.etsy.com/listing/1337764622/jute-tote-carryall-bag-striped-shadow
"Personalized Wallet,Mens Wallet,Engraved Wallet,Groomsmen Wallet,Leather Wallet,Custom Wallet,Boyfriend Gift for Men,Christmas Gift for Him ",Bags & Purses > Wallets & Money Clips > Wallets,9.96,7,355,63,1,418,12,"personalized wallet,handwritten wallet,Engraved Wallet,leather wallet,handwriting gift,Wallet For Him,customized wallet,mens leather wallet,mens wallet,Fathers Day Gift,Gift For Boyfriend,gift for men,Engrave Engraving",United States,2022-11-03,yes,no,no,GoldenHornWallet,https://www.etsy.com/listing/1324438074/personalized-walletmens-walletengraved
PRE-ORDER *Ships in 1 week* Dinosaur Toddler Backpack Boy School Bag For Toddler Kindergarten Backpack Kids Custom Toddler Backpack Tag Name ,Bags & Purses > Backpacks,14.99,7,160,33,2,709,14,"toddler boy backpack,toddler backpack boy,Dinosaur Backpack,Dinosaur Bag,Baby Backpack,Custom Backpack,Personalize Backpack,Embellished Bag,Embroidery Bag,Kids Backpack Tags,mini backpack kids,Backpack Tags,Kids Dinosaur Bag",United States,2023-03-12,yes,no,no,TEPTEPbaby,https://www.etsy.com/listing/1422606388/pre-order-ships-in-1-week-dinosaur
"BULK RECEPTION WEDDING luggage tags | Champagne leather, and so the Adventure Begins in gold, our quote #23, ld buckle. ",Bags & Purses > Luggage & Travel > Luggage Tags,2.93,7,334,45,4,232,16,"wedding favors,wedding escort,luggage tags,leather luggage tags,suitcase tags,name holder,wedding keepsake,save the date,bridal party gifts,bride and groom gift,travel wedding gifts,bridal shower favor",United States,2022-11-05,yes,no,no,EscortTags,https://www.etsy.com/listing/1325904118/bulk-reception-wedding-luggage-tags
"Kids Name Tote Bag, Custom Name Tote Bag,Personalized Stationery Tote, Birthday Totes, Kindergarten Preschool Library Tote, Schol Tote bag, ",Bags & Purses > Totes,4.9,7,133,48,5,123,0,"personalized Totes,Birthday Gift Tote,Custom Tote Bag,Canvas Tote Bag,Name Tote Bag,Rainbow Tote Bag,Kids Tote Bag,School Tote Bag,Kids Name Tote,Kindergarten Tote,Teacher Tote Bag,Wedding Gift Totes,babyshower gift tote",United States,2023-03-02,yes,no,no,KsfGiftCraft,https://www.etsy.com/listing/1414688010/kids-name-tote-bag-custom-name-tote
"Cowhide Key Chain Wallet, Color Block Cowhide, Branded Cowhide, Genuine Hair on Cowhide, Genuine Leather,Leather Key Tag, Personalized Gifts ",Bags & Purses > Wallets & Money Clips > Wallets,27.0,7,52,19,1,177,22,"Cowhide,Genuine Leather,cowhide coin purse,cowhide key chain,leather keychain,cowhide keychain,keychain wallet,western keychain,western wallet,credit card holder,branded wallet,personalized gift,personalized wallet",United States,2023-04-20,yes,no,no,BarbedWireBiscuit,https://www.etsy.com/listing/1465003895/cowhide-key-chain-wallet-color-block
"Personalized Beach Bag, Girls Trip Gift, Tote Gift Bags, Beach Bags, Bridesmaid Beach Bag, Bachelorette Favors, Bridesmaid Proposal Gift ",Bags & Purses > Totes,6.14,7,671,162,6,348,13,"burlap bag,beach bag,bridesmaid bag,burlap tote bag,beach tote bag,bridesmaid gifts,girls trip gifts,custom name tote,bridesmaid gift bag,party favor bag,tote bags,gift for her,bachelorette gifts",United States,2022-09-26,yes,no,no,Goldenshine1996,https://www.etsy.com/listing/1298914506/personalized-beach-bag-girls-trip-gift
"Cat Ita Bag,Ita Bag Backpack,Handbag and Crossbody,3 Carries Style Versatile Ita bag,With 2 Inserts,Fast Shipping ",Bags & Purses > Backpacks,29.99,7,291,55,3,556,13,"Itabag,Ita bag,Ita bags,itabag backpack,itabag crossbody,ita bag crossbody,ita bag backpack,ita bag cat,crossbody Ita bag,backpack ita bag,pin bag,pin display bag,itabag cat",United States,2023-01-16,yes,no,no,NancyPursesGifts,https://www.etsy.com/listing/1394733545/cat-ita-bagita-bag-backpackhandbag-and
Keychain Wallet - Wallet with chenille patch - personalized wallet - keychain card holder - nylon wallet - card holder - personalized ,Bags & Purses > Wallets & Money Clips > Wallets,13.5,7,599,151,3,1364,11,"stoney clover,friend gift,teacher gift,personalized gift,coin purse,card holder,wallet,keychain,chenille patch,personalized wallet,nylon wallet,keychain wallet",United States,2022-09-20,yes,no,no,BKLYNLNDN,https://www.etsy.com/listing/1294759894/keychain-wallet-wallet-with-chenille
"Multi-Color Ita Bag Crossbody with Insert, Anime Ita Bag, ita messenger bag, Window Bag, Pin Display Bag, Pin Purse, Itabag. ",Bags & Purses > Handbags > Crossbody Bags,17.0,7,677,172,9,919,23,"ita bag,ita bag crossbody,pin bag,itabag,ita bags,pin display bag,Window Bag,ita messenger bag,Anime Ita Bag,ita bag cross body,ita tote bag,clothes pin bag,itabag crossbody",United States,2022-11-19,yes,no,no,NancyPursesGifts,https://www.etsy.com/listing/1336399086/multi-color-ita-bag-crossbody-with
Logo Cash Envelopes | Budget Binder Envelopes | A6 | A5 ,Bags & Purses > Wallets & Money Clips > Wallets,5.5,6,1240,172,1,1019,15,"cash binder,cash envelope,budget binder,cash savings binder,savings binder,streaming,credit cards,debt payoff,dave ramsey,baby steps,cash stuffing,sinking fund,cash savings system",United States,2022-09-23,yes,no,no,EnchantedDaisyShop,https://www.etsy.com/listing/1297028956/logo-cash-envelopes-budget-binder
"Personalized Duffle Bag, Weekender Bags with Name, Embroidered Duffle Bag, GYM Travel Bag for Women, Bridesmaid Gift, Graduation Gift ",Bags & Purses > Luggage & Travel > Duffel Bags,19.98,6,87,11,1,248,18,"custom travel bag,personalized bag,monogram travel bag,weekender bag,custom weekender bag,custom duffle bag,monogram duffle bag,waterproof bag,bridesmaid Gifts,gift for women,gym bag,duffel bags,weeding gifts",United States,2023-05-19,yes,no,no,MTKIDS,https://www.etsy.com/listing/1471313846/personalized-duffle-bag-weekender-bags
"Cheer, Cheerleader Bag, Cosmetic Bag, Cheer Gift, Cheerleader Gift, Gift For Her, CO65 ",Bags & Purses > Cosmetic & Toiletry Storage > Cosmetic Bags,8.46,6,565,99,3,491,7,"Best Friend Gift,Gift For Her,Cosmetic Bag,Makeup Bag,Cheer,Cheerleader,Cheer Gift,Cheerleader Gift,Team Gifts,Cheer Team,Cheer Bag,Team Bag,Cheerleader Team",United States,2022-09-30,yes,no,no,TheLetterGiftShop3,https://www.etsy.com/listing/1315818447/cheer-cheerleader-bag-cosmetic-bag-cheer
"Personalized S Wars Inspired Leather DoppKit Bag, Engraved Mens Toiletry Bag, Star W Lover Wedding Gift, Groomsmen Gift, Graduation Gift Son ",Bags & Purses > Cosmetic & Toiletry Storage > Toiletry Kits & Travel Cases,20.0,6,1524,235,1,3283,26,"leather dopp kit,40th anniversary,leather dopp kit bag,gift for him,birthday gift him,anniversary gift,groomsmen gift,shaving kit bag men,men's toiletry gift,bestman dopp kit",United States,2022-10-22,yes,no,no,EtraLeather,https://www.etsy.com/listing/1316668318/personalized-s-wars-inspired-leather
"Personalized Wallet,Mens Wallet,Engraved Wallet,Groomsmen Wallet,Leather Wallet,Custom Wallet,Boyfriend Gift for Men,Father Day Gift for Him ",Bags & Purses > Wallets & Money Clips > Wallets,10.77,6,279,43,7,219,12,"anniversary gift,Gift for Dad,Gift for Father,Gift for Grandpa,Gift For Him,Birthday Gift,Christmas Gift,Dad Gift,Father Gift,Grandpa Gift,Father's Day,Father's Gift,Father's day Gift",United States,2022-11-19,yes,no,no,JerseyHandCraft,https://www.etsy.com/listing/1350405475/personalized-walletmens-walletengraved
Personalized backpack/custom backpack/toddler daycare bag/child preschool bag/baby travel bag/birthday gift/personalized Christmas gifts ,Bags & Purses > Backpacks,32.0,6,381,66,5,223,1,"personalized gift,birthday gift,toddler backpack,daycare bag,personalize backpack,kids backpack,baby bag,travel backpack,back to school,preschool bag,mini backpack,baby weekend bag,school book bag",United States,2022-09-21,yes,no,no,KaylanKreationz,https://www.etsy.com/listing/1295846562/personalized-backpackcustom
"Mcraft® Vachetta leather handle protector/strap cover made for round handles, compatible with Speedy 20 30, Alma bb pm etc.Patent Pending. ",Bags & Purses > Handbags > Purse Straps,49.6,6,361,87,1,592,13,"speedy B,speedy 30,speedy 20,Mcraft,Handle cover,Louis Vuitton,Handle protector,strap protector,speedy cover,round handle cover,Louis protector",United States,2022-09-24,yes,no,no,Mcraftleather,https://www.etsy.com/listing/1297671254/mcraft-vachetta-leather-handle
"Custom Name BOGG BAG CHARM , Personalized Bag Charm Script, Bogg Bag Accessories, Bogg Bag Jibbitz Charms ",Bags & Purses > Luggage & Travel > Luggage Tags,14.99,6,863,147,3,470,12,"Bogg Bag Charm,Bogg Bag Bits,Bogg Bag Buttons,bag tag,bogg bag,personalized name,tag for bogg bag,bogg bag name tag,custom name tag,luggage tag,bogg bag accessories,bogg bag Jibbitz,custom name bogg bag",United States,2023-03-07,yes,no,no,3DPrintsNYC,https://www.etsy.com/listing/1418603488/custom-name-bogg-bag-charm-personalized
Personalized Women Makeup Bag Lock Cosmetic Bag Storage Organizer Wedding Bridesmaid Gift for her ,Bags & Purses > Cosmetic & Toiletry Storage > Cosmetic Bags,17.82,6,1038,171,2,1228,32,"monogram,personalized,monogrammed bag,make up bag,bridal gift,travel bag,tech bag,organizer,personalized gift,bridesmaid gift,wedding gift,cosmetic bag,make up organizer",United States,2022-11-26,yes,no,no,MngrmCreateWorkshop,https://www.etsy.com/listing/1341823744/personalized-women-makeup-bag-lock
Personalized Name Tote Bag Custom Name Tote Bag Custom Tote Shopper Womens Bag Customized Name Gift For Her Kids Bag School Bag For Kids ,Bags & Purses > Handbags > Shoulder Bags,8.99,6,643,73,16,207,16,"tote bag,custom tote bag,tote bags,customized tote bag,canvas tote bag,kids tote bag,daycare bag,tote bag for kids,tote bag canvas,eco friendly bag,reusable bag,custom totes,personalized totes,custom name bag,custom name tote bag,custom name gift,womens tote,personalized name,kids bag",United States,2023-05-20,yes,no,no,COCOMONhandmade,https://www.etsy.com/listing/1486132271/personalized-name-tote-bag-custom-name
grandma est Tote bag -personalized grandma gift- mothers day gift for grandma-new grandma gift-gifts for grandma birthday-KUR7 ,Bags & Purses > Totes,20.9,6,117,17,5,240,35,"grandma gift,gifts for grandma,grandma gifts,gift for grandma,new grandma gift,great grandma gift,promoted to grandma,personalized gift,mothers day gift,grandma est,grandma tote bag",United States,2023-04-30,yes,no,no,MIMOREE,https://www.etsy.com/listing/1472322389/grandma-est-tote-bag-personalized
"Luggage Tags Personalized, Backpack Tag, Bag Tags, Custom Name Tags, ID Tags, Personalized Keychain, Travel Accessories, Gift For Traveler ",Bags & Purses > Luggage & Travel > Luggage Tags,9.94,6,655,65,2,251,7,"bag name tag,backpack name tag,customized name tag,purse name tag,personalized ID tag,lunch box name tag,customized keychain,luggage tags,custom luggage tag,travel accessories,backpack tag,name tags backpacks,gift for travelers",United States,2023-03-08,yes,no,no,RiseAndFlourishShop,https://www.etsy.com/listing/1419046200/luggage-tags-personalized-backpack-tag
Monogrammed Laundry Bag | Graduation Gift | Large Laundry Basket | Custom Clothes Hamper | Back to School Gift | College Dorm laundry bag ,Bags & Purses > Totes,35.92,6,426,84,4,246,1,"Custom Laundry Bag,Backpack Laundry Bag,Laundry Backpack,laundry bag backpack,college laundry bag,laundry bag monogram,custom laundry bags,Nylon laundry bag,military laundry bag,student laundry bag,Canvas Laundry Bag,dorm room essentials,college essentials",United States,2023-05-05,yes,no,no,CustomempireShop,https://www.etsy.com/listing/1475857003/monogrammed-laundry-bag-graduation-gift
"Custom Name /Logo Insulated Lunch Bag with drawstring closure, Travel Bag, Organizer Waterproof Bag for Women or Men, Personalized Snack Bag ",Bags & Purses > Food & Insulated Bags > Lunch Bags & Boxes,19.98,6,170,22,4,224,21,"Bags Purses,Lunch Bags,Lunch Boxes,Drawstring bag,insulated bag,travel bag,canvas bag,insulated lunch bag,Food Insulated Bags,portable travel bag",United States,2023-05-25,yes,no,no,SoSoulDesign,https://www.etsy.com/listing/1474962600/custom-name-logo-insulated-lunch-bag
"Personalized Kids Sport Bag, Dance Bag for Girls, Gift For Her, Ballet Bag, Cheerleading Duffle Bag, Kids Weekend Bag, Cute Gym Bag ",Bags & Purses > Luggage & Travel > Duffel Bags,19.89,6,83,35,10,249,23,"Dance Bag for Girls,Gift For Her,Ballet Bag,Kids Weekend Bag,Cute Gym Bag,Personalized Bag,Kids Sport Bag,Cheerleading Bag,Duffle Bag,Back to School,Girl Soccer Gift,Cheerleader Gifts,Woman Sports Bag",United States,2023-06-22,yes,no,no,LosAngelesParty,https://www.etsy.com/listing/1508367461/personalized-kids-sport-bag-dance-bag
Flower Dude Personalized Fanny Packs /Flower Man Waist bag/The Flower Guy Fanny Pack/ Flower Boy fannies/fully customizable/personalized ! ,Bags & Purses > Fanny Packs,10.0,6,400,73,8,177,12,"personalized fanny,custom fanny pack,fanny pack,bachelorette party,flower dude,flower guy,flower man,flower dude proposal,be my flower dude,Petal Patrol,mens fanny pack,Petal Pusher fanny,Flower Bro fanny",United States,2023-04-06,yes,no,no,ScalaCo,https://www.etsy.com/listing/1455727159/flower-dude-personalized-fanny-packs
"Personalized Kids Nylon Backpack, Chenille Letters, Customize, Back to School, 15” Elementary School Sized Backpack ",Bags & Purses > Backpacks,45.0,6,253,71,8,312,0,"bag,purse,personalized,varsity,patches,chenille letters,custom,pink,stoney clover,kids,back to school,book bag",United States,2023-06-20,yes,no,no,LullabiesLollipops,https://www.etsy.com/listing/1492853018/personalized-kids-nylon-backpack
"Leather personalized makeup bag,Leather cosmetic pouch,Makeup bag women,Makeup pouch custom,Personalized travel pouch,Leather clutch purse ",Bags & Purses > Cosmetic & Toiletry Storage > Cosmetic Bags,21.8,5,497,106,1,588,9,"Leather makeup bag,Zipper leather pouch,Leather cosmetic bag,Ladies cosmetic bag,Womens clutch purse,cosmetic pouch,makeup bag,zipper pouch,Makeup bag women,Leather clutch purse,personalized,travel pouch,Makeup pouch custom",United States,2022-12-01,yes,no,no,BagBaseArt,https://www.etsy.com/listing/1359270935/leather-personalized-makeup-bagleather
"Personalized Slim Wallet, Anniversary Gift, Personalized RFID Wallet, Minimalist Leather Card holder ",Bags & Purses > Wallets & Money Clips > Wallets,12.72,5,327,66,7,139,12,"mens wallet,minimalist wallet,personalized gift,personalized wallet,slim wallet,small wallet,Groomsman Gift,boyfriend gift,engraved wallet,Anniversary Gift,custom wallet,gift for him,leather walllet",United States,2023-05-30,yes,no,no,NileLeatherUSA,https://www.etsy.com/listing/1478798600/personalized-slim-wallet-anniversary
NEW!! LARGE Fanny Packs | Park Fanny Pack | Travel Bag | Patch Bag | Disney Bag | Vacation Bag | Belt Bag with Patches | Park Bag ,Bags & Purses > Fanny Packs,26.0,5,205,48,0,341,12,"belt bag,fanny packs,nylon patch bag,stoney clover,bag with patches,fanny pack,fanny pack with name,large fanny pack,jumbo fanny pack",United States,2023-04-22,yes,no,no,PinkJoyCo,https://www.etsy.com/listing/1466405223/new-large-fanny-packs-park-fanny-pack
"Personalised Cabas bag | Custom jute bag for shopping, beach and to gift to a best friend ",Bags & Purses > Totes,16.7,5,1032,212,0,1206,16,"cabas,bag,jute,custom,personalised,name,text,design,beach,shopping,jute bag,cabas bag",United States,2022-10-23,yes,no,no,NKStudioBE,https://www.etsy.com/listing/1331210769/personalised-cabas-bag-custom-jute-bag
"Personalized Bag Duffle Bag, Children Gifts Monogrammed Weekender Bags, Baby Bag, Hospital Bag Personalized Gift,Overnight Baby Bag ",Bags & Purses > Luggage & Travel > Duffel Bags,30.0,5,696,97,2,868,11,"Newborn Gift,Baby Bag,Hospital Bag,Mommy Bag,Flower Girl Bag,Child Gift,Flower Girl Gift,Personalized Gift,Custom Bag,Personalized Bag,Weekender Bag,personalized baby,Baby Gift",United States,2022-11-25,yes,no,no,SelineLounge,https://www.etsy.com/listing/1355013823/personalized-bag-duffle-bag-children
"Monogrammed Diaper Bag Backpack, Expandable Baby Bed, Multi Functional Diaper Bag Backpack, Baby Diaper Bag Backpack with Changing Station ",Bags & Purses > Diaper Bags,44.99,5,208,28,4,220,15,"diaper bag,diaper bag backpack,baby bag,diaper bag boy,diaper bags,diaper bag girl,custom diaper bag,baby diaper bag,monogram diaper bag,DIAPERBAG,DIAPER BAG FOR GIRL,DIAPER BAG FOR BOY,NAME DIAPER BAG,MULTI FUNCTIONAL BAG,Expandable diaperbag,BABY BED DIAPER BAG,CRIB DIAPER BAG,CHANGING STATION",United States,2023-05-29,yes,no,no,MonogramaniaCom,https://www.etsy.com/listing/1478137576/monogrammed-diaper-bag-backpack
"Embroidered Tote Bag, Ironic Boat Tote, Embroidered Boat Tote, Canvas Tote Bag, Beach Bag, Beach Tote, Personalized Gift, Best Friend Gift ",Bags & Purses > Totes,18.8,5,1529,310,23,1480,15,"custom tote bag,bachelorette party,favor,bridesmaid tote,monogrammed tote,gift for her,large boat tote,embroidered tote bag,tote bag,ironic boat tote,funny boat tote,trendy boat tote,Canvas Tote Bag",United States,2022-10-13,yes,no,no,ShopatBash,https://www.etsy.com/listing/1310361624/embroidered-tote-bag-ironic-boat-tote
"Customized Sport Bag Tag for Teams - Single Sided or Double Sided - 4 Design Options - Personalized Name, Team Logo, Number - Luggage Tag ",Bags & Purses > Sports Bags > Team Sports & Gym Bags,3.0,5,377,59,3,285,14,"hockey bag tag,hockey tag,sports bag tag,backpack tag,hockey signs,custom bag tag,personalized tag,personalized bag tag,unique bag tag,sport bag tag,hockey bag sign,popular bag tag,professional bag tag",United States,2022-11-11,yes,no,no,myPREPidentity,https://www.etsy.com/listing/1330332788/customized-sport-bag-tag-for-teams
CUSTOMIZABLE XL Pill Bottle Hangover Kit Pill Bottle Bachelorette Kit Recovery Kit Birthday Hangover Kit Welcome Gift Nursing Graduation ,Bags & Purses > Cosmetic & Toiletry Storage > Cosmetic Bags,1.73,5,225,36,3,221,10,"nashville,disco cowgirl,Hangover kit,recovery kit,nursing graduation,wedding party,pill bottle,pill bottle kit,bachelorette party,Nashville recovery,bridesmaid,bach,moh gift",United States,2023-03-09,yes,no,no,NollyCo,https://www.etsy.com/listing/1434489659/customizable-xl-pill-bottle-hangover-kit
Women's Large Capacity RFID Blocking Luxury Genuine Leather Clutch Wallet Personalized Card Holder Organizer Woman Purse for Her Birthday ,Bags & Purses > Wallets & Money Clips > Wallets,36.79,5,1245,297,9,1081,24,"personalized wallet,Christmas gift women,xmas gift for her,wallet for women,leather women wallet,Long women wallet,personalized purse,large wallet for her,wallet for wife,custom women wallet,Chrsitmas gift idea,engraved wollet,Valentine's Day Gift",United States,2022-11-18,yes,no,no,GiftisComing,https://www.etsy.com/listing/1335699768/womens-large-capacity-rfid-blocking
