title,Category,"price(""$"")",7-day sales,total_sales,total_reviews,7-day reviews,total_favorites,7-day favorites,tags,Ship From,release time,Best Seller,Etsy pick,Raving,store name,product_url
Bogg Bag Compatible Plastic Purse Charm - Custom Word or Name Bogg Bag Bit - Bogg Bag Button - Personalized Name Bogg Bag Accessories ,Bags & Purses > Luggage & Travel > Luggage Tags,9.99,1,18,30,2,154,21,"Personalized Charms,Bogg Bag Charm,Bogg Bag Beach,Bogg Bag Accessories,Personalized Name,Name Bogg Bag,Bag Embelishments,Custom Purse Charms,Bogg Bag Pool,Bogg Bag Ocean,Custom Word Bit,Bogg Bag Compatible,Customized Bogg Bag",United States,2023-07-23,yes,no,no,CitrusCreek,https://www.etsy.com/listing/1514798666/bogg-bag-compatible-plastic-purse-charm
"Patches SEWN ON Personalized Nylon Chenille Patch Backpack, Custom Name Patch Backpack Back to School ",Bags & Purses > Backpacks,40.0,1,60,18,2,94,3,"Stoney clover dupes,chenille patches,custom backpack,back to school,name backpack,nylon backpack,travel backpack,patch backpack,chenille backpack,preppy backpack,patch backpack kids,name backpack kids,name patch backpack",United States,2023-02-19,yes,no,no,PastrichPatches,https://www.etsy.com/listing/1420842879/patches-sewn-on-personalized-nylon
"Bridesmaid Makeup Bag, Personalized Bag, Bridesmaid Gift, Bachelorette Party Gift, Initial Purse, Bridesmaid Proposal ",Bags & Purses > Cosmetic & Toiletry Storage > Cosmetic Bags,9.6,1,107,12,1,106,6,"Wedding gift,custom,personalized,maid of honor,bridesmaid,gift ideas,Jewelry Case,Bridesmaids Gift,clutch purse,wallet,personalized bag,clutch,makeup bag",United States,2022-10-13,yes,no,no,RefinedByElegance,https://www.etsy.com/listing/1310166876/bridesmaid-makeup-bag-personalized-bag
Shadow Monogram Luggage Tag ,Bags & Purses > Luggage & Travel > Luggage Tags,15.99,1,107,16,1,77,4,"Bachelorette Party,bridal party gifts,bridesmaid gifts,couples gifts,honeymoon gifts,luggage tag,passport cover,passport holder,personalized gifts,travel gifts,travel wallet,wedding gifts,wonderlust gifts",United States,2023-04-13,yes,no,no,KinzMarieCo,https://www.etsy.com/listing/1460576991/shadow-monogram-luggage-tag
Customized Tote Bag Custom Logo Custom Text Tote Bag Bulk Custom Tote Bag Custom Tote Shopper Custom Gift For Her Personalized Gift For Her ,Bags & Purses > Handbags > Shoulder Bags,8.99,1,438,43,3,80,4,"tote bag canvas,canvas tote bag,eco friendly bag,aesthetic tote,reusable bag,custom totes,custom tote bag,grocery bag,grocery tote bag,Bulk Tote Bag,Personalized Tote,Customized Tote Bag,Custom Logo Bag",United States,2023-03-17,yes,no,no,COCOMONhandmade,https://www.etsy.com/listing/1440667399/customized-tote-bag-custom-logo-custom
Personalized Baby Backpacks | Monogrammed Toddler Backpacks | Solid Kids Backpacks | Preschool Book Bags | Personalized Diaper Backpacks ,Bags & Purses > Backpacks,29.99,1,32,20,4,129,3,"Baby Gifts,Baby Boy Gift,Baby Shower Gifts,Gifts for Kids,Monogram Backpack,Kids Backpack,Toddler Backpack,Boy Backpack,Girl Backpack,Baby Girl Gift,Diaper Backpack,Cute Backpack,Preschool Book Bag",United States,2023-05-11,yes,no,no,PinkEverAfter,https://www.etsy.com/listing/1479987401/personalized-baby-backpacks-monogrammed
Personalized duffel bag| overnight bags | custom duffle bag | dance bag | personalized gift | birthday gift| personalized bag | gift for her ,Bags & Purses > Cosmetic & Toiletry Storage > Cosmetic Bags,63.75,0,527,97,7,909,34,"dance bag,chenille patches,valentines day gift,teachers gift,personalized gift,duffel bags,personalized bag,gym bag,travel bags,Monogram duffel,Varsity Letter Patch,tote bags personaliz",United States,2023-01-28,yes,no,no,ChicbabyStudio,https://www.etsy.com/listing/1403927391/personalized-duffel-bag-overnight-bags
"Premium backpack name Tags personalized, customized luggage Name tags, Backpack name Tag Personalized ID Tags, Custom name Tag for kids ",Bags & Purses > Luggage & Travel > Luggage Tags,2.49,0,0,13,0,18,0,"name tag,luggage name tag,backpack name tag,customized name tag,personalized tag,travel name tag,acrylic name tag,travel luggage tag,Personalized ID Tags,bag name tag,suitcase name tags,keychain name tag,camera bag name tag",United States,2023-08-08,yes,no,no,BelovedLives,https://www.etsy.com/listing/1540184605/premium-backpack-name-tags-personalized
"Personalized Kids Nylon Lunch Pale, Chenille Letters, Customize, Back to School ",Bags & Purses > Backpacks,28.0,0,32,16,0,71,0,"bag,purse,personalized,varsity,patches,chenille letters,custom,pink,stoney clover,kids,back to school,lunch pale,lunch",United States,2023-07-07,yes,no,no,LullabiesLollipops,https://www.etsy.com/listing/1504448316/personalized-kids-nylon-lunch-pale
"Nylon fanny pack, Monogram Belt Bag, Belt Bag, Crossbody Bag, Crossbody Belt Bag, Women's Belt Bag, Personalized Belt Bag, Embroidered ",Bags & Purses > Cosmetic & Toiletry Storage > Cosmetic Bags,17.0,0,429,71,5,374,6,"Waterproof,fanny pack,Monogram Belt Bag,Belt Bag,Crossbody Bag,Crossbody Belt Bag,Personalized Belt,Bag,Embroidered,trendy belt bag,dupe,Women's Belt Bag,lesiure wear",United States,2023-02-01,yes,no,no,ShopatBash,https://www.etsy.com/listing/1393693666/nylon-fanny-pack-monogram-belt-bag-belt
"Personalized Backpacks for Kids, Custom Monogrammed Students Book Bag, Embroidery Toddler School Bag, Backpacks for Children, Birthday Gift ",Bags & Purses > Backpacks,19.84,0,28,7,0,140,19,"monogram backpack,Personalize Backpack,Embroidery SchoolBag,Custom Backpack,back to school,backpack boy,backpack girl,backpack for school,kids backpack,book bag for student,kids school bag,Custom  School Bags,Backpack for child",United States,2023-06-21,yes,no,no,MTWORLDUS,https://www.etsy.com/listing/1493878000/personalized-backpacks-for-kids-custom
"Small Name Zipper Bag, Bikini Pouch, Name Pool Bag, Wet Dry Pool Pouch, Beach Bag, Water Resistant Bag, Personalized Pool Bag, Diaper Bag ",Bags & Purses > Cosmetic & Toiletry Storage > Cosmetic Bags,11.99,0,121,10,0,68,1,"pvc,plastic bag,mesh pouch,vinyl,waterproof bag,travel,waterproof pouch,vinyl bag,storage bag,bride gift,wedding gift,vacation pouch",United States,2023-04-07,yes,no,no,HDdesignBags,https://www.etsy.com/listing/1442054038/small-name-zipper-bag-bikini-pouch-name
"Personalized Luggage Tag, Acrylic Place Card, Shadow Monogram Gift Tag, Bridesmaid Gift, Bachelorette Party Favors, Girls Trip, Travel Gift ",Bags & Purses > Luggage & Travel > Luggage Tags,5.13,0,153,30,0,133,1,"Bridesmaid gifts,bridesmaid proposal,Shadow Monogram,preppy gift for her,Escort Card,Acrylic Place Cards,Acrylic Name Cards,Destination Wedding,Monogram Tags,Bag Tag,Suitcase Tag,maid of honor gift,Modern 90s y2k",United States,2023-02-06,yes,no,no,TheNativeBride,https://www.etsy.com/listing/1411089955/personalized-luggage-tag-acrylic-place
Personalized Name Bag Custom Name Tote Bag Custom Gift Bridesmaids Bag Gift Tote Shopper Women Bag Customized Name Personalized Gift For Her ,Bags & Purses > Handbags > Shoulder Bags,8.99,0,125,14,0,59,8,"custom tote bag,tote bag,name bags,cocomonhandmade,trendy tote bags,tote bags,tote bag name,tote bag for women,tote bag canvas,pink tote bags,canvas tote bag,eco friendly bag,custom totes,personalized totes,custom name bag,custom name tote bag,custom name gift,womens tote,personalized name,bridesmaid gift,bridesmaid bag",United States,2023-06-01,yes,no,no,COCOMONhandmade,https://www.etsy.com/listing/1494190611/personalized-name-bag-custom-name-tote
"Nylon pouch, clear cosmetic bag, chenille letter bag, stoney clover dupe, wet bag, bathroom bag, nylon makeup bag, varsity letter pouch ",Bags & Purses > Cosmetic & Toiletry Storage > Toiletry Kits & Travel Cases,10.99,0,0,9,0,25,1,"wet bag,bathroom bag,cosmetic bag,nylon pouch,clear bag,stadium bag,chenille letter bag,varsity letter,chenille,Stoney clover,bridesmaid gift,wedding party favors,letter bag",United States,2023-07-06,yes,no,no,HDdesignBags,https://www.etsy.com/listing/1503492042/nylon-pouch-clear-cosmetic-bag-chenille
"Custom Name Halloween Tote Bag, Trick Or Treat Tote Bag, Halloween Squad Totes, Kids Halloween Tote Bag, Candy Tote Bags, Halloween Gift ",Bags & Purses > Totes,4.9,0,0,8,0,41,8,"Halloween Tote Bag,Halloween Squad Bag,Trick or Treat Totes,Kids Halloween Bag,Candy Tote Bag,Halloween Totes,Halloween Gift,Kids Gift Bag,Halloween Bags,Custom Halloween Bag,Custom Name Totes,Fall Season Bag,Halloween Team Totes",United States,2023-07-13,yes,no,no,KsfGiftCraft,https://www.etsy.com/listing/1507938918/custom-name-halloween-tote-bag-trick-or
"Leather tote bag with pocket and zipper, large laptop purse with computer divider, medium women bag for work, small office bag with charm ",Bags & Purses > Totes,108.0,0,0,32,1,718,10,"leather laptop bag,leather work bag,laptop bags women,womens laptop bag,tote bag with zipper,custom laptop bag,womens tote purse,leather shoulder bag,tote bags for women,small leather bag,zippered bag,laptop briefcase,office laptop bag",United States,2022-12-30,yes,no,no,ForTheLoveOfMore,https://www.etsy.com/listing/1382272195/leather-tote-bag-with-pocket-and-zipper
"Handcrafted Top Grain Leather Weekender Bag, High-Quality Durable Canvas Travel Bag, Retro Style Duffel Bag for Men or Women ",Bags & Purses > Luggage & Travel > Duffel Bags,107.98,0,62,18,0,116,5,"Top Grain Leather,Gymnastics Bag,Weekend Bag,Weekender Bag Men,Weekender Bag Women,Vintage Bag,Duffel Bag Men,Duffel Bag,leather duffel bag,Duffel Bag Women,canvas travel bag,overnight bag,canvas duffle bag",United States,2023-06-13,yes,no,no,MegaGearCustom,https://www.etsy.com/listing/1488003502/handcrafted-top-grain-leather-weekender
"Floral Teacher Tote Bag / Teach Them, Love Them, Watch Them Grow Tote Bag / Teachers Gifts / Be Kind Tote Bag ",Bags & Purses > Totes,8.68,0,1000,243,3,1355,8,"canvas tote bag,tote bag for school,natural tote bag,cute tote bag,gift tote bag,teacher gift,teacher tote bag,flower tote bag,kindness tote bag,book tote bag,shopping tote bag,tote bag lover,gift tote bags",United States,2023-03-21,yes,no,no,CuppaTeeClothing,https://www.etsy.com/listing/1443328617/floral-teacher-tote-bag-teach-them-love
Personalized Teacher Cotton Canvas Tote Bag Gift for Teachers Teacher Life Tote Custom Teacher Appreciation Gift Bag Teacher Name Bag ,Bags & Purses > Totes,30.74,0,114,12,0,60,0,"GIFT FOR TEACHER,PERSONALIZED TEACHER,CUSTOM TEACHER GIFT,TOTE BAG TEACHER,TEACHER TOTE,CANVAS TOTE BAG,PERSONALIZED TOTE,TEACHER PRESENT,TEACHER THANK YOU,TEACHER APPRECIATION,LARGE TOTE,TEACHER CUSTOM TOTE,TEACHER  BAG",United States,2023-05-26,yes,no,no,VincenzaSilviaCream,https://www.etsy.com/listing/1489928611/personalized-teacher-cotton-canvas-tote
"Cruise Tote bag, Custom Cruise Vacation Tote Bag, Cruise Gift, Girls Trip Weekend Tote Bag, Cruise Squad, Personalized Family Cruise Trip ",Bags & Purses > Totes,5.39,0,331,58,0,131,1,"girls weekend tote,cruise vacation,cruise birthday,cruise bachelorette,Girls Trip Tote Bags,canvas tote bag,Custom Cruise Bag,yacht sailboat trip,Cruise Squad Totes,Cruise Tote Bag Trip,girls trip tote gift,Cruise wedding bag",United States,2022-11-17,yes,no,no,FourSeasonsShirts,https://www.etsy.com/listing/1334985586/cruise-tote-bag-custom-cruise-vacation
"Personalized School Tote Bag, Teacher Tote Bag, Librarian Totes, Teacher Gift Totes, Back To Schoool Totes, Teacher Appreciation Gift ",Bags & Purses > Totes,4.9,0,19,12,0,46,1,"personalized Totes,Gift Totebag,Name Tote Bag,Rainbow Tote Bag,Personalized Tote,Teacher Gift Tote,Teacher Bag,Library Totes,Teacher Squad Gift,Gift Bag Teacher,Teacher Appreciation,Book Tote Bags,Scool Totes",United States,2023-05-16,yes,no,no,KsfGiftCraft,https://www.etsy.com/listing/1482987175/personalized-school-tote-bag-teacher
"Personalized Kids Backpack, Custom Monogram Backpack, Corduroy Backpack, Embroidery Toddler School Bag, Back bag for Children, Vintage Bag ",Bags & Purses > Backpacks,19.98,0,0,26,7,158,5,"monogram backpack,Personalize Backpack,Embroidery SchoolBag,Custom Backpack,back to school,backpack boy,backpack girl,backpack for school,kids backpack,book bag for student,kids school bag,Custom  School Bags,Backpack for child",United States,2023-06-28,yes,no,no,MTWORLDUS,https://www.etsy.com/listing/1512578837/personalized-kids-backpack-custom
"Holiday Gifts for Friends, Christmas Gifts for Women, Personalized Christmas Gifts for Her Personalized Make up Bag ",Bags & Purses > Cosmetic & Toiletry Storage > Cosmetic Bags,14.81,0,700,135,0,169,1,"christmas gift,coworker gift,gifts for women,make up pouch,personalized gift,initialed bag,monogrammed bag,bridesmaid gift bag,gift for daughter,gift for girlfriend,gift for mom,holiday gift for",United States,2022-10-24,yes,no,no,SSweddings,https://www.etsy.com/listing/1317615806/holiday-gifts-for-friends-christmas
"Personalized Teen Girl Backpack, Matching Pink Custom Pencil Case, Tween Girls Girls, Girlie Gift, Youth Backpack, Bridemaids Backpack ",Bags & Purses > Backpacks,17.59,0,0,18,2,58,2,"barbiecore,barbiebag,Tween Girls Gifts,custombackpack,barbie,barbiebackpack,custombarbiebag,customnamebackpack,girlspinkbackpack,teengirlbackpack,younggirlsbackpack,backtoschoolbag,personalizedbackpack",United States,2023-07-19,yes,no,no,GitcheeGifts,https://www.etsy.com/listing/1511957658/personalized-teen-girl-backpack-matching
The Pocket Pharmacy ,Bags & Purses > Accessory Cases > Pill Boxes,14.98,0,907,318,0,2105,3,"Pill Box,Medication Storage,Travel Necessities,Organization",United States,2023-02-26,yes,no,no,ThePocketPharmacy,https://www.etsy.com/listing/1426066497/the-pocket-pharmacy
"Duffel Bag Personalized Bride Gift, Wifey Weekender Bag, Personalized Christmas Gift for Bride, Bridal Shower Gift personalized bag Mrs ",Bags & Purses > Luggage & Travel > Overnight Bags,34.5,0,764,166,4,1770,13,"bride weekender bag,gift for wife,custom bride,personalized bride,Mrs bag,wifey duffel bag,wifey bag,bridal shower gift,personalized gift,gift for her,bride yoga bag,bride gym bag,wifey weekender bag",United States,2022-11-27,yes,no,no,SelineLounge,https://www.etsy.com/listing/1342300448/duffel-bag-personalized-bride-gift-wifey
Customized Silicone Bento Boxes|Kid's Lunchboxes|Personalized Name Lunch Box|Back to School Lunch| Divided Food Container|Food Storage ,Bags & Purses > Food & Insulated Bags > Lunch Bags & Boxes,10.19,0,0,7,0,41,1,"personalized lunch,bento box,kids lunch box,silicone lunch box,engraved lunch box,meal prep,back to school,kids lunches",United States,2023-07-23,yes,no,no,PersonalizzedDFW,https://www.etsy.com/listing/1528771733/customized-silicone-bento-boxeskids
"Custom Tote Bag, Personalized Tote Bag For Shopping Bulk Custom Text Tote ",Bags & Purses > Totes,7.09,0,254,85,4,244,5,"Custom tote bag,Personalized Tote,Bulk Tote bag,Business Totes,Custom Shopping tote,Trade Show Gift Bag,Custom text tote bag,Canvas Tote Bag,Teacher tote,Bride tote,Nurse tote,Anime Tote bag,Bridesmaid Tote Bag",United States,2023-04-15,yes,no,no,TopLineApparelStore,https://www.etsy.com/listing/1461629883/custom-tote-bag-personalized-tote-bag
"Personalized Golf Tote Bag, Golfer Gift Bag, Golf Lovers Gift, Golf Instructor Gifts, Gifts for Golfers, Golf Clubs Bag, Golf Sport Bags ",Bags & Purses > Totes,5.98,0,83,4,0,29,3,"Golf Tote Bag,Golf Lover Gifts,Funny Golf Bag,Gifts for Golfers,Gift for Men,Fathers Day Gifts,Personalized Golf,Custom Golf Bag,Golfing Club Bags,Golf Sports Bag,Golf Sport Bags,Golf Instructor Gift,Golfer Gift Bag",United States,2023-04-25,yes,no,no,TrendyCraftTX,https://www.etsy.com/listing/1468951905/personalized-golf-tote-bag-golfer-gift
"PERSONALIZED TOTE BAG, Bridesmaid Proposal, Burlap Tote Bag, Embroidered Jute Bag, Custom Beach Bag, Bachelorette Party, Summer Gift ",Bags & Purses > Totes,4.45,0,40,23,0,30,0,"embroidered tote bag,jute bag bulk,bridesmaid proposal,burlap tote bag,custom beach bag,jute bag medium,Personalized Gifts,straw bag,bride jute bag,Gift for Mom,tote bag,summer gift,tote bag aestetic",United States,2023-03-23,yes,no,no,ArastaCrafts,https://www.etsy.com/listing/1431188564/personalized-tote-bag-bridesmaid
"Zipper Tote Bag, Girls Weekend Tote, Girls Trip Tote, Girls Trip Bag, Bridesmaid Tote, Personalized Gift, Cotton Canvas Tote ",Bags & Purses > Totes,8.05,0,122,18,0,132,11,"Tote Bag Canvas,Personalized Tote,Bag Women,wedding party gift,personalized bag,gift for her,personalized gift,cotton canvas tote,Yoga Bags,girls trip tote bag,girls trip tote,girls weekend bag",United States,2023-05-25,yes,no,no,bdactivewear,https://www.etsy.com/listing/1474958238/zipper-tote-bag-girls-weekend-tote-girls
"Custom Vet Tech Fanny Pack, Vet Tech Tool Belt, Vet Tech Organizer Belt, Vet Tool Bag, Vet Tech Gift, Veterinarian gift, Vet tech bag ",Bags & Purses > Fanny Packs,16.98,0,361,55,1,712,13,"vet tech tool belt,vet tech fanny pack,vet tech gift,vet tech week,vet tech organizer,veterinarian gift,vet fanny pack,vet tech bag,gift for vet tech,vet gift,vet tool bag,vet organizer bag,vet organizer belt",United States,2022-10-31,yes,no,no,natruyenshop,https://www.etsy.com/listing/1336335883/custom-vet-tech-fanny-pack-vet-tech-tool
Custom Luggage Tag for Bridesmaid Custom Bachelorette Gifts from Bride PU Leather Luggage Tag Custom Suitcase Tag ,Bags & Purses > Luggage & Travel > Passport Covers,13.5,0,97,37,1,84,0,"custom luggage tag,carry-on luggage,personalised luggage,travel tag for her,wedding luggage tag,bride luggage tag,travel accessories,bridesmaid gift,bridesmaid proposal,bachelorette party,bridal party gift,wedding gift,pu leather bag tag",United States,2023-06-04,yes,no,no,EAElement,https://www.etsy.com/listing/1481847178/custom-luggage-tag-for-bridesmaid-custom
Personalized backpack| Back to school | custom backpack | bookbags | personalized school bags| birthday gift for kids | gifts for kids ,Bags & Purses > Backpacks,63.75,0,31,34,2,193,17,"gift for kids,personalized gift,custom bags,custom backpacks,custom school bag,personalized bag,custom backpack,back to school,Stoney clover,school bags,school bag custom,personalized backpac",United States,2023-07-11,yes,no,no,ChicbabyStudio,https://www.etsy.com/listing/1520815257/personalized-backpack-back-to-school
"Custom Backpack, Personalized Backpack, Kids Backpack, Custom Kids Backpack, Varsity Letter Backpack, Backpack Patches ",Bags & Purses > Backpacks,45.0,0,0,28,4,155,9,"kids backpack,custom backpack,backpack for kids,backpack kids,backpack custom,gift for kids,birthday gift kids,backpack for school,school backpack,backpack patches,backpack name,backpack,backpack personalize",United States,2023-07-04,yes,no,no,NoaJayneCo,https://www.etsy.com/listing/1516314151/custom-backpack-personalized-backpack
"Golf Cart Cosmetic Bag, Personalized Sports Make Up Bag, Custom Golf Tee Bag, Golf Team Gift, Sports Gift, Coach Gift, Golf Make Up Bag ",Bags & Purses > Cosmetic & Toiletry Storage > Cosmetic Bags,9.56,0,27,8,0,15,0,"Make Up Bag,Toiletry Bag,Zipper Pouch,Personalized Gift,Custom Bag,Coach Gift,Team Gift,Sports Player,Accessory Bag,Wash Bag,Golf,Golf Lover,Golf Tee Bag",United States,2023-04-04,yes,no,no,EndlessCreationsCo,https://www.etsy.com/listing/1454085667/golf-cart-cosmetic-bag-personalized
"Bridesmaid Tote Bags, Personalized Bridesmaid Bags, Custom Tote Bag with Zipper Option, Bridal Party Bridesmaid Gifts ",Bags & Purses > Totes,9.97,0,178,26,0,35,0,"bridesmaid tote bags,maid of honor,tote bag,bridesmaid tote,bridesmaid bag,bridal tote bag,personalized,wedding tote bag,bridal party totes,bridal party gifts,bride tote bag,tote bag with zipper,everlygrayce",United States,2023-03-23,yes,no,no,EverlyGrayce,https://www.etsy.com/listing/1430768150/bridesmaid-tote-bags-personalized
"Personalized Kids Backpack and Lunch Pale, Leather Patch, Black and White Check, Customize, Back to School, Solid Black ",Bags & Purses > Backpacks,29.99,0,153,52,2,322,4,"bag,purse,personalized,varsity,patches,chenille letters,custom,pink,stoney clover,kids,back to school,book bag",United States,2023-06-27,yes,no,no,LullabiesLollipops,https://www.etsy.com/listing/1497303112/personalized-kids-backpack-and-lunch
Personalized Beach Bag Tote Bags Custom Large Beach Tote Bags with Names Bridesmaid Gift Bag Tote ,Bags & Purses > Totes,22.04,0,545,122,1,461,7,"tote bag,bridesmaid,personalized,bridesmaid bag,beach bridesmaid,bridesmaid gift,custom tote bag,beach bag,beach tote,Gift for Mom,Bridesmaid Tote Bags,Bridesmaid Gift Idea,Burlap Jute Bag",United States,2023-03-05,yes,no,no,SSweddings,https://www.etsy.com/listing/1431254081/personalized-beach-bag-tote-bags-custom
"Embroidered Gingham Backpack + Lunchbox, School Bag, Gingham, Pink, Blue ",Bags & Purses > Backpacks,20.0,0,246,37,0,199,3,"Gingham,Nylon",United States,2023-06-03,yes,no,no,UnlimitedCreationsTy,https://www.etsy.com/listing/1495460091/embroidered-gingham-backpack-lunchbox
"Custom Beach Bag, Bachelorette Bags, Clear Beach Bag, Beach Wedding Bags, Girls Trip Gift, Beach Tote, Bachelorette Party Favors, Pool Bag ",Bags & Purses > Totes,15.74,0,1033,308,11,1342,21,"beach bag,beach bags,girls trip,beach tote,pool bag,clear bag,custom beach bag,holographic bag,beach bag waterproof,bachelorette bags,Bridesmaid Bags,Bridesmaid Gift Bag,Bachelorette Favor,holographic tote,birthday favors,girls weekend gift,girls trip gift bag,beach bachelorette,clear concert bag,clear stadium bag,cheer gifts,teen girl gift",United States,2023-01-01,yes,no,no,LimeAndCo,https://www.etsy.com/listing/1369273988/custom-beach-bag-bachelorette-bags-clear
Personalized Leather Luggage Tag Handmade Leather Travel Tag Custom Wanderlust Gift Wedding Favor Tags Christmas Personalized Gifts for Him ,Bags & Purses > Luggage & Travel > Luggage Tags,8.0,0,9,19,3,44,1,"luggage tag,gift for him,gift for her,personalized gift,custom,custom luggage tag,travel gift,leather gift,leather luggage tag,travel tag,personalized tag,groomsmen gift,bridal shower gift",United States,2023-06-20,yes,no,no,VellaireLeatherGoods,https://www.etsy.com/listing/1492828042/personalized-leather-luggage-tag
"Personalized Groomsmen Dopp Kit, Leather Toiletry Bag for Him, Groomsman Gift, Leather Accessories, Men's Travel Bag, Men's Shave Bag Gift ",Bags & Purses > Cosmetic & Toiletry Storage > Toiletry Kits & Travel Cases,14.7,0,575,133,3,157,0,"Dopp Kit,Leather Toiletry Bag,Toiletry Bag for Him,Groomsman Gift,Leather Accessories,Gift Idea,Wedding gift for him,Gift for Boyfriend,Gift for Him,Graduation Gift,Birthday gift,Men's Travel Bag,Men's Shave Bag",United States,2023-05-10,yes,no,no,PeraLeatherBag,https://www.etsy.com/listing/1479010879/personalized-groomsmen-dopp-kit-leather
Personalized Lunch Box -Custom Patch Nylon Bag - Kids Lunch Bag -Colorful Letter Patch Lunch Tote - Patch Bag For Kids - Back to School ,Bags & Purses > Food & Insulated Bags > Lunch Bags & Boxes,30.4,0,36,12,1,114,7,"personalized bag,chenille patches,varsity patches,back to school,custom school bag,gift for kids,custom lunch box,patch lunch bag,lunch tote,kids lunch box,lunch sack,customizable bag,chenille lunch bag",United States,2023-07-21,yes,no,no,DesignsByJoelleLeah,https://www.etsy.com/listing/1513203666/personalized-lunch-box-custom-patch
"Pocket Medication Organizer for Purse, DIY Custom Label Case, Travel Pill Box Organizer, Pill Organizer, Pocket Pharmacy ",Bags & Purses > Accessory Cases > Pill Boxes,8.5,0,0,38,0,188,1,"pocket pharmacy,pill box,medication label,Travel Pill Box,Pill Organizer,Pocket Organizer,pocket pil case,Custom pill label,work pill box",United States,2023-05-22,yes,no,no,TheMediCarry,https://www.etsy.com/listing/1487410343/pocket-medication-organizer-for-purse
Personalized Child and Toddler Nylon Fanny Pack - Child Fanny Pack - Personalized Fanny Pack ,Bags & Purses > Fanny Packs,14.99,0,110,35,3,159,7,"fanny pack,toddler,bag,child,purse,personalized,varsity letter,chenille patch,soft patch,nylon,kids gift,kids present",United States,2023-05-09,yes,no,no,LullabiesLollipops,https://www.etsy.com/listing/1477997355/personalized-child-and-toddler-nylon
Toddler Girls Personalized Suede Cat Kitty Handbag Crossbody First Purse Kids Baby Birthday Flower Girl Graduation Gift ,Bags & Purses > Handbags > Crossbody Bags,19.0,0,0,35,4,299,49,"daisy sunglasses,sunglasses with name,flower glasses,flower girl proposal,baby girl sunglasses,sunglasses for beach,stylish,summer shades,personalized bag,personalized purse,toddler birthday,little girls handbag",United States,2023-06-03,yes,no,no,heiunlimited,https://www.etsy.com/listing/1481028550/toddler-girls-personalized-suede-cat
"Personalized Monogrammed Backpacks, Custom Embroidery School Bags, Kids Backpack with Name, School Bag for Children, Students Book Bag ",Bags & Purses > Backpacks,19.76,0,112,23,2,217,14,"monogram backpack,Personalize Backpack,Embroidery SchoolBag,Custom Backpack,back to school,backpack boy,backpack girl,backpack for school,kids backpack,book bag for student,kids school bag,Custom  School Bags,Backpack for child",United States,2023-06-20,yes,no,no,MTWORLDUS,https://www.etsy.com/listing/1507421261/personalized-monogrammed-backpacks
"Backpack name tag, diaper bag tag, bag tags, acrylic keychains, acrylic name tags, name keyring, school bag tag, Groovy keychains ",Bags & Purses > Backpacks,12.0,0,38,9,1,171,9,"Kids backpack tag,Acrylic name tags,Backpack tags,Groovy keychains,Name keyring,Cute luggage tags,School bag tag,Diaper bag tag,Retro keychain,Acrylic keychains,Backpack name tag,Lunch box tag,Personalized keyring",United States,2023-05-10,yes,no,no,Yaddiedesignandcraft,https://www.etsy.com/listing/1464788422/backpack-name-tag-diaper-bag-tag-bag
