title,Category,"price(""$"")",7-day sales,total_sales,total_reviews,7-day reviews,total_favorites,7-day favorites,tags,Ship From,release time,Best Seller,Etsy pick,Raving,store name,product_url
"Personalized Magic Witch Hand Tumbler, Custom Fortune Tumbler, Witchcraft Tumbler, Fortune Teller Gift, Moon Sun Tumbler ",Home & Living > Kitchen & Dining > Drink & Barware > Drinkware > Tumblers & Water Glasses,20.0,25,637,117,1,1492,77,"custom tumbler,20oz tumbler,name tumbler,gift for her,halloween,halloween tumbler,halloween gift,gift for halloween,witches brew,witches brew tumbler",United States,2022-10-23,yes,no,no,MadeByDarlings,https://www.etsy.com/listing/1317017338/personalized-magic-witch-hand-tumbler
"Best Friend Gift, Gift For Best Friend, I Wish You Lived Next Door Custom Mug by Mugsberry. ",Home & Living > Kitchen & Dining > Drink & Barware > Drinkware > Mugs,11.98,25,530,121,6,700,94,"2 Best Friends,BFF Gifts,Friendship Gift,Gifts for Friends,Bestie Gifts,personalised Gift,Friend Birthday Gift,Best Friend Gift,Bestie cute Gifts,Long distance Friend,Bestie name Gifts,Unique cute gift,personalized  gift",United States,2023-05-20,yes,no,no,MugsBerry,https://www.etsy.com/listing/1471642614/best-friend-gift-gift-for-best-friend-i
Custom wood name sign | Boho name sign | Girls Name Sign | Above crib sign | Baby shower gift | Daisy wood sign  | Retro Nursery Sign ,Home & Living > Home Decor > Wall Decor > Wall Hangings > Signs,57.0,24,2388,546,5,7315,30,"nursery name sign,baby shower gift,3d letters,home and living,nursery decor,wooden name sign,kids room decor,nursery wall decor,name sign,custom name sign,baby shower,nursery round sign,layered sign",United States,2022-11-05,yes,no,no,HouseOfRounds,https://www.etsy.com/listing/1325759930/custom-wood-name-sign-boho-name-sign
"Personalized My Humans Are Getting Married Mug, Custom Dog Engagement Gift, Custom Pet Engagement Gift, Cat Engagement Gift, Gift for her ",Home & Living > Kitchen & Dining > Drink & Barware > Drinkware > Mugs,12.82,24,198,46,10,116,18,"pet portrait,dog mug,cat mug,dog engagement gift,my humans engaged,engagement present,My Humans Married,Custom Pet Gift,engagement gifts pet,custom mug,cat engagement gift,she said yes,Our humans married",United States,2023-06-13,yes,no,no,DanasimpleLLC,https://www.etsy.com/listing/1502490069/personalized-my-humans-are-getting
Tempered Glass Wall Art-Stained Wall Art -Life of Tree Wall Decor-Glass Printing -Large Wall Art-Wall Hangings-Stained Window Decor ,Home & Living > Home Decor > Wall Decor,77.59,24,192,36,3,2215,89,"Wall art,Wall decor,large Wall art,glass art,Wall hangings,glass Wall art,glass printing,abstract,stained wall art,stained window glass,life of tree decor,tempered glass,art for living room",United States,2023-05-01,yes,no,no,CtrlpStore,https://www.etsy.com/listing/1473065633/tempered-glass-wall-art-stained-wall-art
"Custom neon name sign, name sign, nursery sign, nursery letters, children's decor, nursery decor, instant preview, girls room, boys ",Home & Living > Home Decor > Wall Decor > Wall Hangings > Signs,78.47,24,3081,704,4,4480,0,"home decor,name sign,wood signs,wedding sign,wedding decor,laser cut name,family name sign,wedding backdrop,last name sign,grass wall decor,wedding neon sign,custom neon sign,neon sign",United States,2022-10-11,yes,no,no,HouseOfRounds,https://www.etsy.com/listing/1322481415/custom-neon-name-sign-name-sign-nursery
Engraved Stanley Travel Quencher H2.0 Tumbler  - Stanley Cup - Books Engraved - 40 OZ- Adventure Quencher - Books - Bookworm - BOOKSHELF ,Home & Living > Kitchen & Dining > Drink & Barware > Drinkware > Tumblers & Water Glasses,125.0,24,522,86,1,4335,77,"Engraved Stanley,Tumbler,Book Stanley,Book Tumbler,Library,Engraved Tumbler,Personalized Tumbler,Adventure Quencher,Engraved Cup,Personalized Cup,Teacher Gift,Librarian Gift,Mon Gift",United States,2023-03-02,yes,no,no,TaggedWithLoveStudio,https://www.etsy.com/listing/1429385069/engraved-stanley-travel-quencher-h20
"Personalized Acrylic Night Light | Boho Night LED Light | Kids Bedroom Decor, Custom Name, Boho Nursery Decor, Baby Shower Gift,Holiday Gift ","Home & Living > Lighting > Lamps, Shades & Bases > Lamps > Table Lamps",34.99,24,553,56,2,692,35,"Boho Light,Boho Night Light,LED Lamp Kids,Kids Night Light,LED Sign,Night Light Lamp,LED Light Sign,Custom Light Sign,Custom Night Light,Personalized Lamp,Baby Shower Gift,Holiday Gift,Light Up Sign",United States,2022-10-18,yes,no,no,harperandlo,https://www.etsy.com/listing/1313414732/personalized-acrylic-night-light-boho
"Halloween drip tumbler, custom glitter tumbler, poison witches brew tumbler, black swirl Halloween glitter mug, handle tumbler mug glow ",Home & Living > Kitchen & Dining > Drink & Barware > Drinkware > Tumblers & Water Glasses,31.0,24,126,18,4,1122,94,"glow in the dark,drip tumbler,handle tumbler,Stanley dupe,spooky tumbler,witchs brew tumbler,witches brew,Halloween tumbler,glitter tumbler,epoxy tumbler,glittered tumbler,Monogram tumbler,poison tumbler",United States,2023-05-01,yes,no,no,GlitterBooze,https://www.etsy.com/listing/1458919958/halloween-drip-tumbler-custom-glitter
"Married Ornament, Wedding Gift, Wedding Date ornament, Heart Calendar, Anniversary Gift, Our First Christmas, Newlywed Gift, Engagement Gift ",Home & Living > Home Decor > Ornaments & Accents > Ornaments,9.99,24,100,26,8,294,66,"new married,mr mrs ornament,married ornament,first married,marriage ornament,wedding gift,christmas married,married 2023,christmas 2023,calendar ornament,married calendar,heart ornament,married gift",United States,2023-07-30,yes,no,no,ModernXmas,https://www.etsy.com/listing/1519193408/married-ornament-wedding-gift-wedding
"Custom Pet Name Blanket, Personalized Blanket for Dog, Custom Dog Blanket, Personalized Dog Name Blankets, Personalized Soft Blanket for Pet ",Home & Living > Bedding > Blankets & Throws > Baby Blankets,36.36,24,385,80,6,588,24,"Pet Blankets,custom name blanket,soft name blanket,blanket for dog,dog name blanket,puppy name blanket,name blanket for dog,Pet Supplies,custom dog blanket,personalized blanket,custom pet blanket,custom dog gift,dog bed",United States,2023-04-18,yes,no,no,BwnBwn,https://www.etsy.com/listing/1464118117/custom-pet-name-blanket-personalized
"Nurse Tumbler, Engraved Tumbler, postpartum, nurse week gift, retro nurse, doctor day gift, nurse graduation gift, RN thank you, Mothers Day ",Home & Living > Kitchen & Dining > Drink & Barware > Drinkware,85.0,24,431,74,5,1683,95,"40oz with handle,custom water bottle,mothers day gift cup,engraved mom gift,Nurse Tumbler,nurse week gift,retro nurse,RN thank you,Mothers Day,Engraved Tumbler,postpartum,nurse graduation,doctor day gift",United States,2023-03-17,yes,no,no,PlumeriaAndOak,https://www.etsy.com/listing/1426286484/nurse-tumbler-engraved-tumbler
Classic Pooh First Baby Christmas Ornament - Baby Shower Gift ,Home & Living > Home Decor > Ornaments & Accents > Ornaments,12.49,24,964,193,7,1036,36,"christmas ornament,ornaments,woodland ornament,kids ornament,baby first ornament,Winnie the pooh,Pooh Ornament,Baby 1st ornament,baby shower gift,classic pooh,classic pooh gift,Winnie Pooh keepsake,Pooh keepsake",United States,2022-09-22,yes,no,no,ChristmasOrnamentsVA,https://www.etsy.com/listing/1296176362/classic-pooh-first-baby-christmas
"Girls Trip, Girls Weekend, Girls Trip Tumbler, Custom Tumbler, Acrylic Tumbler 18oz ",Home & Living > Kitchen & Dining > Drink & Barware > Drinkware > Tumblers & Water Glasses,14.99,23,606,94,0,424,2,"skinny tumbler,personalized cup,party tumbler,custom tumbler,matte tumbler,personalized gift,personalized tumbler,girls trip,girls weekend,vacation,girls vacation,girls weekend cup,girls trip cup",United States,2023-01-16,yes,no,no,WeddingsByLeann,https://www.etsy.com/listing/1395051481/girls-trip-girls-weekend-girls-trip
Gift for New Home House Warming Gift Door Hanger Lucky Horseshoe Good Luck gift for Client Good Vibes Gift New Business Opening Horse Shoe ,Home & Living > Home Decor > Wall Decor > Wall Hangings,44.0,23,390,84,3,658,45,"housewarming gift,gift for home,good luck charm,new home gift,first house gift,first home gift,Housewarming,house warming gift,horseshoe door,good vibes gift,horse shoe hanger,gift for client,New Business Opening",United States,2022-11-06,yes,no,no,luxebuffalo,https://www.etsy.com/listing/1340460755/gift-for-new-home-house-warming-gift
"Stacked quote sign, adventure awaits sign, kids bedroom sign, nursery sign, bridal shower sign, wood sign, play room sign, wild ones sign ",Home & Living > Home Decor > Wall Decor > Wall Hangings > Signs,40.0,23,71,40,1,922,35,"cut out sign,cut out words,wood sign,wood letters,house of rounds,where the wild ones,wood playroom sign,playroom decor,playroom wall sign,wild ones play sign,wild things play,where the cool kids",United States,2023-01-19,yes,no,no,TwoAvocadosSigns,https://www.etsy.com/listing/1396782337/stacked-quote-sign-adventure-awaits-sign
Pre K to Graduation School Picture Frame | Grade School Photo Frame | Personalized School Picture frame | School Years Photo Frame ,Home & Living > Home Decor > Picture Frames & Displays > Displays,72.0,23,668,120,4,1880,66,"pre k to graduation,yearbook photo frame,school photos,wallet picture,303woods,photo display,back to school,school picture frame,school pictures,school photo,k 12 photo frame,grade school,kindergarten to grad",United States,2023-01-05,yes,no,no,303Woods,https://www.etsy.com/listing/1372120386/pre-k-to-graduation-school-picture-frame
"Thank You For Helping Me Grow, Thank You Gift Succulent Box, Wood Card, Mentor Professor Teacher Appreciation Gift ",Home & Living > Outdoor & Gardening > Plants > Succulents & Cacti,43.12,22,641,87,0,1008,56,"succulent gift box,personalized gifts,teacher gifts,gifts for teachers,thank you gift ideas,mentor gift,professor gift,appreciation gifts,friendship gift,college tutor gift,plant gifts,therapist gifts,doctor gifts",United States,2023-04-26,yes,no,no,UntieTheBowGifts,https://www.etsy.com/listing/1455058064/thank-you-for-helping-me-grow-thank-you
"Couple Anniversary Gift Custom Engraved Compass, Personalized gift compass , Valentines Day Gift for him,Gift for Dad,Boyfriend Gift for Men ",Home & Living > Home Decor > Decorative Compasses,23.2,22,227,26,3,621,192,"anniversary gift,personalized compass,man gift,gifts for him,gift for men,groomsmen gift,gift for dad,boyfriend gift,Couple Gift,gift for her,husband christmas,valentines day gift,romantic gift couple",United States,2022-12-23,yes,no,no,EliteCustomDesignUSA,https://www.etsy.com/listing/1377723515/couple-anniversary-gift-custom-engraved
"Headband and Bow Holder Shelf Bundle, Cascading 1, 2, 3, or 4 Rod Holder with Lace or Macrame, Girl Nursery Decor,  Baby Shower Gift ",Home & Living > Home Decor > Wall Decor,33.6,22,720,125,3,2986,45,"Headband Organizer,bow holder,hair bow holder,baby girl gift,Bow Holder Shelf,nursery shelf,baby girl,headband holder,bow holder baby girl,nursery decor,macrame,boho nursery decor,baby shower gift",United States,2022-10-26,yes,no,no,MyEllieBeans,https://www.etsy.com/listing/1318812658/headband-and-bow-holder-shelf-bundle
"plant pot box, planter pots, plant bag, basket plant pot, bohemian basket, organizer basket, flower pot, yarn storage, closet basket, PTB160 ",Home & Living > Outdoor & Gardening > Planters & Pots > Indoor Planters,11.1,22,672,174,1,4295,77,"plant pot box,planter pots,plant bag,basket plant pot,bohemian basket,organizer basket,flower pot,yarn storage,closet basket,linen plant pot,washable basket,canvas planter,farbci basket",United States,2022-11-17,yes,no,no,TurkishRugNRoll,https://www.etsy.com/listing/1334835042/plant-pot-box-planter-pots-plant-bag
"ethnic pillow, pink blue pillow, oriental pillow, oushak pillow, lumbar pillow, minimalist pillow, boho pillow cover, retro pillow, PT 40 ",Home & Living > Home Decor > Throw Pillows,7.0,22,539,100,2,1248,35,"pink blue pillow,oriental pillow,oushak pillow,lumbar pillow,boho pillow cover,retro pillow,vintage pillows,pillow sham set,pillow cases organic,18x18 pillow,12x24 pillow case",United States,2022-10-20,yes,no,no,TurkishRugNRoll,https://www.etsy.com/listing/1315286038/ethnic-pillow-pink-blue-pillow-oriental
Personalized Cup For Veterinarian Vet Tech Gift insulated Tumbler Custom Cups Tumbler Skinny Gift for Vet Mug set of 34567 Graduation Gift ,Home & Living > Kitchen & Dining > Drink & Barware > Drinkware > Tumblers & Water Glasses,14.99,22,317,64,10,580,19,"skinny tumbler,personalized cup,vet week,vet tech,vet gift,vet tech gift,vet,veterinary gift,vet tumbler,vet cup,vet tech cup,personalized,vet tech cups",United States,2023-01-16,yes,no,no,WeddingsByLeann,https://www.etsy.com/listing/1380406782/personalized-cup-for-veterinarian-vet
"Personalized Disney Toy Story Velveteen Blanket, Toy Story Blanket, Disney Movies, Custom Blanket with Name, Anniversary Gift C-08022322 ",Home & Living > Bedding > Blankets & Throws,22.99,22,510,102,4,728,25,"Fleece Blanket,personalized blanket,custom blanket,custom baby blanket,baby name blanket,baby blanket,name blanket,Sherpa blanket,custom gift for kids,custom boy name,custom girl name,toy story fan gift",United States,2023-02-18,yes,no,no,EthanCreativeGifts,https://www.etsy.com/listing/1420193349/personalized-disney-toy-story-velveteen
"Nurse Ornament, New Nurse Gift, Graduation Ornament, Nurse Graduation Ornament, RN Gift, BSN Gift, Nursing Graduation Gift, Graduation Gift ",Home & Living > Home Decor > Ornaments & Accents > Ornaments,27.0,22,471,125,1,496,4,"Christmas Gift,christmas ornament,Graduation Ornament,Graduation Gift,graduation ornament,masters ornament,Nurse Ornament,New Nurse Gift,RN Gift,BSN Gift",United States,2022-11-07,yes,no,no,PrettyDesignbyKary,https://www.etsy.com/listing/1341068499/nurse-ornament-new-nurse-gift-graduation
Modern Metal Address Yard Sign - Modern Address Sign - Metal Address House Number Sign With Stakes - MCM | Style A30 ,Home & Living > Home Decor > Wall Decor > Wall Hangings > Signs > Address Signs,41.35,22,112,31,1,199,9,"metal address sign,yard address sign,address sign,house number sign,address yard sign,pinky design,number sign,address numbers,metal address,house numbers,metal number sign,metal address plaque,door number,custom address,custom metal address,home address sign,yard stake sign",United States,2023-03-18,yes,no,no,PinkyDesign,https://www.etsy.com/listing/1441015217/modern-metal-address-yard-sign-modern
Customized Dry Erase Acrylic Calendar for Wall | Personalized Large Calendar for Wall in Home or Office | Family Dry Erase Monthly Calendar ,Home & Living > Office > Dry Erase Boards,54.4,22,179,32,2,980,26,"Whiteboard calendar,memo board,clear calendar,office decor,dry erase calendar,perpetual calendar,family calendar,large wall calendar,acrylic calendar,custom calendar,glass calendar,calendar,monthly calendar",United States,2023-01-31,yes,no,no,circleandsquaredecor,https://www.etsy.com/listing/1392269168/customized-dry-erase-acrylic-calendar
Custom Neon Name sign | Name Sign | Nursery Sign | Nursery Letters | Children's Decor | Nursery Decor | Dorm Decoration | Girls Room | Boys ,Home & Living > Home Decor > Wall Decor > Wall Hangings > Signs,15.0,22,423,125,7,4392,32,"home decor,name sign,wedding sign,wedding decor,family name sign,wedding neon sign,custom neon sign,neon sign,kids name sign,kids neon sign,dorm decoration,custom neon name,Nursery Name Sign",United States,2023-01-28,yes,no,no,JaxleyDesign,https://www.etsy.com/listing/1389975212/custom-neon-name-sign-name-sign-nursery
"40 or 64 Ounce Stanley Tumbler Name Plate, Personalized Name Tag for Stanley Lid, Name for Tumbler Lid, Stanley Cup Accessories, Quencher ",Home & Living > Kitchen & Dining > Drink & Barware > Drinkware > Tumblers & Water Glasses,8.99,22,88,21,4,42,0,"stanley tumbler,stanley name plate,40 ounce tumbler,quencher name plate,stanley cup topper,stanley nameplate,stanley accessories,custom name plate,tumbler lid,personalized stanley,personalized lid tag,65 ounce tumbler,flow state lid",United States,2023-07-23,yes,no,no,ashandaspenhandmade,https://www.etsy.com/listing/1529106235/40-or-64-ounce-stanley-tumbler-name
"KARMIC REVENGE,  Advanced Conjure, VIDEO cast option, taste of their own medicine, not a hex, curse, or black magic but Swift karma, ",Home & Living > Spirituality & Religion > Tarot Readings & Divinations,9.99,22,77,16,2,52,3,"love spell,revenge spell,regret spell,karmic revenge spell,hex spell,destruction spell,ex spell,karmic spell,karma spell,spell,money spell,psychic reading",United States,2023-06-16,yes,no,no,PsychicInsignia,https://www.etsy.com/listing/1504383635/karmic-revenge-advanced-conjure-video
"Personalized Flannel Throw Blankets for Adult Kid, Custom Blanket with Photos Text, Personalized Throws, Housewarming Gift,Mother's day Gift ",Home & Living > Bedding > Blankets & Throws,22.99,22,345,63,11,421,61,"memory gift,Wedding Gift,Memorial Gift,photo on blanket,Anniversary gifts,warm blanket,Birthday gifts,bff gifts,dog blanket,cat blanket,gift for mom,gift for grandmom,father's day gifts",United States,2022-10-17,yes,no,no,PyramidDesignStudio,https://www.etsy.com/listing/1312818586/personalized-flannel-throw-blankets-for
Cute Memory Bear made from a loved ones clothing ,Home & Living > Spirituality & Religion > Cemetery & Funeral > Grave Markers & Decoration,60.0,21,238,51,15,744,32,"Bear stuffie,nursery bear,memory bear,Keepsake bear,memorial gift,bear made from shirt,made from clothes,remembrance bear,baby shower gift,memory teddy,cute teddy bear,cute Memory bear,sunnydaystitches",United States,2023-04-01,yes,no,no,SunnyDayStitchesew,https://www.etsy.com/listing/1437506080/cute-memory-bear-made-from-a-loved-ones
Custom Neon Sign | Neon sign | Wedding Neon Sign | Led Neon Sign | Name Neon Sign | LED neon sign bar | Home & Wall decor sign ,Home & Living > Home Decor > Wall Decor > Wall Hangings > Signs,20.0,21,216,113,17,27,0,"neon sign,Neon sign bedroom,Custom neon sign,Home decor,Wall decor,wedding signs,wedding decorations,wedding favors,Room decor,gift for him,gift for her,personalized gifts",United States,2022-10-27,yes,no,no,ManhattanNeons,https://www.etsy.com/listing/1333898211/custom-neon-sign-neon-sign-wedding-neon
First Day of School Sign Personalized Interchangeable Names Back to school board Reusable White Board Dry Erase Back to School Sign ,Home & Living > Home Decor > Wall Decor > Wall Hangings > Signs,15.0,21,259,195,31,1147,59,"1st day of school,last day of school,school sign,back to school sign,school board,back to school board,milestone board,wood school sign,first day of school,custom school sign,personalized sign,resuable board,school sign reusable",United States,2023-06-22,yes,no,no,TheRainbowBarn,https://www.etsy.com/listing/1494418532/first-day-of-school-sign-personalized
5 ,Home & Living > Furniture > Living Room Furniture > Console Tables & Cabinets > Console & Sofa Tables,90.3,21,632,51,1,11107,241,"narrow console,power console table,skinny sofa table,behind the couch,behind couch table,behind sofa table,behind the sofa,skinny side table,skinny console table,narrow end table,small entryway table,hallway table,wood accent table",United States,2022-12-22,yes,no,no,MittenStateWoodworks,https://www.etsy.com/listing/1376530121/5-inch-deep-powered-sofa-table-behind
"Road Opener Spell | Same Day Results | Powerful Remove All Obstacles | Powerful Opportunities | Clairvoyant Tarot Reading | Get Job, Fortune ",Home & Living > Spirituality & Religion > Psychic Readings,15.82,21,211,31,2,167,3,"road opener,manifest spell,fortune spell,famous spell,remove blockages,achieve goals,money spell,road opener candle,road opener soap,beginner spell kit,transformation spell,remove all obstacles,find fortune",United States,2023-04-24,yes,no,no,BlackRavenMagicka,https://www.etsy.com/listing/1453633210/road-opener-spell-same-day-results
Personalized Christmas Stockings | Leather Patch Name Stockings | Laser Engraved Christmas Stockings ,Home & Living > Home Decor > Ornaments & Accents > Stockings,14.4,21,769,114,0,1648,49,"patch,family,knit,holiday,engraved,name,stocking,mantle,Christmas,faux leather tag,stocking tag,personalized,knit stockings",United States,2022-10-17,yes,no,no,rusticoakdesign,https://www.etsy.com/listing/1312699292/personalized-christmas-stockings-leather
"Personalized whiteboard eraser,  chalkboard eraser with expo marker Teacher Gift, Teacher appreciation gift, personalized Gift ",Home & Living > Office > Office & School Supplies,3.0,21,2471,455,7,1820,15,"Teacher,Eraser,White board,Chalk board,Classroom,Appreciation,Laser engraved,Teacher gift,Board,Engraved Eraser,Teacher eraser,Teacher Appreciation,Personalized Gift",United States,2022-10-05,yes,no,no,SeasideSass,https://www.etsy.com/listing/1319033117/personalized-whiteboard-eraser
"Set of 10 Plastic Shot Glasses Personalized, custom shot glasses bulk, 30th birthday decorations, custom shot glass, 30th birthday favors ",Home & Living > Kitchen & Dining > Drink & Barware > Barware > Shot Glasses,15.5,20,398,110,6,819,22,"photo shot glasses,custom shot glasses,shot glasses bulk,party favors,Plastic Shot Glasses,shot glasses,Personalized,pool party favors,Adult party favors,custom shot glass,dirty thirty,30th birthday,30th birthday decor",United States,2023-01-14,yes,no,no,CarolinaCanCoolers,https://www.etsy.com/listing/1392949109/set-of-10-plastic-shot-glasses
"Retirement Gift, Smells Like It's Not My Problem, Funny Candle, Gift for Her, Gift for Him Teacher Retirement, Gift for Coworker ",Home & Living > Home Decor > Candles & Holders > Candles > Container Candles,11.0,20,2560,634,15,2299,44,"Retirement Party,Man Retirement,Personalized Gift,Retirement Gift,Funny Candle,Gift for Her,Gift for Coworker,Not My Problem,Gift for Him,Teacher Retirement,Happy Retirement,Retired Nurse,Smells Like It's Not",United States,2023-01-18,yes,no,no,WisdomHouseCo,https://www.etsy.com/listing/1395975589/retirement-gift-smells-like-its-not-my
Custom Neon Sign| Neon Sign| Aesthetic Neon Sign| Wedding Neon Signs| Neon Name Signs| LED Neon Lights| Neon Signs| Neon Sign Bar|Home Decor ,Home & Living > Home Decor > Wall Decor > Wall Hangings > Signs,10.0,20,590,49,9,1966,128,"neon sign,neon signs,neon sign custom,personalized neon,handmade neon sign,neon wall sign,neon light sign,custom neon sign,pink neon sign,neon sign bedroom,led neon sign,neon bar sign,home decor",United States,2022-11-16,yes,no,no,DexstylesShop,https://www.etsy.com/listing/1348109213/custom-neon-sign-neon-sign-aesthetic
Personalized First Christmas Engaged - Christmas Engagement Names Ornament 2023 - Mistletoe Ornament ,Home & Living > Home Decor > Ornaments & Accents > Ornaments,9.99,20,5901,1573,9,2982,45,"christmas ornament,first christmas,engaged christmas,wedding gift,first christmas as,engagement,christmas couple,christmas engaged,couple names,engagement gift,mistletoe ornament",United States,2022-10-13,yes,no,no,ModernXmas,https://www.etsy.com/listing/1310382056/personalized-first-christmas-engaged
"Last Name Wood Sign w/ Faux Cowhide and Western Style Text, Cowhide Custom Sign, Rustic Western Wedding Engagement Gift, Western Home Decor ",Home & Living > Home Decor > Wall Decor > Wall Hangings > Signs,85.0,20,336,45,6,1701,70,"Last Name Sign,Wood Last Name Sign,Western Name Sign,Cowhide Name Sign,Cowhide Wedding Sign,Western Wedding Gift,Rustic Wedding Decor,Custom Cowhide Sign,Western Last Name,Cowhide Wedding Gift,Custom Wood Sign,Cowboy Wedding,Cowhide Last Name",United States,2023-04-28,yes,no,no,TheWoodenCanvasCo,https://www.etsy.com/listing/1456480082/last-name-wood-sign-w-faux-cowhide-and
"Personalizable Smells Like Not Your Problem Anymore Funny Gift - Eco-Friendly 100% Soy Candle, 9oz ",Home & Living > Home Decor > Candles & Holders > Candles > Container Candles,24.99,20,1247,327,7,2120,23,"smells like,not your problem,not my problem,gift for coworker,coworker goodbye,funny candle,gag gifts,gifts under 20,promotion congrats,retirement gift,unique soy candles,funny novelty candle",United States,2022-12-13,yes,no,no,BrazenFlames,https://www.etsy.com/listing/1369662505/personalizable-smells-like-not-your
Farmhouse Monogram Throw - Personalized Blanket with Name - Personalized Gift - Corporate Gift - Soft Herringbone Stripe Blanket with Tassel ,Home & Living > Bedding > Blankets & Throws,49.0,20,1148,177,1,534,1,"personalized blanket,corporate gift,monogram blanket,gift for her,Plush throw blanket,cable knit throw,get well gift,bereavement gift,housewarming gift,Cotton Anniversary,blanket with patch,personalized gift,blanket with tassels",United States,2023-02-02,yes,no,no,LLDgiftsByLaurenLash,https://www.etsy.com/listing/1394022676/farmhouse-monogram-throw-personalized
"Teacher Appreciation Gift Teacher Tumbler Glass Cup, End of Year Personalized Iced Coffee Cup, School Student Thank You Gift for Teachers ",Home & Living > Kitchen & Dining > Drink & Barware > Drinkware > Tumblers & Water Glasses,15.99,20,366,77,1,685,64,"teacher coffee glass,Teacher coffee cup,Teacher tumbler,Personalized teacher,Teacher appreciation,Teacher grad gift,End of school gift,Teacher thank you,New teacher gift,customized teacher,ice coffee glasses,iced coffee cup,Custom teacher glass",United States,2023-01-04,yes,no,no,SipSipHoorayDesign,https://www.etsy.com/listing/1371335936/teacher-appreciation-gift-teacher
