title,"price(""$"")",7-day sales,total_sales,total_reviews,7-day reviews,total_favorites,7-day favorites,tags,Ship From,release time,Best Seller,Etsy pick,Raving,store name,product_url
"Halloween Sweatshirt,Halloween Sweater,Ghost Sweatshirt,Halloween Dog Sweatshirt,Ghost Dog Shirt,2023 Happy Halloween,Retro Spooky Season ",13.2,4,173,49,4,1028,24,"Halloween tshirt,Halloween for women,Halloween party,Funny halloween,Halloween gift,Halloween boo,Halloween witches,Halloween Sweatshirt,Long Sleeve,SpookyDoodles Shirt,Halloween shirt",United States,2023-07-04,yes,no,no,CustomTeaShirt,https://www.etsy.com/listing/1516322649/halloween-sweatshirthalloween
"Baby Shower Gift, Protected By Dog Onesie®, Custom Dog Breed Onesie®, Personalized Protected By Pets Onesie®, Pet Onesie®, Retro Onesie® ",16.98,4,519,46,0,165,10,"personalized baby,Bella Canvas,baby shower gift,protected by dog,dog parent baby,protected by pets,retro baby shower",United States,2023-04-19,yes,no,no,frankybstudio,https://www.etsy.com/listing/1450141934/baby-shower-gift-protected-by-dog-onesie
"Disney Cruise Family Vacation 2023 Shirt,Disney Cruise Group Shirt,Custom 2023 Disney Shirt,Disney Pirate Shirt,Family Matching Cruise Shirt ",7.99,4,148,23,0,133,18,"family cruise shirt,disneyland shirt,cruise shirts",United States,2023-03-26,yes,no,no,SofTeeCustom,https://www.etsy.com/listing/1433006772/disney-cruise-family-vacation-2023
"Kids Summer Shirt - Happy Camper Kids Retro TShirt - Summer Retro Natural Infant, Toddler, Youth & Adult Tee #5675-C ",9.99,4,73,28,5,186,4,"retro boho,trendy,toddler shirt,kids shirt,natural shirt,natural tee,toddler tshirt,girls boys kids,graphic tees,toddler gifts,summer adventure,color choice,happy camper",United States,2023-05-09,yes,no,no,DoubleJoyDesigns,https://www.etsy.com/listing/1463958844/kids-summer-shirt-happy-camper-kids
"From Fur Mama To Baby Mama, Pregnant Sweatshirt, Gift for Expecting Mom, To Human Mama, New Mom Gifts, Baby Announcement, Pregnancy Reveal ",23.78,4,481,89,3,821,4,"Pregnant Sweatshirt,To Human Mama,New Mom Gifts,Baby Announcement,Pregnancy Reveal,From Fur Mama To,Baby Mama sweatshirt,expecting mom gift,Fur mom to human mom,Pregnant mom sweater,mom to be sweatshirt,baby reveal gifts,preggers sweatshirt",United States,2023-03-30,yes,no,no,FamilyPrintClothing,https://www.etsy.com/listing/1449975957/from-fur-mama-to-baby-mama-pregnant
Custom Face Swimsuit Personalized Women's Bathing Suit with Photo Bikini Set Swimwear Anniversary Birthday Bachelorette Party Gift ,8.99,4,456,82,7,123,0,"custom swimsuit,custom bathing suit,custom face swimsuit,face bathing suit,swimsuit with face,custom swimwear,photo swimsuit,face swimsuit,custom face bikini,face swimwear,bachelorette party,face on swimwear,face print swimsuit",United States,2023-05-09,yes,no,no,FunnyCustomGift,https://www.etsy.com/listing/1478463865/custom-face-swimsuit-personalized-womens
"Minnie and Mickey Shirt, Disneyworld Shirts, Animal shirt, Minnie Ear Shirt , Leopard cheetah print Shirt, Disney Shirt , Disney Ear Shirt ",7.0,4,147,18,1,232,7,"Women Shirt,custom tshirt,Christmas Tees,Holiday t-shirt,Christmas Tree,Family Vacation,Disneyworld Shirt,Minnie T-Shirt",United States,2023-03-23,yes,no,no,HappyCustomTshirts,https://www.etsy.com/listing/1430691214/minnie-and-mickey-shirt-disneyworld
Girls Comfort Colors® T-Shirt - 'In My Big Sister Era' Back Print - Personalized Front Pocket Print with Trendy Skeleton Peace Sign and Name ,21.83,4,86,21,0,335,7,"Girls t-shirt,Comfort Colors®,Big sister shirt,Gift for big sister,Personalized shirt,Customizable t-shirt,Trendy kids fashion,Proud big sister,Big sister reveal,Big sister outfit,Stylish girls shirt",United States,2023-06-01,yes,no,no,SweetTeezLLC,https://www.etsy.com/listing/1479876676/girls-comfort-colors-t-shirt-in-my-big
"Two Infinity and Beyond Shirt, Toy Story Birthday Shirt, Woody Birthday Shirt, Buzz Birthday Shirt, To Infinity and Beyond ",16.98,4,266,44,2,177,9,"toy story,toy story birthday,buzz birthday,woody birthday,reach 4 the sky,two infinity,2 infinity,buzz shirt,woody to infinity,buzz to infinity,birthday buzz,birthday woody,2 inf and beyond",United States,2023-04-22,yes,no,no,BirthdayyBasicss,https://www.etsy.com/listing/1452215418/two-infinity-and-beyond-shirt-toy-story
Custom Pink Shirt ,9.99,4,221,54,1,67,2,"Pink Shirt,Singer,Artist,2023 Shirt,Custom Pink Shirt,pink beautiful",United States,2023-06-16,yes,no,no,tovartshirts,https://www.etsy.com/listing/1490784758/custom-pink-shirt
"Custom Football Sister Shirt, Little Kid Sister Football, Big Brother Football Shirt, Toddler Girl Football Sibling Tee, Football Sis Shirt ",24.74,4,109,15,3,167,7,"little sister shirt,kid football shirt,football sister,sister football tee,football sis shirt,brother football,girl football shirt,football number,toddler football,custom football gift,football sibling tee,custom football name,kid football tee",United States,2023-07-02,yes,no,no,SymbolicImports,https://www.etsy.com/listing/1515330829/custom-football-sister-shirt-little-kid
"Frozen Birthday Shirt , Elsa Birthday Shirts, Frozen Custom Shirt , Frozen Personalized Tee, Ages 1 - 6 ",7.2,4,315,50,3,211,10,"Elsa shirt,birthday shirt,elsa birthday shirt,frozen shirt,frozen birthday,custom frozen,2nd birthday,4th birthday,frozen custom shirt,frozen personalized",United States,2023-04-05,yes,no,no,ArieDesignStudio,https://www.etsy.com/listing/1440256198/frozen-birthday-shirt-elsa-birthday
"Dear Person Behind Me, You are Enough Tshirt for Friends and Family, Kindness Shirt, Mental Health Matters Shirt, To the Person Behind Me ",7.99,4,28,18,1,79,2,"Kindness Shirt,Dear Person Behind,You are Enough,Mental Health Matter,To the Person Behind,Person Behind Me,You matter shirt,inspirational tee,cute gift for friend,wife birthday,mental health gift,awareness gift,gift for wife",United States,2023-06-10,yes,no,no,OJEYAPPAREL,https://www.etsy.com/listing/1486095708/dear-person-behind-me-you-are-enough
"In My Pregnant Era Shirt, Pregnancy Comfort Colors Shirt, Gift for New Mom T-Shirt, Retro Concert Tee, Vintage Pregnant Women Tee ",14.99,4,52,12,0,684,102,"Comfort Colors,Oversized Comfort,Mom to Be,Gift for Mom,Pregnancy Tee,Announcement Gift,Maternity t-shirt,Gender Reveal,Gender Party Tee,Cute mama shirt,new mama gift,In My Pregnancy",United States,2023-06-08,yes,no,no,EarthCustom,https://www.etsy.com/listing/1498676687/in-my-pregnant-era-shirt-pregnancy
"Wizardry Houses Shirt, Harry Potter T-Shirt, Wizard School Shirt, Bookish Shirt, Sorting Hat Shirt, Potterhead Gift, Wizarding World ",9.73,4,807,73,0,343,9,"Potterhead Shirt,Funny HP Shirt,Wizard School Shirt,Bookish Shirt,Wizarding World,Potterhead Gift,Potterhead T-Shirt",United States,2023-03-23,yes,no,no,TheCustomoon,https://www.etsy.com/listing/1444818059/wizardry-houses-shirt-harry-potter-t
"Disney Cruise Shirts, Disney Cruise, Disney matching shirts, Disney Cruise custom matching shirts, Disney Cruise tees with custom name ",8.99,4,273,39,0,134,8,"Cruise Shirt,Mickey Cruise Shirt,Cruise Travel Shirt,Cruise Family Shirt,Custom Cruise Shirt,Family Travel Shirt,Cruise Tank top,Women Cruise Shirt,Cruise Squad Tee",United States,2023-04-13,yes,no,no,MakCustomShirt,https://www.etsy.com/listing/1460036093/disney-cruise-shirts-disney-cruise
Construction Birthday Shirt | Boys Birthday Shirt | I'm Two And Digging It Birthday Shirt | 2nd Birthday Shirt | Dump Truck Birthday ,11.99,4,49,15,0,89,9,"kids birthday,Toddler Shirt,Construction,dig it,dump truck,boys birthday shirt,kids birthday shirt,birthday shirt,excavator birthday,digging it birthday,truck,2ND bIRTHDAY,SECOND BIRTHDAY",United States,2023-06-11,yes,no,no,MadiMooshBoutique,https://www.etsy.com/listing/1500950455/construction-birthday-shirt-boys
"Mama girl shirt,Girl's mama shirt,Mommy and Me Shirts, Retro Mamas Girl Shirts, Matching Mom and Daughter Shirts, Girl Mama Shirt ",12.59,3,226,31,0,280,7,"retro boho shirt,natural shirt,neutral shirt,announcement,mamas girl shirt,mommy and me shirts,mommy and me outfit,mom and daughter tee,mother daughter tee,matching daughter,gender reveal shirt,girl mama shirt,baby shower gift",United States,2023-04-29,yes,no,no,ForeverBDesign,https://www.etsy.com/listing/1471573405/mama-girl-shirtgirls-mama-shirtmommy-and
"Custom Lake Crew Shirt for Kids, Personalized Camping T-Shirt, Toddler Natural Graphic Tee (LAKE CREW) ",10.79,3,73,29,0,57,1,"Natural Shirt,Cute Kid Clothes,Toddler Shirt,Shirts for Kids,Lake Crew,Camping Shirt,Cousin Crew,Personalized Shirt,Custom Name Shirt,Summer Vacation,Outdoor Adventure,Cute Camp Shirt",United States,2023-05-24,yes,no,no,LittleSpunkies,https://www.etsy.com/listing/1488666313/custom-lake-crew-shirt-for-kids
"Funny German Shepherd Dog Shirt,Funny Dog Shirt,Sarcastic German Shepherd Gift,German Shepherd Mom Shirt,Dog Lovers Tee,German Shepherd Dad ",11.9,3,174,25,2,181,8,"dog lover gift,dog lover shirt,dog mom shirt,dog dad shirt,dog owner gifts,german shepherd gift,german shepherd tees,veterinary shirt,gift for pet owner,custom dog shirt,funny dog clothing,sarcastic shepherd",United States,2023-05-11,yes,no,no,BlueberriesUS,https://www.etsy.com/listing/1465720278/funny-german-shepherd-dog-shirtfunny-dog
Fashion doll tutu outfit-hot pink tutu outfit ,21.99,3,136,29,5,124,11,"Tutu,birthday,Barbie,pink,preppy",United States,2023-05-28,yes,no,no,DsBoutique1126,https://www.etsy.com/listing/1476989986/fashion-doll-tutu-outfit-hot-pink-tutu
"Personalized Teacher Name Shirt, Customized Kindergarten Dream Team Teacher T-Shirt, Custom Kindergarten Teacher, Teacher Appreciation Gift ",13.6,3,21,31,7,173,6,"Cute Teacher Shirts,Gift for Teacher,best teacher shirt,Custom Teacher Name,First Day of School,Custom Teacher Shirt,Kindergarten Teacher,Teacher Appreciation,Teacher Name Shirt,Customized Teacher,personalized teacher,dream team teacher,back to school",United States,2023-07-27,yes,no,no,SummerBreezeTee,https://www.etsy.com/listing/1531895143/personalized-teacher-name-shirt
"Hello First Grade Shirt, Back To School Shirt, Hello First Grade Rainbow Shirt, First Grade Shirt, First Grade Teacher Shirt,1st Grade Shirt ",5.94,3,279,36,4,104,0,"kindergarten shirt,1st grade shirt,pre-k shirt,preschool shirt,2nd grade shirt,3rd grade shirt,kindergarten teacher,teacher shirt,back to school shirt,hello 1st grade,hello kindergarten,1st grade teacher,back to school kids",United States,2023-06-01,yes,no,no,ARKTeeshirt,https://www.etsy.com/listing/1493784969/hello-first-grade-shirt-back-to-school
"Custom Embroidered Sweatshirt, Custom Embroidered Varsity Crewneck, Embroidery Crewneck, Personalized Sweatshirt, Embroidered Sweatshirt ",34.95,3,68,11,3,213,24,"custom sweatshirt,custom crewneck,gift for wife,Mrs Sweatshirt,Personalized Gift,mother's day gift,father's day gift,Christmas gift,husband gift,wife gift,mom gift,bride gift,varsity sweatshirt,bridesmaid gift",United States,2023-05-27,yes,no,no,FortonPrints,https://www.etsy.com/listing/1476683764/custom-embroidered-sweatshirt-custom
Custom Embroidered Unisex Comfort Colors Tee ,22.94,3,108,21,0,144,14,"honeymoon shirt,sarcastic shirt,custom embroidered,personalized sweater,custom comfort color,custom tee,custom t-shirt,customizable shirt,embroidered crewneck,embroidered shirt,aesthetic shirt,comfort colors tee,tumblr tees",United States,2023-05-14,yes,no,no,totallyicedout,https://www.etsy.com/listing/1481716445/custom-embroidered-unisex-comfort-colors
"I'm Here For The Snacks, Disney Trip Shirts, Family Shirt, Disney Food Beer Shirts, Disneyland Shirts, Disneyworld Vacation T-shirt, Girls ",8.99,3,189,29,5,83,7,"Disneyworld Shirt,Family Matching Tee,Epcot Shirt,Here for the snacks,Girls Trip shirt,youth girl tee",United States,2023-06-05,yes,no,no,JoyfulDesignShirts,https://www.etsy.com/listing/1496856757/im-here-for-the-snacks-disney-trip
"COVERALLS, DICKIE Coveralls, KIDS Jumpsuit, Modern Unique Stylish Eye-Catching Beautiful Design Short Sleeves Coveralls For Kids ",75.0,3,65,18,1,169,14,"Dickies,Shortalls,Skirtalls,Dickie",United States,2023-04-29,yes,no,no,TTbyStationeryStacy,https://www.etsy.com/listing/1471223019/coveralls-dickie-coveralls-kids-jumpsuit
"Custom Design Shirt, Custom Text Shirt, Personalized Shirt, Custom T-shirt, Custom Logo Shirts, Customizable Shirt, Custom Unisex Shirts ",7.32,3,417,80,4,91,0,"Custom Design Shirt,Custom Text Shirt,Personalized Shirt,Custom T-shirt,Custom Logo Shirts,Customizable Shirt,custom logo shirt,personalized logo,custom tee,custom logo tshirt,small business shirt,personalized mom,Custom Unisex Shirts",United States,2023-03-20,yes,no,no,SweeTeeShirt,https://www.etsy.com/listing/1442384117/custom-design-shirt-custom-text-shirt
Customize Bling Butterfly Thong ,18.75,3,174,23,2,217,12,"mothers day,pink,customize,gifts for her,gifts for him,birthday gifts,bridal shower,lingerie,thong,surprise gift",United States,2023-04-22,yes,no,no,PrettyGirlcraftStore,https://www.etsy.com/listing/1466411291/customize-bling-butterfly-thong
"Custom Teacher Shirts Custom School Shirt Teacher Team Shirts, Custom School Spirit Tee Personalized Elementary Tee Custom Teacher Name Gift ",15.99,3,205,68,6,723,33,"custom school shirt,custom teacher shirt,teacher tshirt,teacher team shirts,school spirit shirts,personalized teacher,custom school name,elementary school,custom teacher gift,gift for new teacher,school spirit week,custom teacher gifts,teacher pod",United States,2023-04-16,yes,no,no,ExpressiveHQ,https://www.etsy.com/listing/1462177523/custom-teacher-shirts-custom-school
Personalized In My Teacher Era Shirt Back To School Shirt Teacher Gift Funny Teacher Tee Custom Name Teacher Comfort Colors® ,7.64,3,200,59,16,510,2,"In My Teacher Era,Gift For Teacher,Teacher Era Shirt,Teacher Appreciation,Teacher Life Shirt,Teacher Sweatshirt,Teacher Gift Shirt,Custom Teacher Shirt,Funny Teacher Shirt,Retro Teacher Shirt,Teacher Tshirt,Best Teacher Shirt,Back To School Shirt",United States,2023-07-15,yes,no,no,HoneyandBlithe,https://www.etsy.com/listing/1523565189/personalized-in-my-teacher-era-shirt
"Custom Football Mom Shirt, Football Mama Shirt, Football Mom Tee, Game day shirt football season, Sport Mom Tee, personalized jersey number ",29.24,3,91,19,3,276,5,"football game shirt,football mom shirt,football mama shirt,football mom,mom football tee,custom football tee,football game day,football mom gift,football season,personalized jersey,mom game day shirt,football number,football team shirt",United States,2023-07-02,yes,no,no,SymbolicImports,https://www.etsy.com/listing/1515327417/custom-football-mom-shirt-football-mama
"Personalized Volleyball Shirt, Custom Volleyball Shirt, Christmas Shirt, Volleyball Mom Shirt, Team Spirit Tee, Player Number and Name Shirt ",7.6,3,244,47,17,119,22,"personalized shirt,volleyball mom shirt,volleyball shirt,player number,team spirit shirt,volleyball team tee,custom player shirt,personalized t shirt,school volleyball,Christmas Shirt,custom team spirit,personalized player,custom player tee",United States,2023-03-31,yes,no,no,EllaTeeClothing,https://www.etsy.com/listing/1437239106/personalized-volleyball-shirt-custom
"Wildflowers SPED Teacher Shirt, Special Education Teacher Shirts, See The Able Not The Label, SPED Teacher Gifts for Women, Special Ed Tee ",14.39,3,164,23,2,253,2,"wildflowers,SPED teacher shirt,special education,teacher shirts,see the able,SPED teacher gifts,for women,special ed shirt,SPED teacher gift,autism awareness,autism shirts,back to school tees,not the label",United States,2023-03-21,yes,no,no,YugAndLila,https://www.etsy.com/listing/1443779137/wildflowers-sped-teacher-shirt-special
Camp Bach Bachelorette Party Happy Camper T Shirt with Custom Bride Design for Lake or Summer Camp Theme Party ,26.5,3,301,38,0,398,14,"bachelorette party,summer camp,camp bachelorette,lake tahoe party,mountain theme party,bachelorette shirts,bridal party shirts,destination t shirts,summer camp party,happy camper t shirt,t shirt,custom bachelorette,personalized t shirt",United States,2023-03-23,yes,no,no,girlsnightoutlet,https://www.etsy.com/listing/1445027321/camp-bach-bachelorette-party-happy
"Custom Stitch Birthday Girl Shirt, Family Stitch Birthday Party Shirt, Stitch Birthday Shirt, Personalized Stitch Birthday Shirt ",8.99,3,225,26,2,144,5,"stitch birthday,birthday girl shirt,stitch girl shirt,stitch shirt,custom shirt,stitch gifts,birthday girl gift,toddler gift,birthday girl,girl birthday shirt,gift birthday girl,family birthday",United States,2023-05-15,yes,no,no,NiftyTeeCrafts,https://www.etsy.com/listing/1468097420/custom-stitch-birthday-girl-shirt-family
"Leveled Up To First Grade Shirt, Mario First Grade Shirt, First Grade Shirt, Mario School Shirt, 1st Grade Kids Shirt, Back To School Shirt ",5.94,3,173,28,4,58,0,"kindergarten shirt,1st grade shirt,pre-k shirt,preschool shirt,2nd grade shirt,3rd grade shirt,kindergarten teacher,teacher shirt,back to school shirt,hello 1st grade,hello kindergarten,1st grade teacher,back to school kids",United States,2023-07-21,yes,no,no,ARKTeeshirt,https://www.etsy.com/listing/1513580418/leveled-up-to-first-grade-shirt-mario
"Custom Embroidered Car Hoodie, Car Photo Embroidered, Custom Car Hoodie, Classic Cars Embroidered, Anniversary Gifts For Men, Car Lover Gift ",31.62,3,184,16,1,259,42,"car embroidered,custom car,embroidered sweater,embroidered hoodie,custom portrait,gift for him,gift for dad,car lover gift,gift for car lovers,classic cars,anniversary gift,gift for husband,initial on sleeves",United States,2023-05-20,yes,no,no,Ruodinshop,https://www.etsy.com/listing/1486182105/custom-embroidered-car-hoodie-car-photo
"Disney Cruise Shirt, Disney Let's Cruise Shirt, Custom Disney Cruise Shirt, Disney Squad Shirt, Custom Family Disney Cruise Shirt ",8.99,3,522,47,3,178,3,"cruise shirt,custom shirt,cruise outfit,family shirt,let's cruise shirt",United States,2023-04-08,yes,no,no,NiftyTeeCrafts,https://www.etsy.com/listing/1442655256/disney-cruise-shirt-disney-lets-cruise
"Mickie and Minnie Custom Disney Family shirts, Disney Vacation shirts, Disney Family shirts, Disney Tee,Disneyland shirt, Disneyworld shirts ",6.0,3,254,38,1,235,5,"Clothing,Gender-Neutral Adult Clothing,Tops & Tees,T-shirts,Graphic Tees",United States,2023-04-01,yes,no,no,FamilyTeeShopUS,https://www.etsy.com/listing/1451789523/mickie-and-minnie-custom-disney-family
Mamasaurus & Dadosaur Shirts • Mama Dinosaur Birthday Party Tshirt • Dad Dino Bday Tee • Matching Family Birthday Shirts • Mom and Dad Tee ,25.35,3,127,22,3,56,0,"Mamasaurus Shirt,Mama Dinosaur,Birthday Party Tee,Dino Birthday Party,Mom and Dad Shirts,Unisex Crewneck Tee,Dadasaurus Shirts,Family Dino Shirts,Dadosaur Tshirt,Dad Dino Bday Tee,Matching Family Tee,Womens and Mens",United States,2023-05-24,yes,no,no,LetsGrowBoutique,https://www.etsy.com/listing/1489096399/mamasaurus-dadosaur-shirts-mama-dinosaur
"Custom Logo Design, Company Logo, Team Logo, Personalized Logo T Shirt, Your Logo Here, Your Text Here, Create Your Graphic Logo, Add Text ",9.78,3,41,149,19,233,8,"Custom Logo Design,Company Logo,Team Logo,Your Logo Here,Your Text Here,company shirt,business logo shirt,design your logo,custom text t shirt,brand logo shirt,custom school spirit,custom logo shirt,personalized t shirt",United States,2023-07-07,yes,no,no,OJEYAPPAREL,https://www.etsy.com/listing/1518168399/custom-logo-design-company-logo-team
"Disney Princess Castle Shirt, Disney Vacation Shirt, Disney Watercolor Tee, Disney Girls Trip, Disney Castle ",10.19,3,101,14,2,180,27,"Disneyland Shirt,Princess Shirt,princess castle,Magic Kingdom Shirt,Ariel Princess Shirt",United States,2023-04-23,yes,no,no,SomethingByUs,https://www.etsy.com/listing/1467185555/disney-princess-castle-shirt-disney
"This Is The Way Shirt, Mandalorian Shirt, Disney Shirt, Galaxy Edge Shirt, Disneyland Shirt, Men Shirts, Women Shirts, Gift for Daddy, ",12.99,3,513,50,1,256,6,"This Is The Way,boba fett shirt",United States,2023-04-26,yes,no,no,GlitterArtGift,https://www.etsy.com/listing/1455027930/this-is-the-way-shirt-mandalorian-shirt
"Personalized Custom Logo T-shirt, Customize Your Own Shirt, Custom Tshirt Front and Back , Custom Company Logo, Custom Text Shirt Printing ",6.49,3,221,41,25,75,20,"custom shirt,custom tshirt,personalized shirt,custom text shirt,Logo Design Shirt,Custom Logo Tshirt,custom tee,custom matching,your logo shirt,personalized text,Make Your Own Shirt,create your shirt,custom company shirt",United States,2023-07-15,yes,no,no,TeecartShop,https://www.etsy.com/listing/1509130810/personalized-custom-logo-t-shirt
"Custom Wizard Birthday Squad Shirts, Magic Birthday Shirt, Personalized Birthday Shirts, Potterhead Birthday, Birthday Girl and Boy Shirts ",12.0,3,136,18,2,102,0,"Family matching Tees,Custom Birthday Tee,Potterhead Birthday,Birthday Squad Tee,Magic Birthday Shirt,Birthday Group Shirt,Wizard T-shirts,birthday girl shirt,birthday boy shirt,birthday crew shirt,Custom Wizard Shirts,harry birthday shirt,birthday group tee",United States,2023-04-25,yes,no,no,CustomThingsGift,https://www.etsy.com/listing/1468726965/custom-wizard-birthday-squad-shirts
Customized Super Ma.rio characters vintage matching family shirt ,16.0,3,251,36,2,750,6,"mario,super mario bros,mario shirt,super mario shirt,mario dad shirt",United States,2023-04-12,yes,no,no,RidiculousBiscuit,https://www.etsy.com/listing/1445372436/customized-super-mario-characters
"Lavender in my mom era shirt, Embroidered Mom Era Shirt, Comfort Colors Tee ",29.99,3,261,59,4,143,0,"mama tee,mama shirt,gift for mom,shirt for mom,embroidered tee,Personalized Tee,comfort colors,mama tshirt,gift for her,gift for friend,in my mom era,mom era tee,swift concert shirt",United States,2023-05-15,yes,no,no,MadeForMamaShirtShop,https://www.etsy.com/listing/1482258761/lavender-in-my-mom-era-shirt-embroidered
"Mañana Será Bonito Shirt/Hoodie/Sweatshirt, Karol G Shirt, Funny KaroL G Gift, Manana Sera Bonito Album Shirt, Cute College Graduation ",10.99,3,150,23,6,141,28,"Karol G,Bichota Design,Karol G Merch,Mañana Será Bonito,Music Merchandise,Concert Wear,Bichota Shirt,gift for him,gift for her,funny gift,Trending Shirt,Latin Pop",United States,2023-05-26,yes,no,no,CustomDaintyDesign,https://www.etsy.com/listing/1475704836/manana-sera-bonito-shirthoodiesweatshirt
"First down birthday party, First year down shirt or bodysuit, 1st year down birthday, Football first birthday, 1st down birthday, Boy theme ",16.89,3,111,15,3,183,12,"1st birthday boy,first birthday boy,boys first birthday,boy birthday outfit,first birthday shirt,birthday shirt,personalized shirt,football birthday,first year down,black shirt,First down,birthday party,1st year down",United States,2023-04-26,yes,no,no,SKKDesignbaby,https://www.etsy.com/listing/1469351807/first-down-birthday-party-first-year
"Super Mario Shirt, Super Mario Birthday Shirt, Super Mario Family Shirt, Super Mario & Friends Party Matching Shirt, Friend Gift Tshirts ",10.6,3,220,47,3,184,8,"Mario Family Shirt,Mario Shirt,Family Birthday,Mario Game Gaming,Mario Group Shirt,Birthday Group Shirt,Super Mario Shirt,Princess Peach,Super Mario,Bowser Shirt,Luigi Shirt,Yoshi Shirt,Personalized Mario",United States,2023-07-02,yes,no,no,CartoonShirt,https://www.etsy.com/listing/1515066937/super-mario-shirt-super-mario-birthday
"Birthday Girl Shirt, Birthday Party Tshirt, Girl birthday Shirt, Personalized Birthday Tshirt, Family Birthday Tshirt, No Glitter ",16.8,3,296,64,3,154,4,"Birthday Crew Shirt,Birthday Gift Tee,Custom Tshirt,Girl Birthday Shirt,Birthday Girl Shirt,No Glitter,Girl birthday,Family Birthday,family birthday tee,custom birthday tee,come on baby shirt",United States,2023-03-22,yes,no,no,GreenOasisShirt,https://www.etsy.com/listing/1444096633/birthday-girl-shirt-birthday-party
"good things take time hoodie, i hope you know how loved you are hoodie | Trendy college shirt | comfort colors shirts | trendy crewnecks ",27.0,3,186,20,0,540,7,"COMFORT COLORS,BEACH OUTFIT,BEACH T-SHIRT,school shirts,trendy shirts,college tees,summer shirts,comfortable shirts,state shirt,summer tees,oversized tee,sunkissed,summer clothing",United States,2023-04-05,yes,no,no,CCApparelTX,https://www.etsy.com/listing/1454526059/good-things-take-time-hoodie-i-hope-you
2nd Wedding Anniversary Gift For Him / Gift for Couple / 2nd Anniversary Shirt Gift For Her / Gift For Husband And Wife / Cotton Anniversary ,23.0,3,54,18,2,58,2,"gift for him,gift for husband,gift for wife,gifts for couple,best husband since,2nd anniversary gift,cotton anniversary,2 year anniversary,second anniversary,2021 anniversary,2021 wedding,since 2021,epic since 2021",United States,2023-05-29,yes,no,no,WildMerchUp,https://www.etsy.com/listing/1478081610/2nd-wedding-anniversary-gift-for-him
"Disney Pirate Cruise Shirt, Minnie Mickey Pirate Shirts, Disney Pirate Shirt, Minnie Pirate Shirt, Mickey Pirate Shirt, Disney 2023 Pirate ",9.99,3,186,22,1,176,12,"Pirate Minnie Mouse,Pirate Mickey Mouse,Mickey Pirate shirt,Minnie Pirate Shirt,Pirates of Caribbean,Family cruise shirt,Pirate shirt,Custom pirates shirt",United States,2023-04-29,yes,no,no,mtnapparel,https://www.etsy.com/listing/1471567331/disney-pirate-cruise-shirt-minnie-mickey
"Custom College Apparel Lettuce Trim Lounge Shorts, Dorm Wear, Bed Party Gift, Commitment, Game Day, Tailgate, Dorm ",22.0,3,241,32,0,395,8,"bed party,bed party gift,commitment gift,college gift,college Merch,handmade by d,handmadebyd,gameday apparel,trendy college,tailgate apparel,custom college,college apparel,college shorts",United States,2023-04-01,yes,no,no,HandmadeByDShop,https://www.etsy.com/listing/1451618455/custom-college-apparel-lettuce-trim
